URL,MobileURL,Date,Title
"https://www.diariovasco.com/sociedad/salud/policia-reparte-marcarillas-20200128133646-ntrc.html","https://www.diariovasco.com/sociedad/salud/policia-reparte-marcarillas-20200128133646-ntrc_amp.html","2020-01-28 14:45:00","La Policía Nacional reparte marcarillas a los agentes en los aeropuertos ante el coronavirus"
"https://www.nur.kz/1838171-ne-nado-massovo-skupat-maski-i-lekarstva-almatincev-prosat-ne-panikovat-iz-za-koronavirusa.html","https://www.nur.kz/amp/1838171-ne-nado-massovo-skupat-maski-i-lekarstva-almatincev-prosat-ne-panikovat-iz-za-koronavirusa.html","2020-01-28 06:45:00","  Не надо массово скупать маски и лекарства : алматинцев просят не паниковать из - за коронавируса - новости Казахстана"
"https://vitals.lifehacker.com/can-a-surgical-mask-protect-you-from-coronavirus-1841311686","https://vitals.lifehacker.com/can-a-surgical-mask-protect-you-from-coronavirus-1841311686/amp","2020-01-28 21:30:00","Can a Surgical Mask Protect You From Coronavirus ? "
"https://www.msn.com/en-us/news/technology/coronavirus-deaths-climb-over-100-hong-kong-limits-travel-everything-we-know/ar-BBZoGu5","","2020-01-28 11:15:00","Coronavirus deaths climb over 100 , Hong Kong limits travel : Everything we know"
"https://www.msn.com/en-us/news/technology/coronavirus-cases-approach-3000-death-toll-jumps-above-80-everything-we-know/ar-BBZnOOq","","2020-01-28 00:00:00","Coronavirus cases approach 3 , 000 , death toll jumps above 80 : Everything we know"
"https://www.msn.com/en-us/news/technology/coronavirus-deaths-hit-106-first-case-in-germany-everything-we-know/ar-BBZo2Ps","","2020-01-28 02:30:00","Coronavirus deaths hit 106 , first case in Germany : Everything we know"
"https://www.diariosur.es/sociedad/salud/policia-reparte-marcarillas-20200128133646-ntrc.html","https://www.diariosur.es/sociedad/salud/policia-reparte-marcarillas-20200128133646-ntrc_amp.html","2020-01-28 20:45:00","La Policía Nacional reparte mascarillas a los agentes en los aeropuertos ante el coronavirus"
"https://www.journaldemontreal.com/2020/01/28/coronavirus-le-masque-un-reflexe-de-protection-pas-forcement-efficace","","2020-01-28 13:15:00","Coronavirus : le masque , un réflexe de protection pas forcément efficace"
"https://www.reuters.com/article/us-china-health-toll-hubei/chinas-hubei-province-says-100-dead-2714-total-cases-in-virus-outbreak-idUSKBN1ZR03W","https://mobile.reuters.com/article/amp/idUSKBN1ZR03W","2020-01-28 01:45:00","China Hubei province says 100 dead , 2 , 714 total cases in virus outbreak"
"https://in.reuters.com/article/us-china-health-toll-hubei/chinas-hubei-province-says-100-dead-2714-total-cases-in-virus-outbreak-idINKBN1ZR03W","https://in.mobile.reuters.com/article/amp/idINKBN1ZR03W","2020-01-28 03:45:00","China Hubei province says 100 dead , 2 , 714 total cases in virus outbreak"
"https://uk.reuters.com/article/us-china-health-toll-hubei/chinas-hubei-province-says-100-dead-2714-total-cases-in-virus-outbreak-idUKKBN1ZR03W","https://uk.mobile.reuters.com/article/amp/idUKKBN1ZR03W","2020-01-28 04:00:00","China Hubei province says 100 dead , 2 , 714 total cases in virus outbreak"
"https://www.thestar.com.my/news/nation/2020/01/28/show-your-colours-only-one-way-to-wear-surgical-masks-correctly-with-the-coloured-side-out","","2020-01-28 06:30:00","Show your colours : Only one way to wear surgical masks correctly , with the coloured side out"
"https://www.witn.com/content/news/Vidant-doctors-recommend-precautions-with-coronavirus-and-travel--567343081.html","","2020-01-28 05:45:00","Vidant doctors recommend precautions with coronavirus and travel"
"https://www.ladepeche.fr/2020/01/28/coronavirus-a-toulouse-les-masques-sont-en-rupture-de-stock,8692009.php","https://www.ladepeche.fr/amp/2020/01/28/coronavirus-a-toulouse-les-masques-sont-en-rupture-de-stock,8692009.php","2020-01-28 06:45:00","Coronavirus : à Toulouse , les masques sont en rupture de stock"
"https://www.hoy.es/sociedad/salud/policia-reparte-marcarillas-20200128133646-ntrc.html","https://www.hoy.es/sociedad/salud/policia-reparte-marcarillas-20200128133646-ntrc_amp.html","2020-01-28 14:00:00","La Policía Nacional reparte marcarillas a los agentes en los aeropuertos ante el coronavirus"
"https://www.express.co.uk/news/world/1234620/coronavirus-latest-news-death-toll-china-news-flight-japan-shanghai-passengers-scared","https://www.express.co.uk/news/world/1234620/coronavirus-latest-news-death-toll-china-news-flight-japan-shanghai-passengers-scared/amp","2020-01-28 19:00:00","Coronavirus latest : 70 passengers refuse to board plane with Wuhan residents over virus | World | News"
"https://www.lifehacker.com.au/2020/01/can-a-surgical-mask-protect-you-from-coronavirus/","https://www.lifehacker.com.au/2020/01/can-a-surgical-mask-protect-you-from-coronavirus/amp","2020-01-28 22:45:00","Can A Surgical Mask Protect You From Coronavirus ? "
"https://www.dailymail.co.uk/health/article-7937887/Coronavirus-fears-hit-Birmingham-facemask-wearing-patient-escorted-ambulance.html","https://www.dailymail.co.uk/health/article-7937887/amp/Coronavirus-fears-hit-Birmingham-facemask-wearing-patient-escorted-ambulance.html","2020-01-28 12:30:00","Coronavirus fears hit Birmingham as facemask - wearing patient is escorted into an ambulance"
"https://ua.korrespondent.net/world/4187434-koronavirus-poshyryvsia-ne-cherez-rynok-moreproduktiv-vcheni","https://korrespondent.net/amp/4187434-koronavirus-poshyryvsia-ne-cherez-rynok-moreproduktiv-vcheni","2020-01-28 13:00:00","Коронавірус поширився не через ринок морепродуктів - вчені"
"https://www.5-tv.ru/news/281351/maski-skupleny-povsemu-miru-naibolee-aktivnye-pokupateli-grazdane-kitaa/","https://m.5-tv.ru/amp/news/281351/maski-skupleny-povsemu-miru-naibolee-aktivnye-pokupateli-grazdane-kitaa/","2020-01-28 10:30:00","Маски скуплены по всему миру : наиболее активные покупатели граждане Китая"
"https://www.bbc.com/russian/news-51280596","https://www.bbc.com/russian/amp/news-51280596","2020-01-28 13:15:00","Первые случаи передачи коронавируса выявлены за пределами Китая - в Германии и Японии"
"https://newsinfo.inquirer.net/1220658/are-surgical-n95-masks-needed-amid-suspected-coronavirus-cases-in-ph","https://newsinfo.inquirer.net/1220658/are-surgical-n95-masks-needed-amid-suspected-coronavirus-cases-in-ph/amp","2020-01-28 09:45:00","Who should wear surgical masks ? WHO answers"
"https://www.efe.com/efe/espana/portada/la-policia-reparte-en-las-fronteras-mascarillas-y-guantes-a-los-agentes-ante-el-coronavirus/10010-4160479","","2020-01-28 12:30:00","La Policía reparte en las fronteras mascarillas y guantes a los agentes ante el coronavirus | Portada"
"https://www.cleveland.com/news/2020/01/should-i-be-freaking-out-what-can-you-do-to-protect-yourself-from-the-china-coronavirus.html","https://www.cleveland.com/news/2020/01/should-i-be-freaking-out-what-can-you-do-to-protect-yourself-from-the-china-coronavirus.html?outputType=amp","2020-01-28 23:45:00","Should I be freaking out ? What can you do to protect yourself from the China coronavirus"
"https://www.adelaidenow.com.au/lifestyle/health/doctors-in-wuhan-break-down-crying-after-days-without-sleep/news-story/4c3127e7214011e77e27cad7b40a7a67?nk=d4e3809645406c4122f72c2dcf0bebe1-1580224595","https://amp.adelaidenow.com.au/lifestyle/health/doctors-in-wuhan-break-down-crying-after-days-without-sleep/news-story/4c3127e7214011e77e27cad7b40a7a67","2020-01-28 15:30:00","Coronavirus outbreak : Doctors break down crying after days without sleep"
"https://www.adelaidenow.com.au/lifestyle/health/doctors-in-wuhan-break-down-crying-after-days-without-sleep/news-story/4c3127e7214011e77e27cad7b40a7a67?nk=c7a1de964f644f7f5400f18f6b4b6492-1580177898","https://amp.adelaidenow.com.au/lifestyle/health/doctors-in-wuhan-break-down-crying-after-days-without-sleep/news-story/4c3127e7214011e77e27cad7b40a7a67","2020-01-28 02:30:00","Coronavirus outbreak : Doctors break down crying after days without sleep"
"https://www.adelaidenow.com.au/lifestyle/health/doctors-in-wuhan-break-down-crying-after-days-without-sleep/news-story/4c3127e7214011e77e27cad7b40a7a67?nk=06a6f053f7fd8bbe858e36772f43527b-1580170675","https://amp.adelaidenow.com.au/lifestyle/health/doctors-in-wuhan-break-down-crying-after-days-without-sleep/news-story/4c3127e7214011e77e27cad7b40a7a67","2020-01-28 00:30:00","Coronavirus outbreak : Doctors break down crying after days without sleep"
"https://ua.korrespondent.net/ukraine/4187329-masky-y-vaktsyna-vid-koronavirusu-v-ukraini-aktyvizuvalysia-shakhrai","https://korrespondent.net/amp/4187329-masky-y-vaktsyna-vid-koronavirusu-v-ukraini-aktyvizuvalysia-shakhrai","2020-01-28 11:00:00","Маски й вакцина від коронавірусу . В Україні активізувалися шахраї"
"https://rus.azattyk.org/a/v-svazi-s-koronavirusom-v-kyrgyzstane-usileny-mery-bezopasnosti/30401325.html","https://rus.azattyk.org/amp/30401325.html","2020-01-28 12:15:00","Кыргызстан усиливает меры безопасности в связи с коронавирусом"
"https://utro.ru/life/2020/01/28/1433293.shtml","https://utro.ru/amp/life/2020/01/28/1433293.shtml","2020-01-28 12:30:00","Коронавирус 2020 , способы заражения , как защититься : последние новости"
"https://russian.rt.com/russia/news/712711-moskva-shtab-koronavirus","https://russian.rt.com/russia/news/712711-moskva-shtab-koronavirus/amp","2020-01-28 12:15:00","В Москве создан оперативный штаб для контроля ситуации с коронавирусом"
"https://www.msn.com/en-us/news/technology/coronavirus-deaths-hit-107-first-case-in-germany-everything-we-know/ar-BBZo2Ps","","2020-01-28 03:45:00","Coronavirus deaths hit 107 , first case in Germany : Everything we know"
"https://tass.ru/obschestvo/7619987","https://tass.ru/obschestvo/7619987/amp","2020-01-28 00:45:00","Исследование : порядка 55 % россиян считают коронавирус реальной угрозой"
"https://korrespondent.net/world/4187434-koronavyrus-rasprostranylsia-ne-cherez-rynok-moreproduktov-uchenye","https://korrespondent.net/amp/4187434-koronavyrus-rasprostranylsia-ne-cherez-rynok-moreproduktov-uchenye","2020-01-28 13:15:00","Коронавирус распространился не через рынок морепродуктов - ученые"
"https://www.noticiasaominuto.com/mundo/1402385/coronavirus-hong-kong-suspende-ligacoes-de-comboio-e-de-ferry-para-china","","2020-01-28 13:45:00","Coronavírus : Hong Kong suspende ligaes de comboio e de ferry para China"
"https://www.francetvinfo.fr/sante/maladie/coronavirus/coronavirus-les-idees-recues-sur-les-risques-de-contamination_3803517.html","https://mobile.francetvinfo.fr/sante/maladie/coronavirus/coronavirus-les-idees-recues-sur-les-risques-de-contamination_3803517.amp","2020-01-28 20:45:00","Coronavirus : les idées reçues sur les risques de contamination"
"https://in.reuters.com/article/china-health-hongkong/hong-kong-to-suspend-high-speed-rail-service-in-bid-to-halt-spread-of-coronavirus-idINKBN1ZR0VA","https://in.mobile.reuters.com/article/amp/idINKBN1ZR0VA","2020-01-28 09:45:00","Hong Kong to suspend high - speed rail service in bid to halt spread of coronavirus"
"https://www.thestar.com.my/news/nation/2020/01/28/stern-action-against-traders-raising-price-of-face-masks","","2020-01-28 00:30:00","Stern action against traders raising price of face masks"
"https://www.istoedinheiro.com.br/a-mascara-uma-opcao-de-protecao-mas-sem-100-de-garantia/","","2020-01-28 14:30:00","A máscara , uma opo de proteo , mas sem 100 % de garantia"
"https://lanouvelletribune.info/2020/01/coronavirus-enfin-le-ministre-hounkpatin-informe-les-beninois-et-rassure/","https://lanouvelletribune.info/2020/01/coronavirus-enfin-le-ministre-hounkpatin-informe-les-beninois-et-rassure/amp/","2020-01-28 11:45:00","Coronavirus : Le ministre Hounkpatin informe les Béninois et rassure – La Nouvelle Tribune"
"https://www.dw.com/pt-br/opini%C3%A3o-n%C3%A3o-se-deixe-contagiar-pelo-coronav%C3%ADrus/a-52179551","https://amp.dw.com/pt-br/opini%C3%A3o-n%C3%A3o-se-deixe-contagiar-pelo-coronav%C3%ADrus/a-52179551","2020-01-28 20:45:00","Opinião : Não se deixe contagiar pelo coronavírus ! | Novidades da ciência para melhorar a qualidade de vida | DW"
"https://utro.ru/showbiz/2020/01/28/1433258.shtml","https://utro.ru/amp/showbiz/2020/01/28/1433258.shtml","2020-01-28 09:45:00","Коронавирус в Китае 2020 : симптомы , новости , лечение"
"https://novini.bg/sviat/azia/579655","https://novini.bg/amp/sviat/azia/579655","2020-01-28 09:00:00","Българска студентка , блокирана в Китай : Ухан е пуст като София по празниците - Азия"
"http://news.bigmir.net/world/1974726-Nazvany-novye-simptomy-i-sposoby-zarazhenija-koronavirusom","http://amp.news.bigmir.net/world/1974726-Nazvany-novye-simptomy-i-sposoby-zarazhenija-koronavirusom","2020-01-28 12:15:00","Названы новые симптомы и способы заражения коронавирусом"
"https://uk.reuters.com/article/uk-china-health-hongkong/hong-kong-suspends-some-rail-ferry-links-with-china-mainland-to-curb-virus-spread-idUKKBN1ZR0VE?rpc=401","https://uk.mobile.reuters.com/article/amp/idUKKBN1ZR0VE","2020-01-28 19:00:00","Hong Kong suspends some rail , ferry links with China mainland to curb virus spread"
"https://uk.reuters.com/article/uk-china-health-hongkong/hong-kong-suspends-some-rail-ferry-links-with-china-mainland-to-curb-virus-spread-idUKKBN1ZR0VE","https://uk.mobile.reuters.com/article/amp/idUKKBN1ZR0VE","2020-01-28 12:30:00","Hong Kong suspends some rail , ferry links with China mainland to curb virus spread"
"https://in.reuters.com/article/us-china-health-hongkong/hong-kong-suspends-some-rail-ferry-links-with-mainland-to-curb-virus-spread-idINKBN1ZR0VC","https://in.mobile.reuters.com/article/amp/idINKBN1ZR0VC","2020-01-28 12:30:00","Hong Kong suspends some rail , ferry links with China mainland to curb virus spread"
"https://uk.reuters.com/article/us-china-health-hongkong/hong-kong-suspends-some-rail-ferry-links-with-mainland-to-curb-virus-spread-idUKKBN1ZR0VC","https://uk.mobile.reuters.com/article/amp/idUKKBN1ZR0VC","2020-01-28 12:45:00","Hong Kong suspends some rail , ferry links with China mainland to curb virus spread"
"https://www.reuters.com/article/us-china-health-hongkong/hong-kong-suspends-some-rail-ferry-links-with-china-mainland-to-curb-virus-spread-idUSKBN1ZR0VC","https://mobile.reuters.com/article/amp/idUSKBN1ZR0VC","2020-01-28 12:30:00","Hong Kong suspends some rail , ferry links with China mainland to curb virus spread"
"https://uk.reuters.com/article/us-china-health-hongkong/hong-kong-suspends-some-rail-ferry-links-with-china-mainland-to-curb-virus-spread-idUKKBN1ZR0VC","https://uk.mobile.reuters.com/article/amp/idUKKBN1ZR0VC","2020-01-28 15:00:00","Hong Kong suspends some rail , ferry links with China mainland to curb virus spread"
"https://in.reuters.com/article/us-china-health-hongkong/hong-kong-suspends-some-rail-ferry-links-with-china-mainland-to-curb-virus-spread-idINKBN1ZR0VC","https://in.mobile.reuters.com/article/amp/idINKBN1ZR0VC","2020-01-28 15:00:00","Hong Kong suspends some rail , ferry links with China mainland to curb virus spread"
"https://news.abs-cbn.com/business/01/28/20/subic-port-on-alert-against-new-coronavirus-administrator","","2020-01-28 03:30:00","Subic port on alert against new coronavirus : administrator"
"https://i.stuff.co.nz/national/health/119100085/what-you-need-to-know-about-coronavirus","","2020-01-28 14:00:00","What you need to know about coronavirus"
"https://www.stuff.co.nz/national/health/119100085/what-you-need-to-know-about-coronavirus","","2020-01-28 04:15:00","What you need to know about coronavirus"
"https://www.nbcnews.com/health/health-news/what-new-coronavirus-n1119081?cid=public-rss_20200128","https://www.nbcnews.com/news/amp/ncna1119081","2020-01-28 02:00:00","What is the coronavirus disease and is there a coronavirus vaccine ? "
"https://www.9news.com.au/national/where-is-coronavirus-total-cases-australia-and-around-the-world/2e233424-3323-4c38-9c8c-bb25a2d4c501","https://amp.9news.com.au/article/2e233424-3323-4c38-9c8c-bb25a2d4c501","2020-01-28 03:15:00","Where has coronavirus spread ? Number of total cases worldwide"
"https://www.theaustralian.com.au/world/coronavirus-400-trapped-australians-register-with-dfat-to-be-evacuated-from-china/news-story/8af1454332c3b040352a7c83d712df0d?nk=57b8461590c7b8de7994c1f3b44a455e-1580233676","https://amp.theaustralian.com.au/world/coronavirus-400-trapped-australians-register-with-dfat-to-be-evacuated-from-china/news-story/8af1454332c3b040352a7c83d712df0d","2020-01-28 18:00:00","Coronavirus : 400 trapped Australians register with DFAT to be evacuated from China"
"https://www.theaustralian.com.au/world/coronavirus-400-trapped-australians-register-with-dfat-to-be-evacuated-from-china/news-story/8af1454332c3b040352a7c83d712df0d?nk=6abc122918bfd25ce5efa08e658f2f77-1580247112","https://amp.theaustralian.com.au/world/coronavirus-400-trapped-australians-register-with-dfat-to-be-evacuated-from-china/news-story/8af1454332c3b040352a7c83d712df0d","2020-01-28 21:45:00","Coronavirus : 400 trapped Australians register with DFAT to be evacuated from China"
"https://ktar.com/story/2947418/surgical-masks-are-hot-accessory-at-asu-after-coronavirus-diagnosis/","https://ktar.com/story/2947418/surgical-masks-are-hot-accessory-at-asu-after-coronavirus-diagnosis/amp/","2020-01-28 21:45:00","Surgical masks are hot accessory at ASU after coronavirus diagnosis"
"https://www.segodnya.ua/world/wnews/mozhno-zarazitsya-cherez-glaza-kak-rasprostranyaetsya-novaya-pnevmoniya-1393762.html","/world-amp/mozhno-zarazitsya-cherez-glaza-kak-rasprostranyaetsya-novaya-pnevmoniya-1393762.html","2020-01-28 09:15:00","Коронавирус из Китая - как происходит заражение"
"https://gizmodo.com/how-much-do-face-masks-help-prevent-the-spread-of-virus-1841309321","https://gizmodo.com/how-much-do-face-masks-help-prevent-the-spread-of-virus-1841309321/amp","2020-01-28 21:15:00","How Much Do Face Masks Help Prevent the Spread of Viruses ? "
"https://abc7news.com/5884372/","https://abc7news.com/amp/5884372","2020-01-28 08:00:00","Coronavirus : US health officials warn people to avoid all travel to China due to deadly virus"
"https://abc7news.com/health/officials-warn-people-to-avoid-all-travel-to-china-due-to-coronavirus/5884372/","https://abc7news.com/amp/5884372","2020-01-28 07:45:00","Coronavirus : US health officials warn people to avoid all travel to China due to deadly virus"
"https://ura.news/news/1052416544","{{ (metaService && metaService.ampUrl()) ? metaService.ampUrl() : https://amp.ura.news/news/1052416544 }}","2020-01-28 20:00:00","В больницу Воронежа доставили пациента с подозрением на коронавирус"
"https://www.wsj.com/articles/hong-kong-china-travel-to-be-reduced-significantly-due-to-coronavirus-11580205806","https://www.wsj.com/amp/articles/hong-kong-china-travel-to-be-reduced-significantly-due-to-coronavirus-11580205806","2020-01-28 11:45:00","Hong Kong - China Travel to Be Reduced Significantly Due to Coronavirus"
"https://www.theaustralian.com.au/world/coronavirus-400-trapped-australians-register-with-dfat-to-be-evacuated-from-china/news-story/8af1454332c3b040352a7c83d712df0d?nk=e4be1a844969a600e1cf944c9a4c0b1d-1580181466","https://amp.theaustralian.com.au/world/coronavirus-400-trapped-australians-register-with-dfat-to-be-evacuated-from-china/news-story/8af1454332c3b040352a7c83d712df0d","2020-01-28 03:30:00","Coronavirus : 400 trapped Australians register with DFAT to be evacuated from China"
"https://forbes.kz/news/2020/01/28/newsid_217764","https://m.forbes.kz/news/2020/01/28/newsid_217764","2020-01-28 15:30:00","Эксперт оценила риск заражения коронавирусом через посылки AliExpress"
"https://volgasib.ru/virtual/obshestvo/isklyuchit-obyatiya-i-potselui-volgogradtsam-obyasnili-kak-ne-zarazitsya-virusom/","https://volgasib.ru/virtual/obshestvo/isklyuchit-obyatiya-i-potselui-volgogradtsam-obyasnili-kak-ne-zarazitsya-virusom/amp/","2020-01-28 11:00:00"," « Исключить объятия и поцелуи »: волгоградцам объяснили , как не заразиться вирусом • СоцИнформБюро"
"https://www.kp.ru/daily/27084/4156298/","https://amp.kp.ru/daily/27084/4156298/","2020-01-28 18:30:00","Коронавирус в Китае показал к грядущей реальной эпидемии мир не готов"
"https://oglobo.globo.com/sociedade/saude/hong-kong-interrompe-linhas-de-trem-balsas-para-china-continental-contra-coronavirus-1-24215268","","2020-01-28 13:00:00","Hong Kong interrompe linhas de trem e balsas para a China continental contra coronavírus"
"https://www.cnbc.com/2020/01/28/hong-kong-to-suspend-high-speed-rail-to-halt-spread-of-coronavirus.html","https://www.cnbc.com/amp/2020/01/28/hong-kong-to-suspend-high-speed-rail-to-halt-spread-of-coronavirus.html","2020-01-28 11:15:00","Hong Kong to suspend high - speed rail to halt spread of coronavirus"
"https://www.thestar.co.uk/health/chinese-people-sheffield-wear-masks-protect-against-coronavirus-1378198","https://www.thestar.co.uk/health/chinese-people-sheffield-wear-masks-protect-against-coronavirus-1378198?amp","2020-01-28 18:15:00","Chinese people in Sheffield wear masks to protect against coronavirus"
"http://www.sundaytimes.lk/article/1114170/colombo-and-suburbs-hit-by-surgical-mask-shortage","","2020-01-28 11:15:00","Sunday Times - Colombo and suburbs hit by surgical mask shortage"
"https://ria.ru/20200128/1563972914.html","https://ria.ru/amp/20200128/1563972914.html","2020-01-28 13:00:00","Руководство ЕК обсудит меры по сдерживанию эпидемии коронавируса"
"https://rg.ru/2020/01/28/uchenye-koronavirus-mozhet-peredavatsia-s-rasstoianiia-2-metra-i-cherez-glaza.html","https://rg.ru/amp/2020/01/28/uchenye-koronavirus-mozhet-peredavatsia-s-rasstoianiia-2-metra-i-cherez-glaza.html","2020-01-28 20:30:00","Ученые : коронавирус может передаваться с расстояния 2 метра и через глаза"
"https://www.thestreet.com/investing/3m-ramps-up-face-mask-production-in-response-to-coronavirus","https://www.thestreet.com/.amp/investing/3m-ramps-up-face-mask-production-in-response-to-coronavirus","2020-01-28 21:15:00","3M Ramps Up Face - Mask Production in Response to Coronavirus"
"https://www.focus.pl/artykul/kolejne-kraje-z-koronawirusem-eksperci-potwierdzaja-pochodzi-od-dzikich-zwierzat","https://www.focus.pl/artykul/amp/kolejne-kraje-z-koronawirusem-eksperci-potwierdzaja-pochodzi-od-dzikich-zwierzat","2020-01-28 11:00:00","Kolejne kraje z koronawirusem . Eksperci potwierdzają : pochodzi od dzikich zwierząt"
"https://www.terra.com.br/noticias/opiniao-nao-se-deixe-contagiar-pelo-coronavirus,e697e0d9aa6bd4358a16ad670782f92fqp214598.html","https://www.terra.com.br/amp/noticias/opiniao-nao-se-deixe-contagiar-pelo-coronavirus,e697e0d9aa6bd4358a16ad670782f92fqp214598.html","2020-01-28 18:15:00","Opinião : Não se deixe contagiar pelo coronavírus ! "
"https://www.ouest-france.fr/sante/virus/coronavirus-chinois-porter-un-masque-de-protection-est-ce-vraiment-utile-6710443","https://amp.ouest-france.fr/sante/virus/coronavirus-chinois-porter-un-masque-de-protection-est-ce-vraiment-utile-6710443","2020-01-28 08:30:00","Coronavirus chinois . Porter un masque de protection , est - ce vraiment utile ? "
"https://www.vedomosti.ru/economics/articles/2020/01/28/821663-koronavirus-mirovuyu-ekonomiku","https://m.vedomosti.ru//economics/articles/2020/01/28/821663-koronavirus-mirovuyu-ekonomiku","2020-01-28 18:00:00","Коронавирус проверит мировую экономику на прочность"
"https://www.foxnews.com/health/canadas-coronavirus-cases-husband-wife","https://www.foxnews.com/health/canadas-coronavirus-cases-husband-wife.amp","2020-01-28 15:15:00","Canada first coronavirus cases are confirmed in husband and wife : officials"
"https://www.nst.com.my/world/world/2020/01/560481/hong-kong-suspends-high-speed-rail-ferry-services-over-coronavirus","//www.nst.com.my/node/560481/amp","2020-01-28 12:15:00","Hong Kong suspends high - speed rail , ferry services over coronavirus"
"https://www.5.ua/suspilstvo/u-kyievi-nemaie-kytaiskoho-koronavirusu-ale-misto-hotove-do-zahrozy-kmda-207175.html","https://www.5.ua/amp/suspilstvo/u-kyievi-nemaie-kytaiskoho-koronavirusu-ale-misto-hotove-do-zahrozy--kmda-207175.html","2020-01-28 16:00:00","У Києві немає китайського коронавірусу , але місто готове до загрози – КМДА"
"https://unitedwithisrael.org/new-israeli-masks-could-help-stop-deadly-chinese-virus/","https://unitedwithisrael.org/new-israeli-masks-could-help-stop-deadly-chinese-virus/amp/","2020-01-28 13:45:00","New Israeli Masks Could Help Stop Deadly Chinese Virus"
"https://www.lci.fr/sante/coronavirus-ces-francais-qui-veulent-quitter-wuhan-ceux-qui-veulent-rester-en-chine-2143904.html","https://www.lci.fr/amp/sante/coronavirus-ces-francais-qui-veulent-quitter-wuhan-ceux-qui-veulent-rester-en-chine-2143904.html","2020-01-28 06:30:00","Coronavirus : ces Français qui veulent quitter Wuhan et ceux qui veulent rester"
