URL,MobileURL,Date,Title
"https://www.bhaskar.com/photo/utility/news/coronavirus-n95-face-mask-how-to-use-latest-updates-in-hindi-corona-covid-19-cases-rise-in-india-126994123.html","","2020-03-21 13:00:00","Photo News In Hindi : Coronavirus N95 Face Mask | When and How to Use Masks as Corona ( COVID - 19 ) Cases Rise In India | फेस मास्क कब और क्यों पहनें , इसे समझें"
"https://newsinfo.inquirer.net/1246155/doh-on-covid-19-patients-breastfeeding","https://newsinfo.inquirer.net/1246155/doh-on-covid-19-patients-breastfeeding/amp","2020-03-21 12:00:00","Breastfeeding allowed for mothers with COVID - 19 DOH"
"https://www.msn.com/en-gb/news/world/portugals-death-toll-from-coronavirus-doubles-to-12/ar-BB11v2ma","","2020-03-21 12:45:00","Portugal death toll from coronavirus doubles to 12"
"https://publimetro.pe/vida-estilo/salud/las-mascarillas-caseras-nos-protegen-del-covid-19-nnda-nnlt-noticia/","https://publimetro.pe/vida-estilo/salud/las-mascarillas-caseras-nos-protegen-del-covid-19-nnda-nnlt-noticia/?outputType=amp","2020-03-21 02:45:00"," ¿ Las mascarillas caseras nos protegen del COVID - 19 ? "
"https://nypost.com/2020/03/21/corrections-officer-slams-doc-over-lack-of-masks/","https://nypost.com/2020/03/21/corrections-officer-slams-doc-over-lack-of-masks/amp/","2020-03-21 22:15:00","NYC Corrections Officer slams DOC over lack of masks"
"https://parade.com/1012729/jessicasager/how-to-sew-a-face-mask-to-overcome-the-shortage-during-coronavirus-pandemic/","https://parade.com/1012729/jessicasager/how-to-sew-a-face-mask-to-overcome-the-shortage-during-coronavirus-pandemic/amp/","2020-03-21 16:30:00","How to Sew a Face Mask How to Sew a Mask During Coronarivus Crisis"
"https://www.dailydot.com/irl/lizzo-face-mask/","https://www.dailydot.com/irl/lizzo-face-mask/?amp","2020-03-21 18:30:00","Lizzo Defends Herself Wearing Face Mask After Backlash"
"https://www.standard.co.uk/news/uk/man-wembley-stadium-lasagne-warns-coronavirus-fake-news-a4393881.html","https://www.standard.co.uk/news/uk/man-wembley-stadium-lasagne-warns-coronavirus-fake-news-a4393881.html?amp","2020-03-21 20:30:00","Man behind prank Wembley Stadium lasagne prank warns of dangers of fake coronavirus news"
"https://www.msn.com/en-in/health/familyhealth/coronavirus-scare-do-you-need-to-wear-n95-masks/ar-BB11uo3l","","2020-03-21 08:30:00","Coronavirus scare : Do you need to wear N95 masks ? "
"https://www.koaci.com/article/2020/03/21/senegal/sante/senegal-avec-9-nouveaux-cas-le-pays-depasse-la-barre-des-50-cas-de-malades-de-covid-19_139716.html","","2020-03-21 22:45:00","Sénégal : Avec 9 nouveaux cas , le pays dépasse la barre des 50 cas de malades de Covid 19"
"https://www.standard.co.uk/news/uk/coronavirus-mothers-day-visit-boris-johnson-advice-a4393671.html","https://www.standard.co.uk/news/uk/coronavirus-mothers-day-visit-boris-johnson-advice-a4393671.html?amp","2020-03-21 00:30:00","Boris Johnson urges Brits to  think very carefully  before paying Mother Day visit as he orders coronavirus lockdown"
"https://www.newsweek.com/google-covid-19-resource-1493582","https://www.newsweek.com/google-covid-19-resource-1493582?amp=1","2020-03-21 17:15:00","Google Launches Portal to Help U . S . Users Find Information on Coronavirus"
"https://trome.pe/actualidad/coronavirus-miraflores-pasear-a-su-perro-burla-cuarentena-noticia/","https://trome.pe/actualidad/coronavirus-miraflores-pasear-a-su-perro-burla-cuarentena-noticia/?outputType=amp","2020-03-21 04:45:00","Coronavirus | Miraflores | Miraflores | Sale a pasear con su perro y se burla de cuarentena :  Voy a hacerme una mascarilla del brasier de mi mamá  Actualidad"
"http://www.adiac-congo.com/content/coronavirus-le-port-de-la-bavette-nest-pas-conseille-pour-les-personnes-saines-114467","","2020-03-21 13:45:00","Coronavirus : le port de la bavette nest pas conseillé pour les personnes saines | adiac - congo . com : toute lactualité du Bassin du Congo"
"http://adiac-congo.com/content/coronavirus-le-port-de-la-bavette-nest-pas-conseille-pour-les-personnes-saines-114467","","2020-03-21 13:45:00","Coronavirus : le port de la bavette nest pas conseillé pour les personnes saines | adiac - congo . com : toute lactualité du Bassin du Congo"
"http://www.adiac-congo.com/content/coronavirus-le-port-de-la-bavette-nest-pas-conseille-aux-personnes-saines-114467","","2020-03-21 17:15:00","Coronavirus : le port de la bavette nest pas conseillé aux personnes saines | adiac - congo . com : toute lactualité du Bassin du Congo"
"https://www.sfchronicle.com/news/article/Coronavirus-FAQ-Should-you-wear-a-face-mask-15147298.php","https://www.sfchronicle.com/news/amp/Coronavirus-FAQ-Should-you-wear-a-face-mask-15147298.php","2020-03-21 06:15:00","Coronavirus FAQ : Should you wear a face mask ? "
"https://elpopular.pe:443/virales/2020/03/21/coronavirus-twitter-doctora-ensena-como-usar-correctamente-mascarilla-covid-19-4740","https://elpopular.pe/amp/virales/2020/03/21/coronavirus-twitter-doctora-ensena-como-usar-correctamente-mascarilla-covid-19-4740","2020-03-21 19:15:00","Coronavirus | Twitter | Doctora enseña cómo usar correctamente una mascarilla"
"https://nairobinews.nation.co.ke/editors-picks/kenya-red-cross-warns-public-against-buying-masks-on-the-streets","https://nairobinews.nation.co.ke/amp/editors-picks/kenya-red-cross-warns-public-against-buying-masks-on-the-streets","2020-03-21 11:30:00","Kenya Red Cross warns public against buying masks on the streets"
"https://fr.sputniknews.com/france/202003211043353855-quelque-5000-policiers-sont-confines-avec-des-symptomes-de-covid-19-selon-un-syndicat/","https://fr.sputniknews.com/amp/france/202003211043353855-quelque-5000-policiers-sont-confines-avec-des-symptomes-de-covid-19-selon-un-syndicat/","2020-03-21 22:00:00","Quelque 5 . 000 policiers sont confinés avec des symptômes de Covid - 19 , selon un syndicat"
"https://www.newsweek.com/coronavirus-spain-italy-death-toll-1493567","https://www.newsweek.com/coronavirus-spain-italy-death-toll-1493567?amp=1","2020-03-21 13:30:00","Global Coronavirus Death Toll Now Exceeds 11 , 500 and Nearly 279 , 000 Infected Around the World"
"https://www.ouest-france.fr/sante/virus/coronavirus/coronavirus-les-policiers-pourront-porter-un-masque-si-les-circonstances-l-exigent-6788042","https://amp.ouest-france.fr/sante/virus/coronavirus/coronavirus-les-policiers-pourront-porter-un-masque-si-les-circonstances-l-exigent-6788042","2020-03-21 18:00:00","Coronavirus . Les policiers pourront porter un masque si les « circonstances » « lexigent » "
"http://westchester.news12.com/story/41923261/first-responders-grateful-for-publics-help-to-battle-shortage-of-face-masks","","2020-03-21 04:15:00","First responders grateful for public help to battle shortage o"
"https://www.standard.co.uk/news/uk/government-support-selfemployed-coronavirus-universal-credit-statutory-sick-pay-a4393841.html","https://www.standard.co.uk/news/uk/government-support-selfemployed-coronavirus-universal-credit-statutory-sick-pay-a4393841.html?amp","2020-03-21 15:00:00","Chancellor urged to provide financial lifeline for the self - employed during coronavirus pandemic"
"https://www.newsweek.com/americans-are-turning-restaurant-takeout-delivery-massive-numbers-while-self-isolating-yelp-says-1493549","https://www.newsweek.com/americans-are-turning-restaurant-takeout-delivery-massive-numbers-while-self-isolating-yelp-says-1493549?amp=1","2020-03-21 05:30:00","Americans Are Turning to Restaurant Takeout and Delivery In Massive Numbers While Self - Isolating , Yelp Says"
"https://www.timesunion.com/news/article/Coronavirus-FAQ-Should-you-wear-a-face-mask-15147991.php","https://www.timesunion.com/news/amp/Coronavirus-FAQ-Should-you-wear-a-face-mask-15147991.php","2020-03-21 18:15:00","Coronavirus FAQ : Should you wear a face mask ? "
"https://www.newsweek.com/catch-coronavirus-phone-clothes-other-surfaces-1493432","https://www.newsweek.com/catch-coronavirus-phone-clothes-other-surfaces-1493432?amp=1","2020-03-21 05:30:00","Can I Catch Coronavirus From My Phone , Clothes or Other Surfaces ? "
"https://www.lyonne.fr/auxerre-89000/actualites/masques-de-protection-nous-avons-pose-la-question-au-medecin-hygieniste-de-l-hopital-d-auxerre_13768661/","https://www.lyonne.fr/amp/auxerre-89000/actualites/masques-de-protection-nous-avons-pose-la-question-au-medecin-hygieniste-de-l-hopital-d-auxerre_13768661/","2020-03-21 19:45:00","Masques de protection : nous avons posé la question au médecin hygiéniste de lhôpital dAuxerre"
"https://tribune.com.pk/story/2180849/3-central-asia-tightens-restrictions-coronavirus-spreads/","https://tribune.com.pk/story/2180849/3-central-asia-tightens-restrictions-coronavirus-spreads/?amp=1","2020-03-21 07:15:00","Central Asia tightens restrictions as coronavirus spreads"
"https://af.reuters.com/article/worldNews/idAFKBN2180RZ","https://mobile.reuters.com/article/amp/af/idAFKBN2180RZ","2020-03-21 18:15:00","Canada death toll from coronavirus rises to 13 - government"
"https://www.channelstv.com/2020/03/21/chile-reports-first-coronavirus-death/","https://www.channelstv.com/2020/03/21/chile-reports-first-coronavirus-death/amp/","2020-03-21 21:45:00","Chile Reports First Coronavirus Death"
"https://www.indiatvnews.com/news/india/fact-check-can-face-masks-protect-you-from-coronavirus-600250","https://www.indiatvnews.com/amp/news/india/fact-check-can-face-masks-protect-you-from-coronavirus-600250","2020-03-21 13:30:00","FACT CHECK : Can face masks protect you from coronavirus ? "
"https://www.kyivpost.com/russia/meduza-russia-confirms-53-new-coronavirus-cases.html","","2020-03-21 17:45:00","Meduza : Russia confirms 53 new coronavirus cases | KyivPost - Ukraine Global Voice"
"https://uk.reuters.com/article/uk-health-coronavirus-canada/canadas-death-toll-from-coronavirus-rises-to-13-government-idUKKBN2180RZ","https://uk.mobile.reuters.com/article/amp/idUKKBN2180RZ","2020-03-21 16:45:00","Canada death toll from coronavirus rises to 13 - government"
"https://www.reuters.com/article/uk-health-coronavirus-canada-idUKKBN2180RZ","https://mobile.reuters.com/article/amp/idUKKBN2180RZ","2020-03-21 17:45:00","Canada death toll from coronavirus rises to 13 - government"
"https://www.dailymail.co.uk/news/article-8137585/Race-track-diners-Gold-Coast-restaurant-man-39-tests-positive-coronavirus.html","https://www.dailymail.co.uk/news/article-8137585/amp/Race-track-diners-Gold-Coast-restaurant-man-39-tests-positive-coronavirus.html","2020-03-21 11:45:00","Race to track down diners at a Gold Coast restaurant after man , 39 , tests positive to coronavirus"
"https://www.msn.com/en-us/news/us/us-military-central-command-confirms-first-case-of-coronavirus-at-hq/ar-BB11vBs5","","2020-03-21 15:30:00","US military Central Command confirms first case of coronavirus at HQ"
"https://www.timesnownews.com/india/article/india-fights-coronavirus-modi-governments-5-point-plan-to-contain-the-covid19-pandemic/567730","https://www.timesnownews.com/amp/india/article/india-fights-coronavirus-modi-governments-5-point-plan-to-contain-the-covid19-pandemic/567730","2020-03-21 18:30:00","coronavirus latest news update India fights Coronavirus : Modi Government 5 point plan to contain the COVID19 pandemic"
"https://tuoitrenews.vn/news/lifestyle/20200321/maskclad-saigon-kids-enjoy-kiteflying-in-times-of-covid19/53587.html","","2020-03-21 04:30:00","Mask - clad Saigon kids enjoy kite - flying in times of COVID - 19 | Tuoi Tre News"
"https://www.oann.com/panamas-copa-airlines-cancels-all-flights-as-coronavirus-crisis-spreads/","","2020-03-21 00:30:00","Panama Copa Airlines cancels all flights as coronavirus crisis spreads"
"https://www.cincinnati.com/story/news/2020/03/21/coronavirus-ohio-sew-masks-home-help-doctors-fight-covid-19/2892098001/","https://amp.cincinnati.com/amp/2892098001","2020-03-21 23:00:00","Coronavirus in Ohio : Sew masks at home to help doctors fight COVID - 19"
"https://www.elconfidencial.com/espana/2020-03-21/mascarillas-caseras-quirurgicas-coronavirus_2510628/","https://www.elconfidencial.com/amp/espana/2020-03-21/mascarillas-caseras-quirurgicas-coronavirus_2510628/","2020-03-21 20:15:00","El auge de las mascarillas caseras : ¿ cómo son de efectivas ? "
"https://www.ledevoir.com/societe/sante/575464/titre","","2020-03-21 00:30:00","Que sont ces « produits biologiques » susceptibles de propager le coronavirus ? "
"https://rpp.pe/peru/actualidad/coronavirus-covid-19-inacal-aprueba-norma-tecnica-sobre-mascarillas-quirurgicas-para-garantizar-estandares-de-calidad-noticia-1253265","https://amp.rpp.pe/peru/actualidad/coronavirus-covid-19-inacal-aprueba-norma-tecnica-sobre-mascarillas-quirurgicas-para-garantizar-estandares-de-calidad-noticia-1253265","2020-03-21 23:15:00","Coronavirus | COVID - 19 | INACAL aprueba norma técnica sobre mascarillas quirúrgicas para garantizar estándares de calidad"
"https://www.newsweek.com/coronavirus-honduras-mar-lago-trump-california-tests-1493576","https://www.newsweek.com/coronavirus-honduras-mar-lago-trump-california-tests-1493576?amp=1","2020-03-21 16:00:00","U . S . Coronavirus Update , Death Toll Hits 260 , Shortage of Tests in Los Angeles and Americans Evacuated From Honduras"
"https://www.financialexpress.com/industry/govt-caps-prices-of-hand-sanitisers-face-masks-hul-cuts-prices-of-lifebuoy-domex-key-things-to-know/1905300/","https://www.financialexpress.com/industry/govt-caps-prices-of-hand-sanitisers-face-masks-hul-cuts-prices-of-lifebuoy-domex-key-things-to-know/1905300/lite/","2020-03-21 09:45:00","Hand sanitiser , face mask prices capped , Lifebuoy , Domex get cheaper : Coronavirus prevention in reach"
"https://www.bbc.com/afrique/monde-51989169","https://www.bbc.com/afrique/amp/monde-51989169","2020-03-21 20:15:00","Des conseils de lOMS au public , pour éviter le coronavirus"
"https://timesofindia.indiatimes.com/city/ludhiana/masks-sanitizers-distributed-at-civil-hospital/articleshow/74753507.cms","https://m.timesofindia.com/city/ludhiana/masks-sanitizers-distributed-at-civil-hospital/amp_articleshow/74753507.cms","2020-03-21 19:15:00","Masks , sanitizers distributed at civil hospital | Ludhiana News"
"https://focustaiwan.tw/society/202003215001","","2020-03-21 10:45:00","How to protect against COVID - 19 - Focus Taiwan"
"https://www.thesun.ie/news/5231446/brit-patient-who-died-after-catching-coronavirus-tested-negative-twice-and-disease-was-only-discovered-at-post-mortem/","https://www.thesun.ie/news/5231446/brit-patient-who-died-after-catching-coronavirus-tested-negative-twice-and-disease-was-only-discovered-at-post-mortem/amp/","2020-03-21 20:30:00","Brit patient who died after catching coronavirus  tested negative TWICE and disease was only discovered at post - mortem  – The Irish Sun"
"https://sputniknews.com/us/202003211078654078-travel-bans-tests-development-and-navy-ships-how-us-government-combats-coronavirus-pandemic/","https://sputniknews.com/amp/us/202003211078654078-travel-bans-tests-development-and-navy-ships-how-us-government-combats-coronavirus-pandemic/","2020-03-21 10:45:00","Travel Bans , Tests Development , and Navy Ships : How US Government Combats Coronavirus Pandemic"
"https://www.oann.com/tokyo-2020-committee-says-not-at-stage-of-deciding-olympics-postponement-kyodo/","","2020-03-21 07:15:00","Tokyo 2020 Committee says not at stage of deciding Olympics postponement : Kyodo"
"https://www.timesnownews.com/india/article/coronavirus-new-cases-in-india-confirmed-covid-19-cases-death-active-cases-as-on-march/567644","https://www.timesnownews.com/amp/india/article/coronavirus-new-cases-in-india-confirmed-covid-19-cases-death-active-cases-as-on-march/567644","2020-03-21 13:15:00","Coronavirus new cases in India : 283 confirmed COVID - 19 cases , 4 deaths , 256 active cases as on March 21 @ 6 PM"
"https://www.kyivpost.com/world/bbc-what-can-the-west-learn-from-asias-coronavirus-fight.html","","2020-03-21 14:15:00","BBC : What can the West learn from Asia coronavirus fight ? | KyivPost"
"https://www.unian.net/health/country/10925426-kitayskie-vrachi-s-pomoshchyu-telesvyazi-podelyatsya-opytom-lecheniya-covid-19-s-ukrainskimi-medikami.html","https://www.unian.net/health/country/amp-10925426-kitayskie-vrachi-s-pomoshchyu-telesvyazi-podelyatsya-opytom-lecheniya-covid-19-s-ukrainskimi-medikami.html","2020-03-21 15:00:00","Коронавирус - Китайские врачи будут делиться опытом лечения COVID - 19 с украинскими медиками"
"https://uk.reuters.com/article/uk-health-coronavirus-spain-tally/spains-coronavirus-deaths-surpass-1300-close-to-25000-cases-health-ministry-idUKKBN2180IO","https://uk.mobile.reuters.com/article/amp/idUKKBN2180IO","2020-03-21 12:30:00","Spain coronavirus deaths surpass 1 , 300 , close to 25 , 000 cases - Health Ministry"
"https://af.reuters.com/article/worldNews/idAFKBN2180IO","https://mobile.reuters.com/article/amp/af/idAFKBN2180IO","2020-03-21 14:00:00","Spain coronavirus deaths surpass 1 , 300 , close to 25 , 000 cases - Health Ministry"
"https://www.yahoo.com/lifestyle/help-protect-healthcare-workers-during-171207825.html","https://www.yahoo.com/amphtml/lifestyle/help-protect-healthcare-workers-during-171207825.html","2020-03-21 01:15:00","You Can Help Protect Healthcare Workers During the COVID - 19 Outbreak by Sewing Medical Masks at Home"
"https://www.news18.com/news/movies/kajol-nysa-trolled-for-not-wearing-masks-at-airport-amid-covid-19-outbreak-2545599.html","https://www.news18.com/amp/news/movies/kajol-nysa-trolled-for-not-wearing-masks-at-airport-amid-covid-19-outbreak-2545599.html","2020-03-21 16:30:00","Kajol , Nysa Trolled for Not Wearing Masks at Airport Amid COVID - 19 Outbreak"
"https://www.businessinsider.in/science/news/google-says-it-has-removed-millions-of-ads-in-the-past-week-relating-to-coronavirus-but-users-are-still-seeing-ads-for-products-like-face-masks/articleshow/74752453.cms","https://www.businessinsider.in/science/news/google-says-it-has-removed-millions-of-ads-in-the-past-week-relating-to-coronavirus-but-users-are-still-seeing-ads-for-products-like-face-masks/amp_articleshow/74752453.cms","2020-03-21 19:45:00","Google says it has removed  millions of ads in the past week  relating to coronavirus , but users are still seeing ads for products like face masks"
"https://www.theguardian.com/world/2020/mar/21/can-face-mask-protect-me-coronavirus-covid-19-myths-busted","https://amp.theguardian.com/world/2020/mar/21/can-face-mask-protect-me-coronavirus-covid-19-myths-busted","2020-03-21 12:15:00","Can a face mask protect me from coronavirus ? Covid - 19 myths busted"
"https://news.yahoo.com/covid-19-doctors-running-masks-130009745.html","https://news.yahoo.com/amphtml/covid-19-doctors-running-masks-130009745.html","2020-03-21 13:30:00","COVID - 19 doctors running out of masks ? Try a bandanna , the CDC says"
"https://www.marthastewart.com/7735640/sew-face-masks-healthcare-workers-coronavirus-covid19-outbreak","","2020-03-21 04:30:00","You Can Help Protect Healthcare Workers During the COVID - 19 Outbreak by Sewing Medical Masks at Home"
"https://www.taiwannews.com.tw/en/news/3901699","","2020-03-21 08:30:00","Taiwan main airlines to refuse passen ... "
"https://in.reuters.com/article/health-coronavirus-philippines/philippines-confirms-45-new-coronavirus-cases-bringing-total-to-307-idINKBN2180DG","https://in.mobile.reuters.com/article/amp/idINKBN2180DG","2020-03-21 11:30:00","Philippines confirms 45 new coronavirus cases , bringing total to 307"
"https://www.lne.es/sociedad/2020/03/21/fabrica-mascarilla-casera-forma-facil/2615292.html","https://amp.lne.es/sociedad/2020/03/21/fabrica-mascarilla-casera-forma-facil/2615292.html","2020-03-21 17:45:00","Como hacer mascarillas para el coronavirus : Así se fabrica la mascarilla casera de la forma más fácil"
"https://www.msn.com/en-gb/news/world/french-designer-gives-away-homemade-masks-during-covid-19-crisis/ar-BB11vOpC","","2020-03-21 17:30:00","French designer gives away homemade masks during Covid - 19 crisis"
"http://www.rfi.fr/en/france/20200321-things-to-do-under-coronavirus-lockdown-make-your-own-face-mask-to-ease-shortage-health-workers-covid-19","https://amp.rfi.fr/en/france/20200321-things-to-do-under-coronavirus-lockdown-make-your-own-face-mask-to-ease-shortage-health-workers-covid-19","2020-03-21 18:30:00","Things to do under lockdown : Make your own face mask to ease shortage"
"https://www.channel3000.com/madison-patient-warns-young-people-theyre-not-invincible-to-coronavirus/","","2020-03-21 01:00:00","Madison patient warns young people theyre not invincible to coronavirus"
"https://www.sunstar.com.ph/article/1849443/Baguio/Local-News/Veggie-stakeholders-urged-to-wear-mask","","2020-03-21 16:15:00","Veggie stakeholders urged to wear mask"
"https://www.globalsecurity.org/security/library/news/2020/03/sec-200320-cna04.htm","","2020-03-21 02:15:00","Equipment for 32 mask production lines to be fully delivered soon"
"https://in.reuters.com/article/health-coronavirus-taiwan/taiwan-reports-18-new-coronavirus-cases-all-imported-idINKBN2180A8","https://in.mobile.reuters.com/article/amp/idINKBN2180A8","2020-03-21 07:45:00","Taiwan reports 18 new coronavirus cases , total now at 153"
"https://www.dailymail.co.uk/tvshowbiz/article-8138055/Lisa-Maffia-breaks-14-day-self-isolation-hairdressers-amid-coronavirus-lockdown.html","https://www.dailymail.co.uk/tvshowbiz/article-8138055/amp/Lisa-Maffia-breaks-14-day-self-isolation-hairdressers-amid-coronavirus-lockdown.html","2020-03-21 17:15:00","Lisa Maffia breaks her 14 day self - isolation to go to the hairdressers"
"https://www.businessinsider.com/face-masks-ads-being-served-by-google-after-ban-2020-3","https://www.businessinsider.com/face-masks-ads-being-served-by-google-after-ban-2020-3?amp","2020-03-21 17:00:00","Ads for face masks are still being served by Google after ban"
"https://www.nwitimes.com/news/local/lake/merrillville/group-fights-virus-stitch-at-a-time/article_8b8a5d3d-e813-564b-8d36-34446da01f58.html","https://www.nwitimes.com/news/local/lake/merrillville/group-fights-virus-stitch-at-a-time/article_8b8a5d3d-e813-564b-8d36-34446da01f58.amp.html","2020-03-21 13:45:00","Group fights virus 1 stitch at a time"
"https://www.10news.com/news/coronavirus/nurses-plead-for-help-during-coronavirus-pandemic","https://www.10news.com/news/coronavirus/nurses-plead-for-help-during-coronavirus-pandemic?_amp=true","2020-03-21 00:45:00","Nurses plead for help during coronavirus pandemic"
"https://www.limaohio.com/news/403427/todays-latest-updates-on-the-coronavirus-pandemic-11","","2020-03-21 21:15:00","Today latest updates on the coronavirus pandemic"
"https://glavred.info/virus/10158677-koronavirus-v-ukraine-vrach-rasskazala-komu-nuzhno-nosit-medicinskie-maski.html","https://glavred.info/virus/amp-10158677-koronavirus-v-ukraine-vrach-rasskazala-komu-nuzhno-nosit-medicinskie-maski.html","2020-03-21 23:15:00","Коронавирус в Украине - Кому нужно носить медицинские маски - совет врача"
"https://www.nbc12.com/2020/03/21/covid-what-you-need-know-about-coronavirus/","/2020/03/21/covid-what-you-need-know-about-coronavirus/?outputType=amp","2020-03-21 13:45:00","COVID - 19 : What you need to know about the coronavirus"
"https://www.theguardian.com/world/2020/mar/21/french-designer-homemade-masks-covid-19","https://amp.theguardian.com/world/2020/mar/21/french-designer-homemade-masks-covid-19","2020-03-21 18:30:00","French designer gives away homemade masks during Covid - 19 crisis"
"https://uk.reuters.com/article/uk-health-coronavirus-portugal/portugals-death-toll-from-coronavirus-doubles-to-12-idUKKBN2180JW","https://uk.mobile.reuters.com/article/amp/idUKKBN2180JW","2020-03-21 12:30:00","Portugal death toll from coronavirus doubles to 12"
"http://www.elsoldemargarita.com.ve/posts/post/id:227965/Neoespartanos-nerviosos-improvisan-tapabocas-frente-a-la-llegada-de-COVID-19","","2020-03-22 00:00:00"," .: El Sol de Margarita :. "
"http://elsoldemargarita.com.ve/posts/post/id:227965/Neoespartanos-nerviosos-improvisan-tapabocas-frente-a-la-llegada-de-COVID-19","","2020-03-22 00:00:00"," .: El Sol de Margarita :. "
"https://glavred.info/virus/10159136-zashchita-ot-virusa-kak-pravilno-nosit-medicinskie-maski-i-perchatki.html","https://glavred.info/virus/amp-10159136-zashchita-ot-virusa-kak-pravilno-nosit-medicinskie-maski-i-perchatki.html","2020-03-21 20:30:00","Китайский коронаврус - как правильно носить маски и перчатки - новости Украины"
"https://www.dailymail.co.uk/tvshowbiz/article-8137405/Julia-Morris-wears-face-mask-supermarket-amid-coronavirus-pandemic.html","https://www.dailymail.co.uk/tvshowbiz/article-8137405/amp/Julia-Morris-wears-face-mask-supermarket-amid-coronavirus-pandemic.html","2020-03-21 08:45:00","Julia Morris wears face mask in supermarket amid coronavirus pandemic"
"https://www.standard.co.uk/news/uk/coronavirus-north-london-mother-baby-pneumonia-standed-peru-a4393711.html","https://www.standard.co.uk/news/uk/coronavirus-north-london-mother-baby-pneumonia-standed-peru-a4393711.html?amp","2020-03-21 00:30:00","North London mother stranded in Peru with baby recovering from pneumonia amid coronavirus pandemic"
"https://www.fox2detroit.com/news/basic-steps-to-boost-immune-system-to-fight-covid-19","https://www.fox2detroit.com/news/basic-steps-to-boost-immune-system-to-fight-covid-19.amp","2020-03-21 09:00:00","Basic steps to boost immune system to fight COVID - 19"
"https://bringmethenews.com/minnesota-news/amid-drastic-shortages-mn-nurse-group-asking-for-n95-mask-donations","https://bringmethenews.com/.amp/minnesota-news/amid-drastic-shortages-mn-nurse-group-asking-for-n95-mask-donations","2020-03-21 17:30:00","Amid  drastic  shortages , MN nurse group asking for N95 mask donations"
