URL,MobileURL,Date,Title
"https://www.msn.com/en-us/weather/topstories/experts-weigh-in-on-how-coronavirus-may-or-may-not-run-rampant-in-us-in-coming-months/ar-BB1010sv","","2020-02-14 22:45:00","Experts weigh in on how coronavirus may , or may not , run rampant in US in coming months"
"https://www.medpagetoday.com/infectiousdisease/publichealth/84889","","2020-02-14 14:30:00","Morning Break : 15th U . S . COVID - 19 Case ; Pass / Fail for Step 1 ; Insulin Pump Recall"
"https://www.irishexaminer.com/breakingnews/views/analysis/ngaire-woods-global-co-operation-is-way-to-fight-pandemic-981580.html","https://amp.irishexaminer.com/breakingnews/views/analysis/ngaire-woods-global-co-operation-is-way-to-fight-pandemic-981580.html","2020-02-14 01:45:00","Ngaire Woods : Global co - operation is way to fight pandemic"
"https://www.msn.com/en-us/news/us/coronavirus-fears-expose-cultural-divide-over-masks-in-californias-san-gabriel-valley/ar-BB100ip6","","2020-02-14 14:15:00","Coronavirus fears expose cultural divide over masks in California San Gabriel Valley"
"https://www.voanews.com/science-health/coronavirus-outbreak/thai-policy-containing-coronavirus-stems-royal-decisions","https://www.voanews.com/science-health/coronavirus-outbreak/thai-policy-containing-coronavirus-stems-royal-decisions?amp","2020-02-14 02:45:00","Thai Policy for Containing Coronavirus Stems from Royal Decisions"
"https://www.dailymail.co.uk/news/article-8003665/Chinese-woman-dons-inflated-giraffe-costume-hospital-failing-buy-face-mask.html","https://www.dailymail.co.uk/news/article-8003665/amp/Chinese-woman-dons-inflated-giraffe-costume-hospital-failing-buy-face-mask.html","2020-02-14 18:30:00","Chinese woman dons an inflated giraffe costume to hospital"
"https://www.msn.com/en-my/news/national/govt-to-allow-face-mask-manufacturers-to-hire-more-foreign-workers/ar-BBZZJhn","","2020-02-14 13:30:00","Govt to allow face mask manufacturers to hire more foreign workers"
"https://technode.com/2020/02/14/baidu-open-source-face-masks/","","2020-02-14 06:45:00","Baidu releases open - source tool to detect faces without masks · TechNode"
"https://vancouversun.com/news/local-news/fifth-case-of-coronavirus-reported-in-british-columbia","https://vancouversun.com/news/local-news/fifth-case-of-coronavirus-reported-in-british-columbia/amp","2020-02-14 23:00:00","Fifth case of coronavirus reported in British Columbia"
"https://www.newsweek.com/covid-19-how-fake-news-could-help-spread-coronavirus-1487402","https://www.newsweek.com/covid-19-how-fake-news-could-help-spread-coronavirus-1487402?amp=1","2020-02-14 18:00:00","COVID - 19 : How Fake News Could Help Spread the Coronavirus"
"https://www.msn.com/en-ca/news/canada/princess-diamond-quarantine-has-backfired-mcgill-expert-says/ar-BB100GLF","","2020-02-14 22:00:00","Princess Diamond quarantine has backfired , McGill expert says"
"https://edmontonsun.com/news/local-news/fifth-case-of-coronavirus-reported-in-british-columbia/wcm/ab561895-b3d4-47e0-bd42-102c967cf329","https://edmontonsun.com/news/local-news/fifth-case-of-coronavirus-reported-in-british-columbia/wcm/ab561895-b3d4-47e0-bd42-102c967cf329/amp","2020-02-14 23:45:00","Fifth case of coronavirus reported in British Columbia"
"https://www.interaksyon.com/special-features/2020/02/14/162179/conspiracy-theories-covid-19-coronavirus-fake-news/","https://www.interaksyon.com/special-features/2020/02/14/162179/conspiracy-theories-covid-19-coronavirus-fake-news/amp/","2020-02-14 07:00:00","Stopping others from sharing fake news , conspiracy theories on COVID - 19 can save lives"
"https://www.hindustantimes.com/world-news/coronavirus-i-am-a-human-not-a-virus-italian-man-s-anti-racist-campaign-wins-hearts/story-TjPtY2eNE0ZUTKlTY5WoAK.html","https://m.hindustantimes.com/world-news/coronavirus-i-am-a-human-not-a-virus-italian-man-s-anti-racist-campaign-wins-hearts/story-TjPtY2eNE0ZUTKlTY5WoAK_amp.html","2020-02-14 06:30:00","  I am a human , not a viru : Italian man anti - racist campaign wins hearts - world news"
"https://e.vnexpress.net/news/news/hanoi-to-heed-health-ministry-on-face-masks-provision-for-students-4055158.html","https://ampe.vnexpress.net/news/news/hanoi-to-heed-health-ministry-on-face-masks-provision-for-students-4055158.html","2020-02-14 11:30:00","Hanoi to heed health ministry on face masks provision for students"
"https://www.dorsetecho.co.uk/news/national/18236667.hundreds-people-contacted-coronavirus-case-emerges-bus-summit/","","2020-02-14 15:45:00","Hundreds of people contacted as coronavirus case emerges after bus summit"
"https://www.newsweek.com/face-mask-shortages-amid-coronavirus-outbreak-mean-dentists-uk-may-need-stop-working-1487305","https://www.newsweek.com/face-mask-shortages-amid-coronavirus-outbreak-mean-dentists-uk-may-need-stop-working-1487305?amp=1","2020-02-14 13:00:00","Face Mask Shortages Amid Coronavirus Outbreak Mean Dentists in U . K . May Need to Stop Working"
"https://tsn.ua/tsikavinki/ne-pidhopi-koronavirus-na-filippinah-floristka-robit-buketi-z-maskoyu-i-rukavichkami-1491408.html","","2020-02-14 11:00:00","  Не підхопи коронавірус : на Філіппінах флористка робить букети з маскою і рукавичками"
"https://www.eltiempo.com/mundo/asia/que-ha-pasado-con-el-crucero-en-cuarentena-en-japon-por-el-coronavirus-462160","https://www.eltiempo.com/amp/mundo/asia/que-ha-pasado-con-el-crucero-en-cuarentena-en-japon-por-el-coronavirus-462160","2020-02-14 18:30:00"," ¿ Qué ha pasado con el crucero en cuarentena en Japón por el coronavirus ? - Asia - Internacional"
"https://tsn.ua/ru/tsikavinki/ne-podhvati-koronavirus-na-filippinah-florist-delaet-bukety-s-maskoy-i-perchatkami-1491408.html","","2020-02-14 12:30:00","  Не подхвати коронавирус : на Филиппинах флорист делает букеты с маской и перчатками"
"https://www.heraldmailmedia.com/news/nation/coronavirus-fears-expose-cultural-divide-over-masks-in-california-s/article_1b95eb20-8072-5874-b759-8f5b1a96ff62.html","","2020-02-14 14:30:00","Coronavirus fears expose cultural divide over masks in California San Gabriel Valley | National"
"https://ria.ru/20200214/1564806549.html","https://ria.ru/amp/20200214/1564806549.html","2020-02-14 20:45:00","Депутаты местного совета Киева отказались принимать украинцев из Уханя"
"http://www.taipeitimes.com/News/biz/archives/2020/02/15/2003730995","","2020-02-14 16:15:00","Penny stock up 192 % as it enters mask market"
"https://www.tricitynews.com/cp-newsalert-fifth-person-in-b-c-presumptively-confirmed-for-new-coronavirus-1.24076816","","2020-02-14 21:45:00","CP NewsAlert : Fifth person in B . C . presumptively confirmed for new coronavirus"
"https://www.msn.com/en-za/health/medical/coronavirus-is-spreading-because-humans-are-healthier/ar-BBZYiKw","","2020-02-14 05:00:00","Coronavirus Is Spreading Because Humans Are Healthier"
"https://www.thedrinksbusiness.com/2020/02/how-the-coronavirus-is-affecting-the-drinks-industry/","","2020-02-14 10:30:00","How the coronavirus is affecting the drinks industry"
"https://www.thesun.co.uk/news/10962320/coronavirus-panic-london-symptoms/","https://www.thesun.co.uk/news/10962320/coronavirus-panic-london-symptoms/amp/","2020-02-14 12:00:00","Coronavirus panic in London : The 5 symptoms to watch for – as race to trace hundreds at risk begins – The Sun"
"https://www.msn.com/en-ca/news/canada/woman-returning-from-shanghai-becomes-bcs-5th-presumptive-coronavirus-case/ar-BB100R6Z","","2020-02-14 23:15:00","Woman returning from Shanghai becomes B . C . 5th presumptive coronavirus case"
"https://www.forbes.com/sites/kenrapoza/2020/02/14/everything-riding-on-china-leader-xi-jinping-to-get-coronavirus-contained/","https://www.forbes.com/sites/kenrapoza/2020/02/14/everything-riding-on-china-leader-xi-jinping-to-get-coronavirus-contained/amp/","2020-02-14 19:00:00","Everything Riding On China Leader Xi Jinping To Get Coronavirus Contained"
"https://gulfnews.com/world/asia/watch-love-in-the-time-of-coronavirus-1.1581660584363","https://gulfnews.com/amp/world/asia/watch-love-in-the-time-of-coronavirus-1.1581660584363","2020-02-14 11:00:00","Watch : Love in the time of coronavirus"
"https://gulfnews.com/world/asia/love-in-the-time-of-coronavirus-a-quiet-valentines-day-in-china-1.1581660584363","https://gulfnews.com/amp/world/asia/love-in-the-time-of-coronavirus-a-quiet-valentines-day-in-china-1.1581660584363","2020-02-14 06:45:00","Love in the time of coronavirus : A quiet Valentine Day in China"
"https://www.660citynews.com/2020/02/14/cp-newsalert-fifth-person-in-b-c-presumptively-confirmed-for-new-coronavirus/","https://www.660citynews.com/2020/02/14/cp-newsalert-fifth-person-in-b-c-presumptively-confirmed-for-new-coronavirus/amp/","2020-02-14 22:45:00","Fifth person in B . C . presumptively confirmed for new coronavirus"
"https://www.airdrietoday.com/national-news/cp-newsalert-fifth-person-in-bc-presumptively-confirmed-for-new-coronavirus-2095035","","2020-02-14 22:15:00","CP NewsAlert : Fifth person in B . C . presumptively confirmed for new coronavirus"
"https://toronto.citynews.ca/2020/02/14/cp-newsalert-fifth-person-in-b-c-presumptively-confirmed-for-new-coronavirus/","https://toronto.citynews.ca/2020/02/14/cp-newsalert-fifth-person-in-b-c-presumptively-confirmed-for-new-coronavirus/amp/","2020-02-14 23:15:00","CP NewsAlert : Fifth person in B . C . presumptively confirmed for new coronavirus"
"https://www.thesun.ie/news/5098298/coronavirus-panic-in-london-the-5-symptoms-to-watch-for-as-race-to-trace-hundreds-at-risk-begins/","https://www.thesun.ie/news/5098298/coronavirus-panic-in-london-the-5-symptoms-to-watch-for-as-race-to-trace-hundreds-at-risk-begins/amp/","2020-02-14 12:00:00","Coronavirus panic in London : The 5 symptoms to watch for – as race to trace hundreds at risk begins – The Irish Sun"
"https://www.thebeijinger.com/blog/2020/02/14/can-masks-protect-you-coronavirus","","2020-02-14 01:00:00","Can Masks Protect You From the Coronavirus ? "
"https://www.yourlocalguardian.co.uk/news/national/18236667.hundreds-people-contacted-coronavirus-case-emerges-bus-summit/","","2020-02-14 15:45:00","Hundreds of people contacted as coronavirus case emerges after bus summit"
"https://news.yahoo.com/experts-weigh-coronavirus-may-may-214207874.html","https://news.yahoo.com/amphtml/experts-weigh-coronavirus-may-may-214207874.html","2020-02-14 22:15:00","Experts weigh in on how coronavirus may , or may not , run rampant in US in coming months"
"https://www.dailymail.co.uk/news/article-8002413/Michigan-woman-says-bank-teller-called-cops-refused-coronavirus-mask.html","https://www.dailymail.co.uk/news/article-8002413/amp/Michigan-woman-says-bank-teller-called-cops-refused-coronavirus-mask.html","2020-02-14 02:45:00","Michigan woman says bank teller called the cops after she refused to take off coronavirus mask"
"https://www.greeleytribune.com/news/public-forum-on-coronavirus-outbreak-to-feature-panel-of-researchers-from-colorado-state-university/","","2020-02-14 17:45:00","Public forum on Coronavirus outbreak to feature panel of researchers from Colorado State University"
"https://medicinehatnews.com/news/national-news/2020/02/14/cp-newsalert-fifth-person-in-bc-presumptively-confirmed-for-new-coronavirus/","","2020-02-14 22:00:00","CP NewsAlert : Fifth person in B . C . presumptively confirmed for new coronavirus - Medicine Hat NewsMedicine Hat News"
"https://www.komando.com/social-media/youtube-coronavirus-stunt/706862/","https://www.komando.com/social-media/youtube-coronavirus-stunt/706862/?amp","2020-02-14 08:45:00","Man arrested after stupid YouTube coronavirus stunt"
"https://www.thestar.com.my/news/nation/2020/02/14/sibu-tower-run-2020-to-proceed-on-march-8-despite-covid-19-coronavirus-outbreak","","2020-02-14 05:45:00","Sibu Tower Run 2020 to proceed on March 8 despite Covid - 19 coronavirus outbreak"
"https://g1.globo.com/ciencia-e-saude/noticia/2020/02/14/china-reduz-para-1380-o-numero-mortos-por-coronavirus-apos-rever-dados.ghtml","https://g1.globo.com/google/amp/ciencia-e-saude/noticia/2020/02/14/china-reduz-para-1380-o-numero-mortos-por-coronavirus-apos-rever-dados.ghtml","2020-02-14 08:00:00","China reduz para 1 . 380 o número mortos por coronavírus após rever dados"
"https://www.foxla.com/news/la-officials-fear-spread-of-anti-asian-racism-fueled-by-coronavirus-worries","https://www.foxla.com/news/la-officials-fear-spread-of-anti-asian-racism-fueled-by-coronavirus-worries.amp","2020-02-14 01:00:00","LA officials fear spread of anti - Asian racism fueled by coronavirus worries"
"https://www.newsweek.com/coronavirus-travel-advice-how-minimize-exposure-risks-airports-planes-cruises-1487311","https://www.newsweek.com/coronavirus-travel-advice-how-minimize-exposure-risks-airports-planes-cruises-1487311?amp=1","2020-02-14 13:00:00","Coronavirus Travel Advice : How to Minimize Exposure While Traveling , Including at Airports , on Planes and Cruises"
"https://www.msn.com/en-xl/news/other/coronavirus-egypt-records-africas-first-case/ar-BBZSxli","","2020-02-14 19:45:00","Coronavirus : Egypt records Africa first case"
"https://www.nbclosangeles.com/news/coronavirus-anti-asian-racism-los-angeles/2309225/","https://www.nbclosangeles.com/news/coronavirus-anti-asian-racism-los-angeles/2309225/?amp","2020-02-14 00:30:00","LA Community Leaders Worry Anti - Asian Racism is Being Fueled by Coronavirus Panic"
"https://www.mobihealthnews.com/news/roundup-techs-role-tracking-testing-treating-covid-19","","2020-02-14 23:45:00","Roundup : Tech role in tracking , testing , treating COVID - 19"
"https://www.nbcbayarea.com/news/national-international/coronavirus-anti-asian-racism-los-angeles/2234056/","https://www.nbcbayarea.com/news/national-international/coronavirus-anti-asian-racism-los-angeles/2234056/?amp","2020-02-14 12:00:00","LA Community Leaders Worry Anti - Asian Racism is Being Fueled by Coronavirus Panic"
"https://www.standard.co.uk/news/uk/coronavirus-covid-19-china-uk-british-dentists-a4361806.html","https://www.standard.co.uk/news/uk/coronavirus-covid-19-china-uk-british-dentists-a4361806.html?amp","2020-02-14 08:30:00","Coronavirus latest : British dentists could stop treating patients due to mask shortage as Covid - 19 cripples Chinese supply line"
"https://infotel.ca/newsitem/cda-coronavirus-bc/cp1740790991","","2020-02-14 23:00:00","Fifth person tests positive in B . C . for new coronavirus after return from China"
"https://www.standard.co.uk/news/uk/coronavirus-uk-patients-baby-test-result-west-sussex-a4361771.html","https://www.standard.co.uk/news/uk/coronavirus-uk-patients-baby-test-result-west-sussex-a4361771.html?amp","2020-02-14 06:15:00","Mother  terrified  as eight - month - old baby tested for coronavirus after being treated by infected doctor"
"https://www.elcorreogallego.es/tendencias/ecg/covid-19-mobile-no-puede-permitirse-imprevistos-exito-sus-objetivos/idEdicion-2020-02-14/idNoticia-1229836/","https://www.elcorreogallego.es/tendencias/ecg/covid-19-mobile-no-puede-permitirse-imprevistos-exito-sus-objetivos/idEdicion-2020-02-14/idNoticia-1229836/amp","2020-02-14 02:30:00","  Con el COVID - 19 , el Mobile no puede permitirse imprevistos en el éxito de sus objetivos  "
"https://www.theepochtimes.com/world-health-organization-denies-advising-ioc-against-delaying-or-canceling-olympics_3238459.html","https://www.theepochtimes.com/world-health-organization-denies-advising-ioc-against-delaying-or-canceling-olympics_3238459.html/amp","2020-02-14 18:15:00","World Health Organization Denies Advising IOC Against Delaying or Canceling Olympics"
"https://www.theepochtimes.com/us-will-test-people-with-flu-like-symptoms-for-new-coronavirus_3238670.html","https://www.theepochtimes.com/us-will-test-people-with-flu-like-symptoms-for-new-coronavirus_3238670.html/amp","2020-02-14 23:00:00","US Will Test People With Flu - Like Symptoms for New Coronavirus"
"https://foxwilmington.com/headlines/cats-are-wearing-coronavirus-masks-in-china/","","2020-02-14 18:00:00","Cats are wearing coronavirus masks in China | Fox Wilmington WSFX - TV"
"https://larouchepub.com/pr/2020/200213_mobilize.html","","2020-02-14 19:30:00","Epidemiologist Argues , U . S . Must Mobilize Public Health To Face Novel Coronavirus"
"https://g1.globo.com/sp/sorocaba-jundiai/noticia/2020/02/14/secretaria-de-saude-descarta-caso-suspeito-de-coronavirus-em-porto-feliz.ghtml","https://g1.globo.com/google/amp/sp/sorocaba-jundiai/noticia/2020/02/14/secretaria-de-saude-descarta-caso-suspeito-de-coronavirus-em-porto-feliz.ghtml","2020-02-14 15:15:00","Secretaria de Saúde descarta caso suspeito de coronavírus em Porto Feliz"
"https://infotel.ca/newsitem/dentists-worried-about-shortage-of-masks-in-light-of-new-coronavirus-outbreak/it70347","","2020-02-14 01:30:00","Dentists worried about shortage of masks in light of new coronavirus outbreak"
"https://www.msn.com/en-ca/news/canada/fifth-person-tests-positive-in-bc-for-new-coronavirus-after-return-from-china/ar-BB100Ms1","","2020-02-14 22:15:00","Fifth person tests positive in B . C . for new coronavirus after return from China"
"https://ura.news/news/1052418822","{{ (metaService && metaService.ampUrl()) ? metaService.ampUrl() : https://amp.ura.news/news/1052418822 }}","2020-02-14 02:30:00","Вирусолог предупредил об угрозе заражения коронавирусом двух третей населения Земли"
"https://ua.korrespondent.net/world/4194048-koronavirus-marketynh-chy-masova-zahroza","https://korrespondent.net/amp/4194048-koronavirus-marketynh-chy-masova-zahroza","2020-02-14 19:30:00","Коронавірус . Маркетинг чи масова загроза ? "
"https://www.independent.co.uk/news/uk/politics/coronavirus-labour-mp-alex-sobel-westminster-london-latest-a9335966.html","https://www.independent.co.uk/news/uk/politics/coronavirus-labour-mp-alex-sobel-westminster-london-latest-a9335966.html?amp","2020-02-14 16:45:00","Labour MP to be tested for coronavirus"
"http://www.xinhuanet.com/english/2020-02/14/c_138784427.htm","","2020-02-14 16:45:00","First mask production line operational in Hainan - Xinhua"
"http://www.taipeitimes.com/News/front/archives/2020/02/15/2003731015","","2020-02-14 16:15:00","Virus Outbreak : Taiwan to become world No . 2 in mask production"
"https://vz.ru/news/2020/2/14/1023822.html","https://vz.ru/amp/news/2020/2/14/1023822.html","2020-02-14 12:15:00","ВЗГЛЯД / Онищенко объяснил , почему не носит маску"
"https://www.ndtv.com/offbeat/pets-in-china-wear-face-masks-amid-coronavirus-crisis-2180053","https://www.ndtv.com/offbeat/pets-in-china-wear-face-masks-amid-coronavirus-crisis-2180053?amp=1 -rum=off","2020-02-14 08:30:00","Pets In China Wear Face Masks Amid Coronavirus Crisis"
"https://www.msf.ie/article/msf-update-covid-19-coronavirus-outbreak","","2020-02-14 16:15:00","MSF update on COVID - 19 coronavirus outbreak"
"https://www.standard.co.uk/news/london/coronavirus-london-summit-mp-victim-a4362206.html","https://www.standard.co.uk/news/london/coronavirus-london-summit-mp-victim-a4362206.html?amp","2020-02-14 12:45:00","Coronavirus hits Westminster as victim linked to super - spreader attended same London summit as MP and minister"
"https://www.vancourier.com/fifth-person-tests-positive-in-b-c-for-new-coronavirus-after-return-from-china-1.24076816","","2020-02-14 22:00:00","Fifth person tests positive in B . C . for new coronavirus after return from China"
"https://www.timescolonist.com/fifth-person-tests-positive-in-b-c-for-new-coronavirus-after-return-from-china-1.24076816","","2020-02-14 22:15:00","Fifth person tests positive in B . C . for new coronavirus after return from China"
"https://korrespondent.net/world/4194048-koronavyrus-marketynh-yly-massovaia-uhroza","https://korrespondent.net/amp/4194048-koronavyrus-marketynh-yly-massovaia-uhroza","2020-02-14 19:15:00","Коронавирус . Маркетинг или массовая угроза ? "
"https://www.infox.ru/news/283/230839-uberegut-li-maski-ot-koronavirusa","https://m.infox.ru/news/283/230839-uberegut-li-maski-ot-koronavirusa/amp","2020-02-14 22:15:00","Уберегут ли маски от коронавируса"
"http://news.bigmir.net/world/1979425-Koronavirys-Marketing-ili-massovaya-ygroza","http://amp.news.bigmir.net/world/1979425-Koronavirys-Marketing-ili-massovaya-ygroza","2020-02-14 20:00:00","Коронавирус . Маркетинг или массовая угроза ? "
"https://www.businessinsider.com/wuhan-coronavirus-london-patient-took-uber-hospital-2020-2","https://www.businessinsider.com/wuhan-coronavirus-london-patient-took-uber-hospital-2020-2?amp","2020-02-14 14:15:00","Wuhan coronavirus : London patient took Uber to hospital against advice"
"https://ura.news/news/1052418884","{{ (metaService && metaService.ampUrl()) ? metaService.ampUrl() : https://amp.ura.news/news/1052418884 }}","2020-02-14 10:00:00","Вирусолог оценил возможность заражения двух третей жителей Земли коронавирусом"
"https://www.businessinsider.in/science/news/the-coronavirus-patient-in-london-showed-up-at-the-hospital-in-an-uber-and-health-officials-say-its-a-sign-people-arent-following-advice-to-contain-the-virus/articleshow/74138532.cms","https://www.businessinsider.in/science/news/the-coronavirus-patient-in-london-showed-up-at-the-hospital-in-an-uber-and-health-officials-say-its-a-sign-people-arent-following-advice-to-contain-the-virus/amp_articleshow/74138532.cms","2020-02-14 14:45:00","The coronavirus patient in London showed up at the hospital in an Uber , and health officials say it a sign people arent following advice to contain the virus"
"https://www.rappler.com/world/regions/europe/251868-russian-woman-faces-court-fleeing-virus-quarantine","https://amp.rappler.com/world/regions/europe/251868-russian-woman-faces-court-fleeing-virus-quarantine","2020-02-14 15:30:00","Russian woman faces court for fleeing virus quarantine"
"https://noticias.uol.com.br/saude/ultimas-noticias/afp/2020/02/14/egito-confirma-primeiro-caso-de-novo-coronavirus-na-africa.htm","https://noticias.uol.com.br/saude/ultimas-noticias/afp/2020/02/14/egito-confirma-primeiro-caso-de-novo-coronavirus-na-africa.amp.htm","2020-02-14 19:00:00","Coronavírus : Egito confirma primeiro caso de covid - 19 na África"
"https://www.aol.co.uk/news/2020/02/14/coronavirus-valentinea-s-celebrations-for-passengers-of-quaran/","https://www.aol.co.uk/amp/2020/02/14/coronavirus-valentinea-s-celebrations-for-passengers-of-quaran/","2020-02-14 15:00:00","Coronavirus : Valentine celebrations for passengers of quarantined cruise ship"
"https://www.independent.co.uk/news/world/asia/coronavirus-china-virus-symptoms-beijing-holiday-quarantine-isolation-return-a9336886.html","https://www.independent.co.uk/news/world/asia/coronavirus-china-virus-symptoms-beijing-holiday-quarantine-isolation-return-a9336886.html?amp","2020-02-14 19:45:00","Coronavirus : Everyone returning to Beijing must go into quarantine or be punished , China warns"
"https://www.deccanchronicle.com/world/asia/140220/japan-allows-elderly-passengers-to-leave-ship-for-quarantine-on-land.html","https://www.deccanchronicle.com/amp/world/asia/140220/japan-allows-elderly-passengers-to-leave-ship-for-quarantine-on-land.html","2020-02-14 14:00:00","Japan allows elderly passengers to leave ship for quarantine on land"
"https://www.sunstar.com.ph/article/1844310/Cebu/Local-News/Bizman-translates-Matud-Nila-to-Chinese-asks-for-solidarity-amid-Covid-19-scare","","2020-02-14 10:00:00","Bizman translates  Matud Nila  to Chinese , asks for solidarity amid Covid - 19 scare"
"http://en.people.cn/n3/2020/0214/c90000-9657761.html","","2020-02-14 11:15:00","Valentine Day : Love is not isolated - People Daily Online"
"https://news.ltn.com.tw/news/focus/breakingnews/3068648","https://news.ltn.com.tw/amp/news/focus/breakingnews/3068648","2020-02-14 19:30:00"," 《 TAIPEI TIMES 》 Taiwan to become world No . 2 in mask production - 焦點"
"https://www.insideedition.com/from-bat-soup-to-drinking-bleach-debunking-coronavirus-myths-58307","https://www.insideedition.com/from-bat-soup-to-drinking-bleach-debunking-coronavirus-myths-58307?amp","2020-02-14 17:30:00","Debunking Coronavirus Myths from  Bat Soup  to Drinking Bleach"
"https://www.insideedition.com/5-myths-about-coronavirus-debunked-58307","https://www.insideedition.com/5-myths-about-coronavirus-debunked-58307?amp","2020-02-14 22:00:00","Debunking Coronavirus Myths :  Bat Soup , Bleach and Face Masks"
"https://www.timesnownews.com/health/article/the-ailment-caused-by-novel-coronavirus-now-has-a-name-how-diseases-are-named-and-why-it-matters/553532","https://www.timesnownews.com/amp/health/article/the-ailment-caused-by-novel-coronavirus-now-has-a-name-how-diseases-are-named-and-why-it-matters/553532","2020-02-14 10:15:00","World Health Organization : The ailment caused by novel coronavirus now has a name : How diseases are named – and why it matters"
"http://www.slate.fr/story/187437/coronavirus-covid-19-chine-wuhan-pekin-shanghai-censure-crise-economique","https://www.slate.fr/story/187437/coronavirus-covid-19-chine-wuhan-pekin-shanghai-censure-crise-economique?amp","2020-02-14 06:45:00","Face au coronavirus , le gouvernement chinois essaie de tenir le coup"
"https://www.dailymail.co.uk/news/article-8004099/Chinese-coronavirus-doctor-goes-work-husband-drives-protect-her.html","https://www.dailymail.co.uk/news/article-8004099/amp/Chinese-coronavirus-doctor-goes-work-husband-drives-protect-her.html","2020-02-14 15:45:00","Chinese coronavirus doctor goes to work while husband drives behind"
