URL,MobileURL,Date,Title
"https://noticias.uol.com.br/ultimas-noticias/rfi/2020/02/10/coronavirus-de-mascara-xi-jinping-pede-medidas-fortes-e-decisivas.htm","https://noticias.uol.com.br/ultimas-noticias/rfi/2020/02/10/coronavirus-de-mascara-xi-jinping-pede-medidas-fortes-e-decisivas.amp.htm","2020-02-10 22:15:00","Coronavírus : de máscara , Xi Jinping pede  medidas fortes e decisivas  "
"https://www.independent.co.uk/travel/news-and-advice/coronavirus-wuhan-cathay-pacific-centers-disease-control-easyjet-foreign-office-a9327081.html","https://www.independent.co.uk/travel/news-and-advice/coronavirus-wuhan-cathay-pacific-centers-disease-control-easyjet-foreign-office-a9327081.html?amp","2020-02-10 23:00:00","Coronavirus : Is it dangerous to fly with an infected passenger and is it safe to travel to southeast Asia ? "
"https://www.independent.co.uk/voices/coronavirus-uk-quarantine-singapore-france-china-symptoms-a9327251.html","https://www.independent.co.uk/voices/coronavirus-uk-quarantine-singapore-france-china-symptoms-a9327251.html?amp","2020-02-10 14:15:00","The united kingdom only has one real immediate defence against the coronavirus – total quarantine"
"https://primicia.com.ve/mundo/coronavirus-deja-900-muertos-en-china/","","2020-02-10 20:15:00","Coronavirus deja 900 muertos en China - Diario Primicia"
"https://www.msn.com/en-gb/finance/other/stocks-slip-as-uk-declares-coronavirus-imminent-threat/ar-BBZPzaC","","2020-02-10 11:00:00","Stocks slip as united kingdom declares coronavirus  imminent threat  "
"http://www.msn.com/en-nz/news/world/coronavirus-103-new-deaths-as-chinese-death-toll-tops-1000/ar-BBZRjaD","","2020-02-11 00:00:00","Coronavirus : 103 new deaths as Chinese death toll tops 1 , 000"
"https://www.straitstimes.com/lifestyle/should-you-wear-a-mask","","2020-02-10 06:15:00","Coronavirus : Should you wear a mask ? "
"https://noticias.r7.com/saude/coronavirus-de-banheiros-separados-a-conversas-restritas-as-recomendacoes-do-ministerio-da-saude-para-a-viagem-dos-brasileiros-repatriados-de-wuhan-09022020","https://noticias.r7.com/saude/coronavirus-de-banheiros-separados-a-conversas-restritas-as-recomendacoes-do-ministerio-da-saude-para-a-viagem-dos-brasileiros-repatriados-de-wuhan-09022020?amp","2020-02-10 11:00:00","Coronavírus : De banheiros separados a conversas restritas , as recomendaes do ministério da Saúde para a viagem dos brasileiros repatriados de Wuhan"
"https://www.laestrella.com.pa/internacional/mundo/200210/coronavirus-xi-jinping-reaparece-publico-mascarilla-dias-reclusion","https://www.laestrella.com.pa/amp/internacional/mundo/200210/coronavirus-xi-jinping-reaparece-publico-mascarilla-dias-reclusion","2020-02-10 20:15:00","Coronavirus : Xi Jinping reaparece en público con mascarilla , tras varios días de reclusión"
"https://sib.fm/news/2020/02/10/biznes-na-koronaviruse-kak-v-internete-zarabatyvayut-na-zagovorennyh-nastojkah-tselebnom-chesnoke-i-okamenevshih-mollyuskah","","2020-02-10 09:30:00","Бизнес на коронавирусе : как в интернете зарабатывают на заговорённых настойках , целебном чесноке и окаменевших моллюсках"
"https://www.mk.ru/incident/2020/02/10/tadzhikskiy-pranker-symitirovavshiy-v-metro-simptomy-koronavirusa-poydet-pod-sud.html","https://www.mk.ru/amp/incident/2020/02/10/tadzhikskiy-pranker-symitirovavshiy-v-metro-simptomy-koronavirusa-poydet-pod-sud.html","2020-02-10 14:45:00","Таджикский пранкер , сымитировавший в метро симптомы коронавируса , пойдет под суд"
"https://abc11.com/bbb-warns-of-phony-face-masks-amid-coronavirus-concerns/5915874/","https://abc11.com/amp/5915874","2020-02-10 01:00:00","Coronavirus outbreak : BBB warns of phony face masks , other scams amid heightened concerns"
"https://abc13.com/bbb-warns-of-phony-face-masks-amid-coronavirus-concerns/5915874/","https://abc13.com/amp/5915874","2020-02-10 00:00:00","Coronavirus outbreak : BBB warns of phony face masks , other scams amid heightened concerns"
"https://abc7chicago.com/bbb-warns-of-phony-face-masks-amid-coronavirus-concerns/5915874/","https://abc7chicago.com/amp/5915874","2020-02-10 00:45:00","Coronavirus outbreak : BBB warns of phony face masks , other scams amid heightened concerns"
"https://abc7chicago.com/abc7chicago.com/bbb-warns-of-phony-face-masks-amid-coronavirus-concerns/5915874/","https://abc7chicago.com/amp/5915874","2020-02-10 05:15:00","Coronavirus outbreak : BBB warns of phony face masks , other scams amid heightened concerns"
"https://otr-online.ru/news/policeyskie-zaderzhali-rossiyanina-izobrazhavshego-bolnogo-koronavirusom-v-metro-146430.html","","2020-02-10 14:00:00","Полицейские задержали россиянина , изображавшего больного коронавирусом в метро | Новости | ОТР"
"https://www.dailystar.co.uk/news/world-news/beloved-chinese-bodybuilder-dies-coronavirus-21471597","https://www.dailystar.co.uk/news/world-news/beloved-chinese-bodybuilder-dies-coronavirus-21471597.amp","2020-02-11 00:00:00","Beloved bodybuilder dies of coronavirus after refusing to wear mask"
"https://utro.ru/life/2020/02/10/1434763.shtml","https://utro.ru/amp/life/2020/02/10/1434763.shtml","2020-02-10 13:45:00","Коронавирус в России 2020 : профилактика алкоголем , последние новости"
"https://abc7ny.com/bbb-warns-of-phony-face-masks-amid-coronavirus-concerns/5915874/","https://abc7ny.com/amp/5915874","2020-02-10 00:00:00","Coronavirus outbreak : BBB warns of phony face masks , other scams amid heightened concerns"
"https://abc7news.com/bbb-warns-of-phony-face-masks-amid-coronavirus-concerns/5915874/","https://abc7news.com/amp/5915874","2020-02-10 00:00:00","Coronavirus outbreak : BBB warns of phony face masks , other scams amid heightened concerns"
"https://www.segs.com.br/saude/215731-hdt-em-parceria-com-a-sociedade-goiana-de-infectologia-realiza-palestra-sobre-coronavirus-e-febre-hemorragica-brasileira","https://www.segs.com.br/saude/215731-hdt-em-parceria-com-a-sociedade-goiana-de-infectologia-realiza-palestra-sobre-coronavirus-e-febre-hemorragica-brasileira/amp","2020-02-10 17:45:00","HDT em parceria com a Sociedade Goiana de Infectologia realiza palestra sobre coronavírus e febre hemorrágica brasileira"
"https://www.contextotucuman.com/nota/178340/900-muertos-por-coronavirus-en-china-el-presidente-aparece-con-mascara.html","https://www.contextotucuman.com/nota/178340/900-muertos-por-coronavirus-en-china-el-presidente-aparece-con-mascara.html/amp","2020-02-10 22:00:00","900 muertos por coronavirus en China : el presidente aparece con máscara"
"https://noticias.uol.com.br/ultimas-noticias/afp/2020/02/10/coronavirus-deixa-mais-de-900-mortos-presidente-chines-aparece-com-mascara.htm","https://noticias.uol.com.br/ultimas-noticias/afp/2020/02/10/coronavirus-deixa-mais-de-900-mortos-presidente-chines-aparece-com-mascara.amp.htm","2020-02-10 17:15:00","Coronavírus deixa mais de 900 mortos ; presidente chinês aparece com máscara"
"https://www.voanews.com/science-health/coronavirus-outbreak/taiwanese-scramble-face-masks-stop-deadly-virus-nearby-china","https://www.voanews.com/science-health/coronavirus-outbreak/taiwanese-scramble-face-masks-stop-deadly-virus-nearby-china?amp","2020-02-10 21:00:00","Taiwanese Scramble for Face Masks to Stop Deadly Virus From Nearby China"
"https://www.voanews.com/science-health/coronavirus-outbreak/taiwanese-go-wild-face-masks-stop-deadly-virus-nearby-china","https://www.voanews.com/science-health/coronavirus-outbreak/taiwanese-go-wild-face-masks-stop-deadly-virus-nearby-china?amp","2020-02-10 08:45:00","Taiwanese Go Wild for Face Masks to Stop Deadly Virus from Nearby China"
"https://www.publimetro.cl/cl/noticias/2020/02/10/predicando-ejemplo-presidente-chino-aparece-mascarilla-visita-hospital.html","https://www.publimetro.cl/cl/metroamp/noticias/2020/02/10/predicando-ejemplo-presidente-chino-aparece-mascarilla-visita-hospital.html","2020-02-10 21:30:00","Predicando con el ejemplo : Presidente chino aparece con mascarilla en visita a hospital"
"https://www.mskagency.ru/materials/2972029","","2020-02-10 14:00:00","В Мосгордуме заявили , что дорогие одноразовые медицинские маски не эффективнее дешевых"
"https://defimedia.info/coronavirus-908-morts-le-president-chinois-pour-des-mesures-plus-fortes","","2020-02-10 18:15:00","Coronavirus : 908 morts , le président chinois pour des mesures « plus fortes » "
"https://ren.tv/news/v-mire/659340-stseny-potseluev-nachali-vyrezat-iz-filmov-dlia-borby-s-koronavirusom","","2020-02-10 20:15:00","Сцены поцелуев начали вырезать из фильмов для борьбы с коронавирусом"
"https://www.independent.co.uk/news/world/americas/flu-children-us-deaths-outbreak-america-why-coronavirus-a9323866.html","https://www.independent.co.uk/news/world/americas/flu-children-us-deaths-outbreak-america-why-coronavirus-a9323866.html?amp","2020-02-10 16:15:00","Why is the flu killing so many American children ? "
"https://de.reuters.com/news/picture/passengers-quarantined-on-coronavirus-hi-idUKRTS315C8","","2020-02-10 23:00:00","Passengers quarantined on coronavirus - hit cruise ship off Japan"
"https://www.ideal.es/sociedad/salud/china-cree-incubacion-20200211224245-ntrc.html","https://www.ideal.es/sociedad/salud/china-cree-incubacion-20200211224245-ntrc_amp.html","2020-02-11 00:00:00","China cree que la incubación del coronavirus alcanza los 24 días"
"https://www.soyacincau.com/2020/02/10/lazada-face-masks-flash-sale-malaysia/","","2020-02-10 10:30:00","Lazada restocks face masks ; wants you to report overcharging sellers"
"https://uk.reuters.com/article/uk-china-health-britain/uk-declares-coronavirus-a-serious-and-imminent-threat-to-public-health-idUKKBN2040OJ","https://uk.mobile.reuters.com/article/amp/idUKKBN2040OJ","2020-02-10 07:45:00","UK declares coronavirus a serious and imminent threat to public health"
"https://regnum.ru/news/accidents/2853518.html","","2020-02-10 05:30:00","Студенты из РФ жалуются на карантинные репрессии в китайском вузе"
"https://www.elnortedecastilla.es/sociedad/salud/china-cree-incubacion-20200211224245-ntrc.html","https://www.elnortedecastilla.es/sociedad/salud/china-cree-incubacion-20200211224245-ntrc_amp.html","2020-02-10 23:45:00","China cree que la incubación del coronavirus alcanza los 24 días"
"https://www.bfm.ru/news/436168","https://www.bfm.ru/amp/news/436168","2020-02-10 07:15:00","В Хабаровске работников транспорта , торговых центров , банков , врачей обязали носить маски"
"https://www.aceshowbiz.com/news/view/00148884.html","https://www.aceshowbiz.com/amp/news/view/00148884.html","2020-02-10 03:30:00","Kash Doll Called Racist for Making Coronavirus Joke With Disney Princess Meme"
"https://gorod.lv/novosti/309518-sprognozirovan-pik-rasprostraneniya-smertelnogo-kitaiskogo-virusa","https://gorod.lv/novosti/309518-sprognozirovan-pik-rasprostraneniya-smertelnogo-kitaiskogo-virusa.amp","2020-02-10 09:45:00","Спрогнозирован пик распространения смертельного китайского вируса"
"https://www.reuters.com/article/us-china-health-xi-outbreak/chinas-xi-says-to-prevent-large-scale-layoffs-amid-coronavirus-outbreak-idUSKBN20419E","https://mobile.reuters.com/article/amp/idUSKBN20419E","2020-02-10 12:00:00","China Xi says to prevent large - scale layoffs amid coronavirus outbreak"
"https://www.contextotucuman.com/nota/178266/coronavirus-deja-900-muertos-en-china-el-presidente-aparece-con-mascara-por-primera-vez.html","https://www.contextotucuman.com/nota/178266/coronavirus-deja-900-muertos-en-china-el-presidente-aparece-con-mascara-por-primera-vez.html/amp","2020-02-10 18:15:00","Coronavirus deja 900 muertos en China : el presidente aparece con máscara por primera vez"
"https://iz.ru/974557/2020-02-10/v-moskve-zaderzhali-eshche-dvukh-uchastnikov-pranka-pro-koronavirus","https://iz.ru/export/google/amp/974557","2020-02-10 18:15:00","В Москве задержали еще двух участников пранка про коронавирус"
"https://www.ferra.ru/news/techlife/koronavirus-vynudil-xiaomi-zalezt-v-dolgi-10-02-2020.htm","https://www.ferra.ru/amp/news/techlife/koronavirus-vynudil-xiaomi-zalezt-v-dolgi-10-02-2020.htm","2020-02-10 20:45:00","Коронавирус вынудил Xiaomi залезть в долги"
"https://www.larazon.es/internacional/20200210/f6yizl4xefbtxadb5uaxfg2c4u.html","https://www.larazon.es/internacional/20200210/f6yizl4xefbtxadb5uaxfg2c4u.html?outputType=amp","2020-02-10 20:15:00","Los drones que gritan a los chinos por el coronavirus"
"https://gulfnews.com/uae/health/disgarded-coronavirus-face-masks-a-safety-hazard-say-abu-dhabi-residents-doctors-1.69621922","https://gulfnews.com/amp/uae/health/disgarded-coronavirus-face-masks-a-safety-hazard-say-abu-dhabi-residents-doctors-1.69621922","2020-02-10 12:30:00","Disgarded coronavirus face masks a safety hazard , say Abu Dhabi residents , doctors"
"https://gulfnews.com/uae/health/discarded-coronavirus-face-masks-a-safety-hazard-say-abu-dhabi-residents-doctors-1.69621922","https://gulfnews.com/amp/uae/health/discarded-coronavirus-face-masks-a-safety-hazard-say-abu-dhabi-residents-doctors-1.69621922","2020-02-10 16:45:00","Discarded coronavirus face masks a safety hazard , say Abu Dhabi residents , doctors"
"https://www.prisonplanet.com/china-woman-falls-to-her-death-trying-to-escape-coronavirus-quarantine.html","","2020-02-10 20:15:00","Prison Planet . com » China : Woman Falls to Her Death Trying to Escape Coronavirus Quarantine"
"https://lenta.ru/news/2020/02/10/alko_vir/","https://m.lenta.ru/news/2020/02/10/alko_vir/amp/","2020-02-10 09:30:00","Россиянам раскрыли влияние алкоголя на коронавирус"
"https://www.thesun.co.uk/news/10913096/coronavirus-uk-china-wuhan-live-updates/","https://www.thesun.co.uk/news/10913096/coronavirus-uk-china-wuhan-live-updates/amp/","2020-02-10 15:45:00","Coronavirus LIVE updates : Brighton GP surgery forced to CLOSE as disease becomes  serious and imminent threat to Brit – The Sun"
"https://rg.ru/2020/02/10/narkolog-pit-alkogol-pri-zabolevanii-koronavirusom-nelzia.html","https://rg.ru/amp/2020/02/10/narkolog-pit-alkogol-pri-zabolevanii-koronavirusom-nelzia.html","2020-02-10 11:45:00","Нарколог : Пить алкоголь при заболевании коронавирусом нельзя"
"https://www.dailymail.co.uk/news/article-7986999/President-Xi-wears-face-mask-temperature-checked.html","https://www.dailymail.co.uk/news/article-7986999/amp/President-Xi-wears-face-mask-temperature-checked.html","2020-02-10 13:15:00","President Xi wears face mask and has his temperature checked"
"https://www.kommersant.ru/doc/4250864","https://www.kommersant.ru/amp/4250864","2020-02-10 17:45:00","Пранкер пострадал от коронавируса"
"https://www.mk.ru/social/2020/02/10/vlasti-khabarovska-vvodyat-specialnyy-masochnyy-rezhim-izza-koronavirusa.html","https://www.mk.ru/amp/social/2020/02/10/vlasti-khabarovska-vvodyat-specialnyy-masochnyy-rezhim-izza-koronavirusa.html","2020-02-10 00:45:00","Власти Хабаровска вводят специальный  масочный  режим из - за коронавируса"
"https://www.nacion.com/ciencia/salud/coronavirus-presidente-chino-aparece-por-primera/7PVIDXEQ6FEQBEY4OCJJRB4BVU/story/","https://www.nacion.com/ciencia/salud/coronavirus-presidente-chino-aparece-por-primera/7PVIDXEQ6FEQBEY4OCJJRB4BVU/story/?outputType=amp-type","2020-02-10 20:30:00","Coronavirus : Presidente chino aparece por primera vez con máscara en público , muertes llegan a 900"
"https://uk.reuters.com/article/uk-china-health-britain/britain-declares-coronavirus-a-serious-and-imminent-threat-to-public-health-idUKKBN2040OJ","https://uk.mobile.reuters.com/article/amp/idUKKBN2040OJ","2020-02-10 09:15:00","Britain declares coronavirus a serious and imminent threat to public health"
"https://vm.ru/news/779934-fas-zayavila-ob-ekonomicheskim-maroderstve-iz-za-zavysheniya-cen-na-maski","https://vm.ru/news/779934-fas-zayavila-ob-ekonomicheskim-maroderstve-iz-za-zavysheniya-cen-na-maski/amp","2020-02-10 15:45:00","ФАС заявила об « экономическом мародерстве » из - за завышения цен на маски"
"https://ukrainian.voanews.com/a/koronavirus-ukraiintsy-evakuatsia/5281434.html","https://ukrainian.voanews.com/amp/5281434.html","2020-02-10 13:45:00","Коронавірус виявили у другого українця на Diamond Princess , посольство евакуює українців з Уханю"
"https://city-press.news24.com/News/sa-seems-unfazed-at-coronavirus-spreads-20200210","","2020-02-10 12:15:00","SA seems unfazed at coronavirus spreads"
"https://kp.ua/life/659425-ukraynka-yz-ukhania-zdes-vse-kak-v-fylmakh-pro-zomby","","2020-02-10 20:30:00","Украинка из Уханя : Здесь все , как в фильмах про зомби"
"https://rg.ru/2020/02/10/reg-dfo/v-habarovske-iz-za-grippa-vveli-masochnyj-rezhim.html","https://rg.ru/amp/2020/02/10/reg-dfo/v-habarovske-iz-za-grippa-vveli-masochnyj-rezhim.html","2020-02-10 20:15:00","В Хабаровске из - за гриппа ввели масочный режим"
"https://www.pravda.com.ua/rus/news/2020/02/10/7239978/","https://www.pravda.com.ua/rus/news/2020/02/10/7239978/index.amp","2020-02-10 08:45:00","На борту лайнера с коронавирусом уже 130 больных"
"https://www.theaustralian.com.au/world/new-uk-laws-to-force-people-back-to-quarantine/news-story/9208bbfbb59fe8a1946d0f9f0785a139?nk=afac1b6f3275ba92b3d0f9836543a70b-1581375758","https://amp.theaustralian.com.au/world/new-uk-laws-to-force-people-back-to-quarantine/news-story/9208bbfbb59fe8a1946d0f9f0785a139","2020-02-10 23:15:00","Xi Jinping appears on coronavirus frontlines"
"http://fraza.ua/news/286929-stala-izvestna-sudba-pervogo-ukraintsa-zarazhennogo-kitajskim-koronavirusom","http://fraza.ua/amp/286929-stala-izvestna-sudba-pervogo-ukraintsa-zarazhennogo-kitajskim-koronavirusom","2020-02-10 13:45:00","Стала известна судьба первого украинца , зараженного китайским коронавирусом"
"https://www.ojogo.pt/internacional/noticias/champions-asiatica-obriga-a-usar-mascara-devido-ao-coronavirus-11805032.html","https://www.ojogo.pt/internacional/noticias/amp/champions-asiatica-obriga-a-usar-mascara-devido-ao-coronavirus-11805032.html","2020-02-10 12:15:00","Champions asiática obriga a usar máscara devido ao coronavírus"
"https://www.sixthtone.com/news/1005180/collage-chinas-week-in-photos%2C-feb.-3%E2%80%939","","2020-02-10 07:15:00","Collage : China Week in Photos , Feb . 3 – 9"
"https://www.msn.com/en-au/news/world/british-man-feared-to-be-coronavirus-super-spreader/ar-BBZQDby","","2020-02-10 15:15:00","British man feared to be coronavirus  super spreader  "
"https://www.asiaone.com/singapore/s-hook-lady-gets-real-how-singaporeans-are-reacting-coronavirus-outbreak","http://www.asiaone.com/singapore/s-hook-lady-gets-real-how-singaporeans-are-reacting-coronavirus-outbreak?amp","2020-02-10 08:00:00","S - hook lady gets real on how Singaporeans are reacting to coronavirus outbreak"
"https://www.ridus.ru/news/319480","","2020-02-10 13:45:00","Против пранкера с приступом коронавируса » возбуждено уголовное дело"
"https://www.newshub.co.nz/home/new-zealand/2020/02/coronavirus-ministry-of-health-urges-calm-over-virus-being-airborne.html","https://www.newshub.co.nz/home/new-zealand/2020/02/coronavirus-ministry-of-health-urges-calm-over-virus-being-airborne.amp.html","2020-02-10 07:15:00","Coronavirus : Ministry of Health urges calm over virus being airborne"
"https://www.bbc.co.uk/sport/football/51441898","https://www.bbc.co.uk/sport/amp/football/51441898","2020-02-10 11:30:00","Dele Alli : Tottenham midfielder apologises for coronavirus  joke  "
"https://ria.ru/20200210/1564512077.html","https://ria.ru/amp/20200210/1564512077.html","2020-02-10 14:30:00","Роспотребнадзор оценил ситуацию с защитными масками"
"https://armenpress.am/rus/news/1004335/","https://armenpress.am/rus/amp/1004335","2020-02-10 14:30:00","Си Цзиньпин проверил реализацию мер по борьбе с коронавирусом в Пекине"
"https://armenpress.am/rus/news/1004335.html","https://armenpress.am/rus/amp/1004335","2020-02-10 14:00:00","Си Цзиньпин проверил реализацию мер по борьбе с коронавирусом в Пекине"
"https://regnum.ru/news/society/2854523.html","","2020-02-10 23:45:00","В Ухане начал работать изолятор на 800 мест для тяжелобольных коронавиурсом"
"https://www.larazon.es/internacional/20200210/x4dwecuym5hfzg2u43xz26ofwa.html","https://www.larazon.es/internacional/20200210/x4dwecuym5hfzg2u43xz26ofwa.html?outputType=amp","2020-02-10 17:45:00","Xi Jinping reaparece en público en las calles de Pekín"
"https://www.bfm.ru/news/436227","https://www.bfm.ru/amp/news/436227","2020-02-10 16:45:00","Имитировавшего приступ от коронавируса в московском метро отправили в СИЗО"
"http://www.courant.com/politics/hc-pol-connecticut-lawmakers-coronavirus-20200210-uoshrmik7zhvzoe64obm3rkrmi-story.html","https://www.courant.com/politics/hc-pol-connecticut-lawmakers-coronavirus-20200210-uoshrmik7zhvzoe64obm3rkrmi-story.html?outputType=amp","2020-02-10 16:15:00","Connecticut lawmakers pan Trump administration response to coronavirus"
"https://technode.com/2020/02/10/iflytek-entity-list-exemption-medical-supplies/","","2020-02-10 07:45:00","iFlytek seeks US trade ban exemption for medical supplies · TechNode"
"https://charter97.org/ru/news/2020/2/10/365376/","https://amp.charter97.org/ru/news/2020/2/10/365376/","2020-02-10 10:30:00","Коронавирус против « большого брата » "
"https://www.indiatvnews.com/news/world/chinese-president-xi-jinping-first-public-appearance-coronavirus-outbreak-587703","https://www.indiatvnews.com/amp/news/world/chinese-president-xi-jinping-first-public-appearance-coronavirus-outbreak-587703","2020-02-10 17:30:00","China President Xi Jinping appears in public for first time after Coronavirus outbreak"
"http://www.msn.com/en-nz/news/world/british-man-feared-to-be-coronavirus-super-spreader/ar-BBZQo0T","","2020-02-10 20:00:00","British man feared to be coronavirus  super spreader  "
"https://www.themoscowtimes.com/2020/02/10/moscow-metro-coronavirus-prankster-faces-prison-time-a69226","","2020-02-10 16:15:00","Moscow Metro Coronavirus Prankster Faces 5 - Year Prison Sentence"
"https://g1.globo.com/mt/mato-grosso/noticia/2020/02/10/centro-de-operacoes-estrategicas-vai-ser-criado-em-mt-para-atender-eventuais-casos-de-coronavirus-diz-governo.ghtml","https://g1.globo.com/google/amp/mt/mato-grosso/noticia/2020/02/10/centro-de-operacoes-estrategicas-vai-ser-criado-em-mt-para-atender-eventuais-casos-de-coronavirus-diz-governo.ghtml","2020-02-10 20:15:00","Centro de Operaes Estratégicas vai ser criado em MT para atender eventuais casos de coronavírus , diz governo"
"https://indianexpress.com/article/india/kerala/coronavirus-positive-india-first-case-6261052/","https://indianexpress.com/article/india/kerala/coronavirus-positive-india-first-case-6261052/lite/","2020-02-10 14:30:00","India first coronavirus positive patient is recovering | India News , The Indian Express"
"https://life.ru/p/1306858","https://life.ru/p/1306858/amp","2020-02-10 13:45:00","В Москве задержали пранкера , который разыграл пассажиров метро приступом коронавируса"
"https://in.reuters.com/article/china-health-japan/sixty-more-people-confirmed-with-coronavirus-on-cruise-ship-in-japan-media-idINKBN2040HP","https://in.mobile.reuters.com/article/amp/idINKBN2040HP","2020-02-10 07:15:00","Sixty more people confirmed with coronavirus on cruise ship in Japan : media"
"https://global.chinadaily.com.cn/a/202002/07/WS5e3d1ea5a310128217275d9b.html","","2020-02-10 08:45:00","Italy agrees to resume some flights with China - Chinadaily . com . cn"
"https://uk.reuters.com/article/us-china-health-toll/china-reports-97-new-coronavirus-deaths-on-mainland-on-sunday-toll-rises-to-908-idUKKBN204009","https://uk.mobile.reuters.com/article/amp/idUKKBN204009","2020-02-10 03:15:00","China reports 97 new coronavirus deaths on mainland on Sunday , toll rises to 908"
"https://www.reuters.com/article/us-china-health-toll/china-reports-97-new-coronavirus-deaths-on-mainland-on-sunday-toll-rises-to-908-idUSKBN204009","https://mobile.reuters.com/article/amp/idUSKBN204009","2020-02-10 01:45:00","China reports 97 new coronavirus deaths on mainland on Sunday , toll rises to 908"
"https://in.reuters.com/article/us-china-health-toll/china-reports-97-new-coronavirus-deaths-on-mainland-on-sunday-toll-rises-to-908-idINKBN204009","https://in.mobile.reuters.com/article/amp/idINKBN204009","2020-02-10 04:30:00","China reports 97 new coronavirus deaths on mainland on Sunday , toll rises to 908"
"https://www.taiwannews.com.tw/en/news/3874115","","2020-02-10 08:45:00","Taiwan High Speed Rail , hotels work to cushio ... "
