URL,MobileURL,Date,Title
"https://www.kp.ru/daily/27089/4162142/","https://amp.kp.ru/daily/27089/4162142/","2020-02-10 12:45:00","Вспышка коронавируса : эксперт рассказал , кому и когда нужно носить медицинские маски"
"https://g1.globo.com/bemestar/blog/ana-escobar/post/2020/02/10/coronavirus-mitos-e-verdades.ghtml","https://g1.globo.com/google/amp/bemestar/blog/ana-escobar/post/2020/02/10/coronavirus-mitos-e-verdades.ghtml","2020-02-10 16:30:00","Coronavírus : mitos e verdades"
"https://timesofindia.indiatimes.com/entertainment/hindi/bollywood/news/sunny-leone-to-ranbir-kapoor-and-parineeti-chopra-bollywood-takes-precaution-against-coronavirus/photostory/74058877.cms","https://m.timesofindia.com/entertainment/hindi/bollywood/news/sunny-leone-to-ranbir-kapoor-and-parineeti-chopra-bollywood-takes-precaution-against-coronavirus/amp_etphotostory/74058877.cms","2020-02-10 08:45:00","Sunny Leone to Ranbir Kapoor and Parineeti Chopra : Bollywood takes precaution against Coronavirus"
"https://www.indiatimes.com/trending/social-relevance/wuhan-coronavirus-outbreaks-turns-busy-chinese-cities-into-ghost-towns-506092.html","https://www.indiatimes.com/amp/trending/social-relevance/wuhan-coronavirus-outbreaks-turns-busy-chinese-cities-into-ghost-towns-506092.html","2020-02-10 14:45:00","Wuhan Coronavirus Outbreaks Turns Busy Chinese Cities Into Ghost Towns"
"http://dengi.ua/archive/articles/312264-Koronavirus-pugaet-apteki","http://amp.dengi.ua/archive/articles/312264-Koronavirus-pugaet-apteki","2020-02-10 17:45:00","Коронавирус пугает аптеки"
"https://news.sky.com/story/coronavirus-can-face-masks-really-protect-you-11931121","https://news.sky.com/story/amp/coronavirus-can-face-masks-really-protect-you-11931121","2020-02-10 22:15:00","Coronavirus : Can face masks really protect you ? "
"https://www.dailystar.co.uk/news/latest-news/tesco-worker-cries-tells-man-21471379","https://www.dailystar.co.uk/news/latest-news/tesco-worker-cries-tells-man-21471379.amp","2020-02-10 22:30:00","Tesco worker cries and tells man wearing face mask to  stay away  from her"
"https://www.hulldailymail.co.uk/news/hull-east-yorkshire-news/coronavirus-face-mask-asian-tesco-3829986","https://www.hulldailymail.co.uk/news/hull-east-yorkshire-news/coronavirus-face-mask-asian-tesco-3829986.amp","2020-02-10 19:45:00","Tesco checkout worker tells Asian man in face mask to  stay away  "
"https://www.businessinsider.com.au/coronavirus-face-mask-safe-prevention-2020-2","https://www.businessinsider.com.au/coronavirus-face-mask-safe-prevention-2020-2/amp","2020-02-10 03:45:00","Demand for face masks is surging because of the coronavirus but doctors say wearing one isnt the safest thing you can do"
"https://www.elperiodico.com/es/internacional/20200210/coronavirus-xi-jinping-mascara-muertos-china-7842801","https://amp.elperiodico.com/es/internacional/20200210/coronavirus-xi-jinping-mascara-muertos-china-7842801","2020-02-10 12:45:00","Coronavirus : 900 muertos ya en China y Xi Jinping , con máscara"
"https://www.terra.com.br/noticias/mundo/xi-diz-que-china-vai-evitar-demissoes-em-massa-durante-surto-de-coronavirus,21d748819653310f744c74175eb34824eqrxqv4t.html","https://www.terra.com.br/amp/noticias/mundo/xi-diz-que-china-vai-evitar-demissoes-em-massa-durante-surto-de-coronavirus,21d748819653310f744c74175eb34824eqrxqv4t.html","2020-02-10 12:45:00","Xi diz que China vai evitar demissões em massa durante surto de coronavírus"
"https://ura.news/news/1052418344","{{ (metaService && metaService.ampUrl()) ? metaService.ampUrl() : https://amp.ura.news/news/1052418344 }}","2020-02-10 19:45:00","Доктор Мясников нашел плюс в эпидемии коронавируса"
"https://ura.news/news/1052418344?story_id=651","{{ (metaService && metaService.ampUrl()) ? metaService.ampUrl() : https://amp.ura.news/news/1052418344 }}","2020-02-10 19:45:00","Доктор Мясников нашел плюс в эпидемии коронавируса"
"https://punemirror.indiatimes.com/entertainment/bollywood/photos-from-parineeti-chopra-and-sunny-leone-to-soha-ali-khan-b-town-celebs-take-precaution-against-coronavirus/articleshow/74068224.cms","","2020-02-10 15:45:00","Photos : From Parineeti Chopra and Sunny Leone to Soha Ali Khan , B - Town celebs take precaution against coronavirus"
"https://mumbaimirror.indiatimes.com/entertainment/bollywood/photos-from-parineeti-chopra-and-sunny-leone-to-soha-ali-khan-b-town-celebs-take-precaution-against-coronavirus/articleshow/74068218.cms","https://mumbaimirror.indiatimes.com/entertainment/bollywood/photos-from-parineeti-chopra-and-sunny-leone-to-soha-ali-khan-b-town-celebs-take-precaution-against-coronavirus/amp_articleshow/74068218.cms","2020-02-10 17:30:00","Photos : From Parineeti Chopra and Sunny Leone to Soha Ali Khan , B - Town celebs take precaution against coronavirus"
"https://bangaloremirror.indiatimes.com/entertainment/bollywood/photos-from-parineeti-chopra-and-sunny-leone-to-soha-ali-khan-b-town-celebs-take-precaution-against-coronavirus/articleshow/74068226.cms","","2020-02-10 19:15:00","Photos : From Parineeti Chopra and Sunny Leone to Soha Ali Khan , B - Town celebs take precaution against coronavirus"
"http://www.ecns.cn/business/2020-02-10/detail-ifztmcih6515386.shtml","","2020-02-10 02:45:00","China mask production recovering as work resumption quickens"
"http://www.thatsmags.com/china/post/30707/how-effective-are-face-masks-against-coronavirus","","2020-02-10 06:45:00","INFOGRAPHIC : How Effective Are Face Masks Against Coronavirus ? "
"https://timesofindia.indiatimes.com/entertainment/hindi/bollywood/news/photo-parineeti-chopra-wears-a-mask-as-a-precaution-from-coronavirus/articleshow/74061437.cms","https://m.timesofindia.com/entertainment/hindi/bollywood/news/photo-parineeti-chopra-wears-a-mask-as-a-precaution-from-coronavirus/amp_articleshow/74061437.cms","2020-02-10 12:00:00","Photo : Parineeti Chopra wears a mask as a precaution from Coronavirus | Hindi Movie News"
"https://www.antaranews.com/berita/1288586/dompet-dhuafa-bagikan-ribuan-masker-kepada-wni-di-hong-kong","https://m.antaranews.com/amp/berita/1288586/dompet-dhuafa-bagikan-ribuan-masker-kepada-wni-di-hong-kong","2020-02-10 15:30:00","Dompet Dhuafa bagikan ribuan masker kepada WNI di Hong Kong"
"https://www.financialexpress.com/lifestyle/health/coronavirus-china-death-toll-jumps-to-902-with-91-new-fatalities-says-official/1862255/","https://www.financialexpress.com/lifestyle/health/coronavirus-china-death-toll-jumps-to-902-with-91-new-fatalities-says-official/1862255/lite/","2020-02-10 02:30:00","Coronavirus : China death toll jumps to 902 with 91 new fatalities , says official"
"https://www.iol.co.za/news/world/uk-declares-coronavirus-a-serious-and-imminent-threat-to-public-health-42461072","","2020-02-10 11:30:00","UK declares coronavirus a serious and imminent threat to public health"
"https://www.5-tv.ru/news/283320/zitelej-habarovska-obazali-nosit-maski/","https://m.5-tv.ru/amp/news/283320/zitelej-habarovska-obazali-nosit-maski/","2020-02-10 15:15:00","Жителей Хабаровска обязали носить маски"
"https://noticias.uol.com.br/ultimas-noticias/rfi/2020/02/10/declinio-da-epidemia-de-coronavirus-pode-comecar-no-fim-de-fevereiro-sugere-especialista-americano.htm","https://noticias.uol.com.br/ultimas-noticias/rfi/2020/02/10/declinio-da-epidemia-de-coronavirus-pode-comecar-no-fim-de-fevereiro-sugere-especialista-americano.amp.htm","2020-02-10 12:30:00","  Declínio da epidemia de coronavírus pode começar no fim de fevereiro , sugere especialista americano"
"https://utro.ru/life/2020/02/10/1434857.shtml","https://utro.ru/amp/life/2020/02/10/1434857.shtml","2020-02-10 20:45:00","Коронавирус в России , Китай , эпидемия"
"https://www.msn.com/en-us/finance/topstocks/5-stocks-to-watch-as-fatalities-due-to-coronavirus-rise/ar-BBZQrT9","","2020-02-10 15:15:00","5 Stocks to Watch as Fatalities Due to Coronavirus Rise"
"https://www.nasdaq.com/articles/5-stocks-to-watch-as-fatalities-due-to-coronavirus-rise-2020-02-10","https://www.nasdaq.com/articles/5-stocks-to-watch-as-fatalities-due-to-coronavirus-rise-2020-02-10?amp","2020-02-10 15:00:00","5 Stocks to Watch as Fatalities Due to Coronavirus Rise"
"https://iz.ru/974503/2020-02-10/sud-arestoval-ustroivshego-prank-s-koronavirusom-v-moskovskom-metro","https://iz.ru/export/google/amp/974503","2020-02-10 14:30:00","Суд арестовал устроившего пранк с коронавирусом в московском метро"
"https://www.sfchronicle.com/business/article/Bay-Area-clinics-seek-supplies-of-masks-for-15045202.php","https://www.sfchronicle.com/business/amp/Bay-Area-clinics-seek-supplies-of-masks-for-15045202.php","2020-02-10 21:45:00","Bay Area clinics seek supplies of masks for coronavirus :  There a huge shortage  "
"https://ura.news/news/1052418286","{{ (metaService && metaService.ampUrl()) ? metaService.ampUrl() : https://amp.ura.news/news/1052418286 }}","2020-02-10 12:15:00","Нарколог объяснил , почему нельзя пить алкоголь при коронавирусе"
"https://ura.news/news/1052418286?story_id=651","{{ (metaService && metaService.ampUrl()) ? metaService.ampUrl() : https://amp.ura.news/news/1052418286 }}","2020-02-10 12:15:00","Нарколог объяснил , почему нельзя пить алкоголь при коронавирусе"
"https://www.straitstimes.com/singapore/morning-briefing-top-stories-from-the-straits-times-on-feb-10","","2020-02-10 01:15:00","Morning Briefing : Top stories from The Straits Times on Feb 10"
"https://propakistani.pk/2020/02/10/xiaomi-resumes-work-in-china-despite-coronavirus-outbreak/","https://propakistani.pk/2020/02/10/xiaomi-resumes-work-in-china-despite-coronavirus-outbreak/amp/","2020-02-10 14:00:00","Xiaomi Resumes Work in China Despite Coronavirus Outbreak"
"https://br.reuters.com/article/worldNews/idBRKBN2041AB-OBRWD","https://mobile.reuters.com/article/amp/br/idBRKBN2041AB-OBRWD","2020-02-10 15:00:00","Xi diz que China vai evitar demissões em massa durante surto de coronavírus"
"https://br.reuters.com/article/topNews/idBRKBN2041AB-OBRTP","https://mobile.reuters.com/article/amp/br/idBRKBN2041AB-OBRTP","2020-02-10 15:00:00","Xi diz que China vai evitar demissões em massa durante surto de coronavírus"
"https://www.bournemouthecho.co.uk/news/national/18223128.chinas-coronavirus-death-toll-climbs-908/","https://www.bournemouthecho.co.uk/news/national/18223128.amp/","2020-02-10 15:30:00","China coronavirus death toll climbs to 908"
"https://www.elperiodicodearagon.com/noticias/internacional/coronavirus-900-muertos-ya-china-xi-jinping-aparece-mascara-primera-vez_1408513.html","https://www.elperiodicodearagon.com/amp/noticias/internacional/coronavirus-900-muertos-ya-china-xi-jinping-aparece-mascara-primera-vez_1408513.html","2020-02-10 15:00:00","Coronavirus : 900 muertos ya en China y Xi Jinping aparece con máscara por primera vez"
"https://finance.yahoo.com/news/5-stocks-watch-fatalities-due-135901347.html","https://finance.yahoo.com/amphtml/news/5-stocks-watch-fatalities-due-135901347.html","2020-02-10 18:00:00","5 Stocks to Watch as Fatalities Due to Coronavirus Rise"
"https://www.diariocordoba.com/noticias/internacional/coronavirus-900-muertos-ya-china-xi-jinping-aparece-mascara-primera-vez_1353268.html","https://www.diariocordoba.com/amp/noticias/internacional/coronavirus-900-muertos-ya-china-xi-jinping-aparece-mascara-primera-vez_1353268.html","2020-02-10 12:15:00","Coronavirus : 900 muertos ya en China y Xi Jinping aparece con máscara por primera vez"
"https://vietnamnet.vn/en/business/vietnam-exempts-import-tax-on-five-commodity-groups-to-fight-coronavirus-615305.html","http://m.vietnamnet.vn/en/business/vietnam-exempts-import-tax-on-five-commodity-groups-to-fight-coronavirus-615305.html","2020-02-10 09:45:00","Vietnam exempts import tax on five commodity groups to fight coronavirus"
"https://www.9tv.co.il/item/10015","","2020-02-10 20:30:00","Вирусная распродажа : в Израиле расхватали все медицинские маски"
"https://www.9news.com.au/world/china-president-xi-makes-rare-public-appearance-during-coronavirus-outbreak-world-news/adaaed5c-83ac-44b1-9abe-3392a0599359","https://amp.9news.com.au/article/adaaed5c-83ac-44b1-9abe-3392a0599359","2020-02-10 21:30:00","China President makes rare public appearance during coronavirus outbreak"
"https://www.fox5atlanta.com/news/illinois-suspects-enter-walmart-with-caution-i-have-the-coronavirus-sign-spray-lysol-on-produce","https://www.fox5atlanta.com/news/illinois-suspects-enter-walmart-with-caution-i-have-the-coronavirus-sign-spray-lysol-on-produce.amp","2020-02-10 18:45:00","Illinois suspects enter Walmart with  Caution I have the Coronaviru sign , spray Lysol on produce"
"https://teknoblog.ru/2020/02/10/103939","https://teknoblog.ru/2020/02/10/103939/amp","2020-02-10 14:00:00","Корпорация PetroChina включилась в борьбу с коронавирусом"
"https://www.fox10phoenix.com/news/illinois-suspects-enter-walmart-with-caution-i-have-the-coronavirus-sign-spray-lysol-on-produce","https://www.fox10phoenix.com/news/illinois-suspects-enter-walmart-with-caution-i-have-the-coronavirus-sign-spray-lysol-on-produce.amp","2020-02-10 20:15:00","Illinois suspects enter Walmart with  Caution I have the Coronaviru sign , spray Lysol on produce"
"https://www.fox29.com/news/illinois-suspects-enter-walmart-with-caution-i-have-the-coronavirus-sign-spray-lysol-on-produce","https://www.fox29.com/news/illinois-suspects-enter-walmart-with-caution-i-have-the-coronavirus-sign-spray-lysol-on-produce.amp","2020-02-10 18:15:00","Illinois suspects enter Walmart with  Caution I have the Coronaviru sign , spray Lysol on produce"
"https://www.fox2detroit.com/news/illinois-suspects-enter-walmart-with-caution-i-have-the-coronavirus-sign-spray-lysol-on-produce","https://www.fox2detroit.com/news/illinois-suspects-enter-walmart-with-caution-i-have-the-coronavirus-sign-spray-lysol-on-produce.amp","2020-02-10 17:15:00","Illinois suspects enter Walmart with  Caution I have the Coronaviru sign , spray Lysol on produce"
"https://www.fox13news.com/news/illinois-suspects-enter-walmart-with-caution-i-have-the-coronavirus-sign-spray-substance-on-7k-worth-of-produce","https://www.fox13news.com/news/illinois-suspects-enter-walmart-with-caution-i-have-the-coronavirus-sign-spray-substance-on-7k-worth-of-produce.amp","2020-02-10 14:45:00","Illinois suspects enter Walmart with  Caution I have the Coronaviru sign , spray substance on $7K worth of produce"
"https://www.elperiodicoextremadura.com/noticias/internacional/coronavirus-900-muertos-ya-china-xi-jinping-aparece-mascara-primera-vez_1217464.html","https://www.elperiodicoextremadura.com/amp/noticias/internacional/coronavirus-900-muertos-ya-china-xi-jinping-aparece-mascara-primera-vez_1217464.html","2020-02-10 14:15:00","Coronavirus : 900 muertos ya en China y Xi Jinping aparece con máscara por primera vez"
"https://www.infobae.com/america/mundo/2020/02/10/coronavirus-xi-jinping-reaparecio-en-publico-con-una-mascarilla-y-se-dejo-tomar-la-temperatura-tras-varios-dias-de-reclusion/","https://www.infobae.com/america/mundo/2020/02/10/coronavirus-xi-jinping-reaparecio-en-publico-con-una-mascarilla-y-se-dejo-tomar-la-temperatura-tras-varios-dias-de-reclusion/?outputType=amp-type","2020-02-10 16:00:00","Coronavirus : Xi Jinping reapareció en público con una mascarilla y se dejó tomar la temperatura tras varios días de reclusión"
"https://www.wort.lu/fr/international/900e-mort-du-coronavirus-enregistre-en-chine-5e414071da2cc1784e355e72","","2020-02-10 13:15:00","900e mort du coronavirus enregistré en Chine"
"https://nversia.ru/news/vlasti-reshili-sozdat-v-rossii-strategicheskiy-zapas-medicinskih-masok/","https://nversia.ru/amp/view/id/166843/","2020-02-10 10:30:00","Власти решили создать в России стратегический запас медицинских масок"
"https://www.theonlinecitizen.com/2020/02/10/pap-mp-responds-to-goh-meng-sengs-facebook-post-regarding-wearing-face-mask-during-resident-visit-in-tampines/","","2020-02-10 09:30:00","  Not the time for destructive politics : PAP MP responds to Goh Meng Seng Facebook post regarding wearing face mask during resident visit in Tampines"
"https://www.msn.com/en-us/finance/companies/surging-mask-demand-can-e2-80-99t-revive-china-e2-80-99s-ailing-plastic-makers/ar-BBZReiE","","2020-02-10 22:00:00","Surging Mask Demand Cant Revive China Ailing Plastic Makers"
"http://www.xinhuanet.com/english/2020-02/10/c_138769925.htm","","2020-02-10 03:00:00","Across China : Chinese couple holds no - guest wedding amid coronavirus outbreak - Xinhua"
"https://www.scmp.com/comment/letters/article/3049472/coronavirus-crisis-yet-more-proof-hong-kong-government-has-failed","https://amp.scmp.com/comment/letters/article/3049472/coronavirus-crisis-yet-more-proof-hong-kong-government-has-failed","2020-02-10 02:00:00","Coronavirus crisis yet more proof that Hong Kong government has failed on every count"
"https://www.nst.com.my/news/nation/2020/02/564190/ministry-keep-close-watch-face-mask-prices-and-supply","//www.nst.com.my/node/564190/amp","2020-02-10 05:00:00","Ministry to keep close watch on face mask prices and supply"
"https://sud.ua/ru/news/abroad/160777-vtoroy-sluchay-koronavirus-diagnostirovali-esche-u-odnogo-ukraintsa","","2020-02-10 16:15:00","Смертельным коронавирусом заразился еще один украинец"
"https://www.elperiodico.com/es/economia/20200210/los-asistentes-al-mwc-pasan-la-cuarentena-en-hoteles-de-europa-7843235","https://amp.elperiodico.com/es/economia/20200210/los-asistentes-al-mwc-pasan-la-cuarentena-en-hoteles-de-europa-7843235","2020-02-10 17:45:00","Mobile World Congress : Asistentes pasan cuarentena en hoteles europeos"
"https://www.thejakartapost.com/news/2020/02/10/30-chinese-workers-under-quarantine-in-n-sulawesi-after-returning-from-china.html","https://www.thejakartapost.com/amp/news/2020/02/10/30-chinese-workers-under-quarantine-in-n-sulawesi-after-returning-from-china.html","2020-02-10 04:00:00","30 Chinese workers under quarantine in N . Sulawesi after returning from China"
"https://www.globalsecurity.org/security/library/news/2020/02/sec-200210-pdo03.htm","","2020-02-10 12:15:00","China mask production recovering as work resumption quickens"
"http://www.china.org.cn/business/2020-02/10/content_75688568.htm","","2020-02-10 01:45:00","China mask production recovering as work resumption quickens"
"http://english.sina.com/news/2020-02-10/detail-iimxxstf0169615.shtml","","2020-02-10 05:15:00","China software , IT service sector expands robustly in 2019 - 抓站 News"
"https://www.elimpulso.com/2020/02/10/xi-jinping-reaparecio-con-una-mascara-para-pedir-medidas-firmes-contra-el-coronavirus/","//www.elimpulso.com/2020/02/10/xi-jinping-reaparecio-con-una-mascara-para-pedir-medidas-firmes-contra-el-coronavirus/amp/","2020-02-10 23:30:00","Xi Jinping reapareció con una mascara para pedir medidas firmes contra el coronavirus"
"https://lta.reuters.com/fotos/articulo/top-photos-of-the-day-idUSRTS31J4C","","2020-02-10 15:30:00","Top Photos of the Day | Reuters . com"
"https://jp.reuters.com/news/picture/top-photos-of-the-day-idJPRTS31J4C","","2020-02-10 15:30:00","Top Photos of the Day | jp . reuters . com"
"https://uk.reuters.com/news/picture/top-photos-of-the-day-idUKRTS31J4C","","2020-02-10 12:30:00","Top Photos of the Day | Reuters . com"
"https://www.reuters.com/news/picture/top-photos-of-the-day-idUSRTS31J4C","https://mobile.reuters.com/news/picture/top-photos-of-the-day-idUSRTS31J4C","2020-02-10 12:45:00","Top Photos of the Day | Reuters . com"
"https://in.reuters.com/news/picture/top-photos-of-the-day-idUSRTS31J4C","","2020-02-10 12:45:00","Top Photos of the Day | Reuters . com"
"https://de.reuters.com/news/picture/top-photos-of-the-day-idUKRTS31J4C","","2020-02-10 13:15:00","Top Photos of the Day | Reuters . com"
"https://glavnoe.ua/news/n357016938-koronavirus-obnaruzhili-u-vtorogo-ukrainca-na-diamond-princess","https://m.glavnoe.ua/amp/n357016938-koronavirus-obnaruzhili-u-vtorogo-ukrainca-na-diamond-princess","2020-02-10 13:15:00","Коронавирус обнаружили у второго украинца на Diamond Princess"
"https://www.fox7austin.com/news/illinois-suspects-enter-walmart-with-caution-i-have-the-coronavirus-sign-spray-lysol-on-produce","https://www.fox7austin.com/news/illinois-suspects-enter-walmart-with-caution-i-have-the-coronavirus-sign-spray-lysol-on-produce.amp","2020-02-10 20:15:00","Illinois suspects enter Walmart with  Caution I have the Coronaviru sign , spray Lysol on produce"
"https://www.independent.co.uk/news/world/asia/coronavirus-incubation-period-symptoms-china-sars-length-days-time-a9326591.html","https://www.independent.co.uk/news/world/asia/coronavirus-incubation-period-symptoms-china-sars-length-days-time-a9326591.html?amp","2020-02-10 13:45:00","Coronavirus could have incubation period of 24 days 10 days longer than previously thought"
"https://tsn.ua/auto/news/tesla-zapustila-gigafactory-u-kitayi-nezvazhayuchi-na-koronavirus-1488738.html","","2020-02-10 09:00:00","Tesla запустила Gigafactory в Китаї , незважаючи на коронавірус . Фото - Новини"
"https://www.independent.co.uk/news/world/americas/coronavirus-cruise-ship-japan-americans-death-toll-latest-princess-diamond-a9328096.html","https://www.independent.co.uk/news/world/americas/coronavirus-cruise-ship-japan-americans-death-toll-latest-princess-diamond-a9328096.html?amp","2020-02-10 19:30:00","Coronavirus : More than 20 Americans test positive for deadly virus on cruise ship"
"https://www.independent.co.uk/news/world/asia/coronavirus-missing-journalist-chen-qiushi-china-wuhan-quarantine-a9327246.html","https://www.independent.co.uk/news/world/asia/coronavirus-missing-journalist-chen-qiushi-china-wuhan-quarantine-a9327246.html?amp","2020-02-10 14:30:00","Coronavirus : Citizen journalist reported missing by family while reporting on outbreak"
"https://www.independent.co.uk/news/world/asia/coronavirus-death-toll-sunday-china-latest-news-uk-a9326451.html","https://www.independent.co.uk/news/world/asia/coronavirus-death-toll-sunday-china-latest-news-uk-a9326451.html?amp","2020-02-10 14:30:00","Coronavirus death toll rises by 97 people on Sunday in deadliest day yet"
"https://www.independent.co.uk/travel/news-and-advice/coronavirus-travel-flights-planes-risk-china-wuhan-symptoms-a9327901.html","https://www.independent.co.uk/travel/news-and-advice/coronavirus-travel-flights-planes-risk-china-wuhan-symptoms-a9327901.html?amp","2020-02-10 22:15:00","Coronavirus : Top doctor says chances of contracting disease on plane is remote"
"https://www.independent.co.uk/news/world/americas/trump-coronavirus-china-april-us-deaths-wuhan-outbreak-latest-a9328366.html","https://www.independent.co.uk/news/world/americas/trump-coronavirus-china-april-us-deaths-wuhan-outbreak-latest-a9328366.html?amp","2020-02-10 23:45:00","Trump cautioned for insisting  coronavirus will be gone by April  "
"https://www.independent.co.uk/news/world/asia/coronavirus-china-cruise-diamond-princess-quarantine-oscars-meals-a9327196.html","https://www.independent.co.uk/news/world/asia/coronavirus-china-cruise-diamond-princess-quarantine-oscars-meals-a9327196.html?amp","2020-02-10 14:30:00","Oscars , eating , and short glimpses of sky : How people on quarantined coronavirus cruise are spending their time"
"https://www.reuters.com/article/us-china-health-taiwan-idUSKBN2040KF","https://mobile.reuters.com/article/amp/idUSKBN2040KF","2020-02-10 07:00:00","Taiwan to freeze entry of some Hong Kong , Macau residents to halt virus"
"https://www.reuters.com/article/us-china-health-taiwan/taiwan-to-freeze-entry-of-some-hong-kong-macau-residents-to-halt-virus-idUSKBN2040KF","https://mobile.reuters.com/article/amp/idUSKBN2040KF","2020-02-10 06:45:00","Taiwan to freeze entry of some Hong Kong , Macau residents to halt virus"
"http://m.news9.com/story/41662747/oxybreath-pro-reviews-2020-launch-new-anti-pollution-mask","","2020-02-10 10:30:00","OxyBreath Pro Reviews 2020 - Launch New Anti - Pollution Mask"
"https://www.news9.com/story/41662747/oxybreath-pro-reviews-2020-launch-new-anti-pollution-mask","","2020-02-10 07:45:00","OxyBreath Pro Reviews 2020 - Launch New Anti - Pollution Mask"
"https://topspb.tv/news/2020/02/10/v-peterburge-proshla-kontrolnaya-zakupka-medicinskih-masok/","","2020-02-10 21:00:00","В Петербурге прошла контрольная закупка медицинских масок"
"https://www.independent.co.uk/news/health/coronavirus-uk-cases-man-singapore-infect-france-spain-brighton-latest-updates-a9326106.html","https://www.independent.co.uk/news/health/coronavirus-uk-cases-man-singapore-infect-france-spain-brighton-latest-updates-a9326106.html?amp","2020-02-10 05:15:00","Coronavirus : united kingdom man linked to seven infections in three countries"
"https://elmundo.sv/con-mascarilla-en-su-rostro-presidente-chino-extiende-condolencias-tras-muertes-por-coronavirus/","","2020-02-10 18:15:00","Con mascarilla en su rostro , presidente chino extiende condolencias tras muertes por coronavirus"
"https://www.lep.co.uk/health/will-face-masks-stop-coronavirus-spreading-preston-1409895","https://www.lep.co.uk/health/will-face-masks-stop-coronavirus-spreading-preston-1409895?amp","2020-02-10 18:45:00","Will face masks stop coronavirus spreading in Preston ? "
