URL,MobileURL,Date,Title
"https://www.thestar.com.my/news/nation/2020/01/28/supply-of-face-masks-being-monitored-says-saifuddin","","2020-01-28 06:45:00","Supply of face masks being monitored , says Saifuddin"
"https://tvzvezda.ru/news/vstrane_i_mire/content/20201281724-2nmE2.html","https://m.tvzvezda.ru/news/vstrane_i_mire/content/20201281724-2nmE2.html/amp/","2020-01-28 15:00:00","Россияне рассказали о жизни в охваченном коронавирусом Китае"
"https://www.independent.co.uk/news/world/asia/coronavirus-china-news-baby-birth-pregnant-woman-caesarean-wuhan-a9305606.html","https://www.independent.co.uk/news/world/asia/coronavirus-china-news-baby-birth-pregnant-woman-caesarean-wuhan-a9305606.html?amp","2020-01-28 15:00:00","Chinese coronavirus patient gives birth to boy by caesarean :  I just want my baby to be healthy  "
"https://exame.abril.com.br/mundo/hong-kong-suspende-trens-para-china-continental-para-conter-coronavirus/","https://exame.abril.com.br/mundo/hong-kong-suspende-trens-para-china-continental-para-conter-coronavirus/amp/","2020-01-28 18:00:00","Hong Kong suspende trens para China continental para conter coronavírus"
"https://www.nytimes.com/reuters/2020/01/28/world/asia/28reuters-china-health-hongkong.html","","2020-01-28 12:30:00","Hong Kong to Suspend High - Speed Rail Service in Bid to Halt Spread of Coronavirus"
"https://news.abs-cbn.com/overseas/01/28/20/china-urges-citizens-to-delay-foreign-travel-over-virus-fears","","2020-01-28 06:45:00","China urges citizens to delay foreign travel over virus fears"
"https://tribune.com.pk/story/2146113/1-travellers-must-carry-corona-free-certificate-na-panel/","https://tribune.com.pk/story/2146113/1-travellers-must-carry-corona-free-certificate-na-panel/?amp=1","2020-01-28 20:00:00","Travellers must carry  corona free certificate : NA panel"
"https://www.economiahoy.mx/internacional-eAm-mexico/noticias/10324159/01/20/Hong-Kong-suspende-conexiones-de-tren-y-ferry-con-China-para-contener-el-coronavirus.html","https://www.economiahoy.mx/internacional-eAm-mexico/amp/10324159/Hong-Kong-suspende-conexiones-de-tren-y-ferry-con-China-para-contener-el-coronavirus","2020-01-28 14:30:00","Hong Kong suspende conexiones de tren y ferry con China para contener el coronavirus"
"https://www.economiahoy.mx/www.economiahoy.mx/internacional-eAm-mexico/noticias/10324159/01/20/Hong-Kong-suspende-conexiones-de-tren-y-ferry-con-China-para-contener-el-coronavirus.html","https://www.economiahoy.mx/internacional-eAm-mexico/amp/10324159/Hong-Kong-suspende-conexiones-de-tren-y-ferry-con-China-para-contener-el-coronavirus","2020-01-28 13:45:00","Hong Kong suspende conexiones de tren y ferry con China para contener el coronavirus"
"https://www.express.co.uk/life-style/health/1234587/coronavirus-latest-symptoms-UK-prepared-global-health-security-world-health-organisation","https://www.express.co.uk/life-style/health/1234587/coronavirus-latest-symptoms-UK-prepared-global-health-security-world-health-organisation/amp","2020-01-28 17:00:00","Coronavirus latest : The Global Health Security reveals how prepared united kingdom is for outbreak"
"https://tyzhden.ua/World/239974","","2020-01-28 14:15:00","Очевидиця : В Китаї паніки немає , але маски розкупили"
"https://kp.ua/life/658359-suprun-rasskazala-o-deistvennykh-y-bespoleznykh-sredstvakh-zaschyty-ot-koronavyrusa","","2020-01-28 21:15:00","Супрун рассказала о действенных и бесполезных средствах защиты от коронавируса"
"https://lta.reuters.com/articulo/china-salud-hongkong-idLTAKBN1ZR186-OUSLT","https://mobile.reuters.com/article/amp/lta/idLTAKBN1ZR186-OUSLT","2020-01-28 12:30:00","Hong Kong suspende conexiones de tren y ferry con China para contener el coronavirus"
"https://blitz.bg/zdrave/zdravni-novini/opredelikha-zarazyavaneto-s-virusa-ubiets-ot-kakvo-razstoyanie-stava_news723340.html","","2020-01-28 13:00:00","Определиха заразяването с вируса убиец от какво разстояние става"
"https://korrespondent.net/world/4187367-nazvany-novye-symptomy-y-sposoby-zarazhenyia-koronavyrusom","https://korrespondent.net/amp/4187367-nazvany-novye-symptomy-y-sposoby-zarazhenyia-koronavyrusom","2020-01-28 11:00:00","Названы новые симптомы и способы заражения коронавирусом"
"http://www.ng.ru/news/669084.html","https://amp.ng.ru/?p=http://www.ng.ru/news/669084.html","2020-01-28 06:15:00","Опрос : Коронавирус реальной угрозой считают более 50 % россиян / Новости / Независимая газета"
"https://www.news.com.au/lifestyle/health/health-problems/coronavirus-400-aussies-want-out-of-wuhan-china-right-now/news-story/705b440d92af7ffb24471609a665a728","https://amp.news.com.au/lifestyle/health/health-problems/coronavirus-400-aussies-want-out-of-wuhan-china-right-now/news-story/705b440d92af7ffb24471609a665a728","2020-01-28 10:30:00","Coronavirus : 400 Aussies want out of Wuhan , China right now"
"https://www.king5.com/article/news/health/family-claims-they-were-racially-stereotyped-during-coronavirus-outbreak/281-e2e4fc8a-fe9e-4cac-bb61-e874d23ca38a","https://www.king5.com/amp/article/news/health/family-claims-they-were-racially-stereotyped-during-coronavirus-outbreak/281-e2e4fc8a-fe9e-4cac-bb61-e874d23ca38a","2020-01-28 03:15:00","Issaquah family claims they were racially stereotyped in coronavirus outbreak"
"https://hsbnoticias.com/noticias/internacional/multan-con-10000-dolares-infectado-con-el-coronavirus-por-o-586959","http://m.hsbnoticias.com/noticias/internacional/multan-con-10000-dolares-infectado-con-el-coronavirus-por-o-586959?amp=1","2020-01-28 02:00:00","Multan con 10 . 000 dólares infectado con el coronavirus por ocultar síntomas en Taiwán"
"https://fijivillage.com/news/Coronavirus-Hong-Kong-to-slash-border-travel-as-virus-spreads-2s9k5r/","","2020-01-28 21:45:00","Fijivillage | Fiji Latest News and Sports website"
"http://bradva.bg/bg/article/article-178471","","2020-01-28 14:30:00","Определиха заразяването с вируса убиец от какво разстояние става"
"https://www.news.com.au/lifestyle/health/health-problems/government-raises-china-travel-warning-as-coronavirus-continues-to-spread/news-story/2447a190e564f32f939dfc32571ce1b0","https://amp.news.com.au/lifestyle/health/health-problems/government-raises-china-travel-warning-as-coronavirus-continues-to-spread/news-story/2447a190e564f32f939dfc32571ce1b0","2020-01-28 18:15:00","China travel advice updated as coronavirus continues to spread"
"https://www.news.com.au/travel/travel-updates/health-safety/government-raises-china-travel-warning-as-coronavirus-continues-to-spread/news-story/2447a190e564f32f939dfc32571ce1b0","https://amp.news.com.au/travel/travel-updates/health-safety/government-raises-china-travel-warning-as-coronavirus-continues-to-spread/news-story/2447a190e564f32f939dfc32571ce1b0","2020-01-28 20:15:00","China travel advice updated as coronavirus continues to spread"
"https://www.rbc.ru/rbcfreenews/5e30624e9a7947dc54dec82d","https://amp.rbc.ru/rbcnews/rbcfreenews/5e30624e9a7947dc54dec82d","2020-01-28 19:30:00","СМИ опубликовали видео доставки пациента с подозрением на коронавирус"
"https://www.reuters.com/article/china-health-hongkong/hong-kong-to-suspend-high-speed-rail-service-in-bid-to-halt-spread-of-coronavirus-idUSP8N29E00H","https://mobile.reuters.com/article/amp/idUSP8N29E00H","2020-01-28 12:00:00","Hong Kong to suspend high - speed rail service in bid to halt spread of coronavirus"
"https://www.msn.com/en-us/health/medical/when-will-there-be-a-coronavirus-vaccine-5-questions-answered/ar-BBZpbQw","","2020-01-28 13:45:00","When will there be a coronavirus vaccine ? 5 questions answered"
"https://www.msn.com/en-ca/news/canada/five-things-to-know-about-coronavirus-in-bc/ar-BBZpWIt","","2020-01-28 21:15:00","Five things to know about coronavirus in B . C . "
"http://www.capetalk.co.za/articles/373217/i-m-anxious-nobody-is-messing-around-people-are-staying-indoors","","2020-01-28 09:30:00","  Im anxious . Nobody is messing around . People are staying indoors  "
"https://islam-today.ru/novosti/2020/01/28/v-turcii-s-podozreniem-na-kitajskij-koronavirus-gospitalizirovali-12-celovek/","","2020-01-28 13:15:00","В Турции с подозрением на « китайский » коронавирус госпитализировали 12 человек"
"https://aif.ru/health/life/ne_epidemiya_a_ucheniya_kto_razduvaet_paniku_vokrug_koronavirusa","","2020-01-28 14:30:00","Не эпидемия , а учения ? Кто раздувает панику вокруг коронавируса"
"https://www.jcnet.com.br/noticias/nacional/2020/01/712251-ministerio-da-saude-investiga-caso-suspeito-de-coronavirus-no-brasil.html","https://www.jcnet.com.br/amp/noticias/nacional/2020/01/712251-ministerio-da-saude-investiga-caso-suspeito-de-coronavirus-no-brasil.html","2020-01-28 18:30:00","Ministério da Saúde investiga caso suspeito de coronavírus no Brasil"
"http://versii.com/news/405275/","","2020-01-28 13:15:00","Названы новые симптомы и способы заражения коронавирусом"
"https://www.kxly.com/392460-2/","","2020-01-28 06:15:00","UW Medicine is developing coronavirus diagnostic test"
"https://observers.france24.com/en/20200128-french-student-documents-life-wuhan-under-quarantine-after-coronavirus-outbreak","","2020-01-28 17:30:00","French student Instagrams life in Wuhan under coronavirus quarantine"
"https://tvzvezda.ru/news/vstrane_i_mire/content/2020128130-F9igI.html","https://m.tvzvezda.ru/news/vstrane_i_mire/content/2020128130-F9igI.html/amp/","2020-01-28 10:45:00","Выявлены новые симптомы и способы передачи коронавируса"
"https://elemental.medium.com/your-most-pressing-questions-about-the-coronavirus-answered-c99bff5f02e9?gi=dcd448daee2f","https://elemental.medium.com/amp/p/c99bff5f02e9","2020-01-28 22:30:00","Coronavirus : Your Most Pressing Questions , Answered"
"https://www.fox10phoenix.com/news/some-asu-students-on-edge-following-confirmed-case-of-coronavirus","https://www.fox10phoenix.com/news/some-asu-students-on-edge-following-confirmed-case-of-coronavirus.amp","2020-01-28 01:00:00","Some ASU students on edge following confirmed case of Coronavirus"
"https://www.independent.co.uk/news/world/asia/coronavirus-china-japan-latest-outbreak-bus-driver-wuhan-death-toll-a9305406.html","https://www.independent.co.uk/news/world/asia/coronavirus-china-japan-latest-outbreak-bus-driver-wuhan-death-toll-a9305406.html?amp","2020-01-28 11:00:00","Coronavirus : Japan confirms patient who caught disease did not visit China"
"https://theprovince.com/news/world/cabbie-kicks-out-coughing-passenger-who-just-came-back-from-wuhan/wcm/c8c89948-2b6f-4bc3-876f-a35d94e76333","https://theprovince.com/news/world/cabbie-kicks-out-coughing-passenger-who-just-came-back-from-wuhan/wcm/c8c89948-2b6f-4bc3-876f-a35d94e76333/amp","2020-01-28 22:15:00","Cabbie kicks out coughing passenger who just came back from Wuhan"
"https://www.thechronicle.com.au/news/400-aussies-want-out-of-china-right-now/3931253/","","2020-01-28 10:30:00","400 Aussies want out of China right now"
"https://podrobnosti.ua/2336023-peredaetsja-cherez-prikosnovenija-uchenye-raskryli-novye-simptomy-koronavirusa.html","","2020-01-28 12:00:00","  Передается через прикосновения : ученые раскрыли новую информацию о коронавирусе"
"https://novini.bg/sviat/azia/579721","https://novini.bg/amp/sviat/azia/579721","2020-01-28 15:00:00","Коронавирусът можел да се предава на разстояние от 2 метра - Азия"
"https://ru.euronews.com/2020/01/28/russia-coronavirus-border-close","","2020-01-28 18:45:00","Коронавирус : усиленные меры безопасности на границе с Китаем"
"https://www.jcnet.com.br/noticias/nacional/2020/01/712183-oms-recua-e-eleva-a-avaliacao-de-risco-internacional-para-o-coronavirus.html","https://www.jcnet.com.br/amp/noticias/nacional/2020/01/712183-oms-recua-e-eleva-a-avaliacao-de-risco-internacional-para-o-coronavirus.html","2020-01-28 00:30:00","OMS recua e eleva a avaliao de risco internacional para o coronavírus"
"https://rg.ru/2020/01/28/reg-urfo/risk-zarazheniia-koronavirusom-cherez-posylki-s-aliexpress-minimalen.html","https://rg.ru/amp/2020/01/28/reg-urfo/risk-zarazheniia-koronavirusom-cherez-posylki-s-aliexpress-minimalen.html","2020-01-28 07:45:00","Риск заражения коронавирусом через посылки с AliExpress минимален"
"https://www.naftemporiki.gr/story/1554893/xongk-kongk-kleinei-ta-sunora-pros-tin-kina-kathos-o-koronaios-eksaplonetai","https://m.naftemporiki.gr/amp/story/1554893/xongk-kongk-kleinei-ta-sunora-pros-tin-kina-kathos-o-koronaios-eksaplonetai","2020-01-28 11:45:00","Χονγκ Κονγκ : Κλείνει τα σύνορα προς την Κίνα καθώς ο κοροναϊός εξαπλώνεται"
"https://www.fox10phoenix.com/news/at-sky-harbor-some-express-concerns-as-coronavirus-outbreak-continues","https://www.fox10phoenix.com/news/at-sky-harbor-some-express-concerns-as-coronavirus-outbreak-continues.amp","2020-01-28 02:00:00","At Sky Harbor , some express concerns as Coronavirus outbreak continues"
"https://www.independent.co.uk/news/world/americas/coronavirus-us-wuhan-china-cdc-where-symptoms-a9306486.html","https://www.independent.co.uk/news/world/americas/coronavirus-us-wuhan-china-cdc-where-symptoms-a9306486.html?amp","2020-01-28 17:15:00","Coronavirus : US to increase staff at nearly two dozen airports as 105 monitored for China disease"
"https://www.sunshinecoastdaily.com.au/news/400-aussies-want-out-of-china-right-now/3931253/","","2020-01-28 10:30:00","400 Aussies want out of China right now"
"https://www.pharmacytimes.com/news/coronavirus-update-cdc-confirms-additional-cases-says-threat-to-us-public-is-low","","2020-01-28 16:30:00","CDC Confirms Additional Coronavirus Cases , Says Threat to US is Low"
"https://www.monitor.co.ug/News/National/Student-with-coronavirus-like-symptoms-hospitalized-in-Kenya/688334-5434902-9pnujx/","https://www.monitor.co.ug/News/National/Student-with-coronavirus-like-symptoms-hospitalized-in-Kenya/688334-5434902-view-asAMP-qxtjjs/index.html","2020-01-28 13:00:00","Student with coronavirus - like symptoms hospitalized in Kenya"
"https://periodicocorreo.com.mx/encanta-reaccion-de-una-bebe-que-prueba-por-primera-vez-el-helado/","https://periodicocorreo.com.mx/encanta-reaccion-de-una-bebe-que-prueba-por-primera-vez-el-helado/amp/","2020-01-28 22:00:00","Encanta reacción de una bebé que prueba por primera vez el helado"
"https://www.thestar.com.my/news/world/2020/01/28/suspected-chinese-coronavirus-patient-gives-birth-to-baby-by-caesarean","","2020-01-28 11:30:00","Suspected Chinese coronavirus patient gives birth to baby by caesarean"
"https://www.prokerala.com/news/articles/a1001922.html","https://www.prokerala.com/news/articles/a1001922.html?amp=1","2020-01-28 15:30:00","Two suspected Coronavirus patients in Hyderabad test negative"
"https://www.channelnewsasia.com/news/asia/suspected-wuhan-virus-patient-gives-birth-baby-caesarean-12361770","","2020-01-28 12:00:00","Suspected Chinese coronavirus patient gives birth to baby by caesarean"
"http://www.asianage.com/india/all-india/290120/screening-of-coronavirus-stepped-up-in-kolkata.html","https://www.asianage.com/amp/india/all-india/290120/screening-of-coronavirus-stepped-up-in-kolkata.html","2020-01-28 21:15:00","Screening of coronavirus stepped up in Kolkata"
"https://golos.ua/i/730889","","2020-01-28 12:15:00","Китайские ученые установили новые способы заражения коронавирусом"
"https://www.reuters.com/article/us-china-health-southkorea-economy/south-korea-all-out-to-contain-virus-outbreak-vows-to-stabilize-market-idUSKBN1ZQ2K6","https://mobile.reuters.com/article/amp/idUSKBN1ZQ2K6","2020-01-28 00:30:00","South Korea  all out  to contain virus outbreak , vows to stabilize market"
"https://www.reuters.com/article/us-china-health-southkorea-economy-idUSKBN1ZQ2K6","https://mobile.reuters.com/article/amp/idUSKBN1ZQ2K6","2020-01-28 00:30:00","South Korea  all out  to contain virus outbreak , vows to stabilize market"
"https://uk.reuters.com/article/us-china-health-southkorea-economy/south-korea-all-out-to-contain-virus-outbreak-vows-to-stabilize-market-idUKKBN1ZQ2K6","https://uk.mobile.reuters.com/article/amp/idUKKBN1ZQ2K6","2020-01-28 00:30:00","South Korea  all out  to contain virus outbreak , vows to stabilize market"
"https://in.reuters.com/article/us-china-health-southkorea-economy/south-korea-all-out-to-contain-virus-outbreak-vows-to-stabilize-market-idINKBN1ZQ2K6","https://in.mobile.reuters.com/article/amp/idINKBN1ZQ2K6","2020-01-28 00:45:00","South Korea  all out  to contain virus outbreak , vows to stabilize market"
"https://www.msn.com/en-ie/news/other/officials-explore-the-emergency-airlift-of-irish-people-trapped-in-virus-hit-city/ar-BBZodZQ","","2020-01-28 03:30:00","Officials explore the emergency airlift of Irish people trapped in virus - hit city"
"https://www.nst.com.my/world/world/2020/01/560461/suspected-coronavirus-patient-gives-birth","//www.nst.com.my/node/560461/amp","2020-01-28 11:15:00","Suspected coronavirus patient gives birth"
"https://www.jpost.com/International/Suspected-Chinese-coronavirus-patient-gives-birth-to-baby-by-cesarean-615646","https://m.jpost.com/International/Suspected-Chinese-coronavirus-patient-gives-birth-to-baby-by-cesarean-615646","2020-01-28 10:45:00","Suspected Chinese coronavirus patient gives birth to baby by cesarean"
"https://www.letelegramme.fr/sante/coronavirus-le-masque-un-reflexe-de-protection-pas-forcement-efficace-28-01-2020-12489056.php","https://www.letelegramme.fr/_amp/056/12489056.php","2020-01-28 09:45:00","Coronavirus  : le masque , un réflexe de protection pas forcément efficace"
"https://www.mk.ru/social/health/2020/01/28/professor-iz-ukhanya-posovetoval-prikryvat-rot-loktyami-izza-koronavirusa.html","https://www.mk.ru/amp/social/health/2020/01/28/professor-iz-ukhanya-posovetoval-prikryvat-rot-loktyami-izza-koronavirusa.html","2020-01-28 12:00:00","Профессор из Уханя посоветовал прикрывать рот локтями из - за коронавируса"
"https://www.reuters.com/article/us-china-health-hongkong/hong-kong-to-suspend-high-speed-rail-service-in-bid-to-halt-spread-of-coronavirus-idUSKBN1ZR0VC","https://mobile.reuters.com/article/amp/idUSKBN1ZR0VC","2020-01-28 09:30:00","Hong Kong to suspend high - speed rail service in bid to halt spread of coronavirus"
"https://mainichi.jp/english/articles/20200128/p2g/00m/0in/084000c","","2020-01-28 13:45:00","S . Korea to send evacuation planes to Wuhan on Thurs ., Fri . "
"https://oglobo.globo.com/sociedade/equipe-que-atendeu-mineira-com-suspeita-de-coronavirus-na-upa-de-belo-horizonte-usou-mascaras-de-protecao-24216283","","2020-01-28 21:30:00","Equipe que atendeu mineira com suspeita de coronavírus na UPA de Belo Horizonte usou máscaras de proteo"
"https://www.cbc.ca/news/canada/manitoba/coronavirus-update-manitoba-1.5443181","https://www.cbc.ca/amp/1.5443181","2020-01-28 20:15:00",""
"https://www.washingtonexaminer.com/news/hong-kong-and-russia-limit-travel-from-china-to-halt-spread-of-coronavirus","https://www.washingtonexaminer.com/news/hong-kong-and-russia-limit-travel-from-china-to-halt-spread-of-coronavirus?_amp=true","2020-01-28 12:30:00","Hong Kong and Russia limit travel from China to halt spread of coronavirus"
"https://www.bbc.com/russian/news-51279286","https://www.bbc.com/russian/amp/news-51279286","2020-01-28 13:15:00","  Держись , Ухань ! Как жители Китая подбадривают друг друга во время вспышки коронавируса"
"https://www.nzherald.co.nz/world/news/article.cfm?c_id=2&objectid=12304042","","2020-01-28 04:00:00","Coronavirus death toll spikes to over 100 , thousands infected"
"https://www.msn.com/en-us/health/medical/what-you-need-to-know-about-the-coronavirus/ar-BBZpMCh","","2020-01-28 19:15:00","What you need to know about the coronavirus"
"https://www.republicworld.com/world-news/rest-of-the-world-news/moon-tours-hospital-as-skorea-virus-preps-continue.html","https://www.republicworld.com/amp/world-news/rest-of-the-world-news/moon-tours-hospital-as-skorea-virus-preps-continue.html","2020-01-28 09:00:00","Moon tours hospital as SKorea virus preps continue"
"https://www.castanet.net/news/Kelowna/275739/1st-case-of-coronavirus-in-B-C-cause-for-concern","","2020-01-28 23:45:00","1st case of coronavirus in B . C . cause for concern ? - Kelowna News"
"https://www.newsfirst.lk/2020/01/28/opposition-leader-vows-fullest-support-to-eradicate-corona-virus/","https://www.newsfirst.lk/2020/01/28/opposition-leader-vows-fullest-support-to-eradicate-corona-virus/amp/","2020-01-28 17:15:00","Opposition Leader vows fullest support to eradicate Corona virus"
"https://www.thesun.co.uk/news/10837053/coronavirus-uk-birmingham-china-wuhan/","https://www.thesun.co.uk/news/10837053/coronavirus-uk-birmingham-china-wuhan/amp/","2020-01-28 17:30:00","Coronavirus fears in united kingdom as hazmat paramedic helps patient SENT HOME by GP – despite returning from Wuhan – The Sun"
"https://uk.reuters.com/article/uk-china-health-pregnantwoman/suspected-chinese-coronavirus-patient-gives-birth-to-baby-by-caesarean-idUKKBN1ZR123","https://uk.mobile.reuters.com/article/amp/idUKKBN1ZR123","2020-01-28 11:15:00","Suspected Chinese coronavirus patient gives birth to baby by caesarean"
"https://in.reuters.com/article/china-health-pregnantwoman/suspected-chinese-coronavirus-patient-gives-birth-to-baby-by-caesarean-idINKBN1ZR11V","https://in.mobile.reuters.com/article/amp/idINKBN1ZR11V","2020-01-28 11:15:00","Suspected Chinese coronavirus patient gives birth to baby by caesarean"
"https://www.reuters.com/article/us-china-health-pregnantwoman/suspected-chinese-coronavirus-patient-gives-birth-to-baby-by-caesarian-idUSKBN1ZR11N","https://mobile.reuters.com/article/amp/idUSKBN1ZR11N","2020-01-28 11:00:00","Suspected Chinese coronavirus patient gives birth to baby by caesarian"
