URL,MobileURL,Date,Title
"https://www.mirror.co.uk/news/uk-news/doctor-debunks-six-common-myths-21873092","https://www.mirror.co.uk/news/uk-news/doctor-debunks-six-common-myths-21873092.amp","2020-04-15 17:15:00","Doctor debunks six common myths of coronavirus - including causes and cures"
"https://www.perthnow.com.au/news/coronavirus/coronavirus-crisis-health-authorities-debunk-the-wildest-covid-19-myths-ng-b881518639z","https://www.perthnow.com.au/news/coronavirus/coronavirus-crisis-health-authorities-debunk-the-wildest-covid-19-myths-ng-b881518639z.amp","2020-04-15 06:00:00","Coronavirus crisis : Health authorities debunk the wildest COVID - 19 myths"
"https://golos.ua/i/745243","","2020-04-15 11:00:00","Израильский врач прокомментировал роль чеснока и имбиря в борьбе с коронавирусом"
"https://lifestyle.inquirer.net/361093/onion-garlic-rich-chicken-soup-to-heal-lung-infections/","https://lifestyle.inquirer.net/361093/onion-garlic-rich-chicken-soup-to-heal-lung-infections/amp/","2020-04-15 22:45:00","Onion -, garlic - rich chicken soup to heal lung infections"
"https://odia.ig.com.br/rio-de-janeiro/2020/04/5899891-cha-de-erva-doce--alho-e-gengibre.html","https://odia.ig.com.br/amp/rio-de-janeiro/2020/04/5899891-cha-de-erva-doce--alho-e-gengibre.html","2020-04-15 04:45:00","Chá de erva - doce , alho e gengibre"
"https://www.kp.by/daily/27118/4198493/","https://amp.kp.by/daily/27118/4198493/","2020-04-15 14:15:00"," « Вечером пришла проверка , а утром на планерке дали новые цены ». Лимоны , имбирь и чеснок подешевели"
"https://www.stltoday.com/lifestyles/food-and-cooking/what-to-use-when-the-store-is-out-of-what-you-want/article_3d5b0995-b2dd-53f1-a8ad-ee422c0482d8.html","https://www.stltoday.com/lifestyles/food-and-cooking/what-to-use-when-the-store-is-out-of-what-you-want/article_3d5b0995-b2dd-53f1-a8ad-ee422c0482d8.amp.html","2020-04-15 12:45:00","What to use when the store is out of what you want"
"https://www.liverpoolecho.co.uk/whats-on/food-drink-news/dominos-makes-major-menu-change-18093971","https://www.liverpoolecho.co.uk/whats-on/food-drink-news/dominos-makes-major-menu-change-18093971.amp","2020-04-15 16:45:00","Domino makes major menu change by ditching loads of favourites"
"https://www.eldestapeweb.com/nota/los-nuevos-mitos-sobre-el-coronavirus-la-oms-revela-toda-la-verdad-sobre-la-pandemia-202041419190","https://www.eldestapeweb.com/nota/los-nuevos-mitos-sobre-el-coronavirus-la-oms-revela-toda-la-verdad-sobre-la-pandemia-202041419190/amp","2020-04-15 01:30:00","Los nuevos mitos sobre el coronavirus : la OMS revela toda la verdad sobre la pandemia"
"https://diariocorreo.pe/peru/coronavirus-peru-gobernador-de-ucayali-recomienda-el-consumo-kion-limon-y-cebolla-para-combatir-el-covid-19-noticia/","https://diariocorreo.pe/peru/coronavirus-peru-gobernador-de-ucayali-recomienda-el-consumo-kion-limon-y-cebolla-para-combatir-el-covid-19-noticia/?outputType=amp","2020-04-15 16:15:00","Coronavirus Perú| Gobernador de Ucayali recomienda el consumo kion , limón y cebolla para combatir el COVID - 19 Perú"
"https://larepublica.pe:443/sociedad/2020/04/15/arequipa-productores-de-palta-y-ajo-se-quedaran-con-sus-cosechas-lrsd/","https://larepublica.pe/sociedad/2020/04/15/arequipa-productores-de-palta-y-ajo-se-quedaran-con-sus-cosechas-lrsd/?outputType=amp","2020-04-15 11:45:00","Arequipa : Productores de palta y ajo se quedarán con sus cosechas"
"https://www.walesonline.co.uk/news/uk-news/dominos-axes-popular-pizzas-sides-18092343","https://www.walesonline.co.uk/news/uk-news/dominos-axes-popular-pizzas-sides-18092343.amp","2020-04-15 06:15:00","Domino axes popular pizzas and sides thanks to coronavirus"
"https://www.bristolpost.co.uk/news/dominos-axes-popular-pizzas-sides-4047166","","2020-04-15 16:15:00","Domino axes popular pizzas and sides thanks to coronavirus"
"https://www.somersetlive.co.uk/news/uk-world-news/dominos-axes-popular-pizzas-sides-4047166","","2020-04-15 07:00:00","Domino axes popular pizzas and sides thanks to coronavirus"
"https://www.thenews.com.pk/print/644617-who-blasts-19-common-myths-related-to-coronavirus","https://www.thenews.com.pk/amp/644617-who-blasts-19-common-myths-related-to-coronavirus","2020-04-15 02:15:00","WHO blasts 19 common myths related to coronavirus"
"https://www.coventrytelegraph.net/news/uk-world-news/dominos-axes-popular-pizzas-sides-18092343","","2020-04-15 07:15:00","Domino axes popular pizzas and sides thanks to coronavirus"
"https://www.hulldailymail.co.uk/news/uk-world-news/dominos-axes-popular-pizzas-sides-4047166","https://www.hulldailymail.co.uk/news/uk-world-news/dominos-axes-popular-pizzas-sides-4047166.amp","2020-04-15 09:15:00","Domino axes popular pizzas and sides thanks to coronavirus"
"https://larepublica.pe/economia/2020/04/14/arequipa-el-70-de-palta-para-exportar-no-salio-del-pais-por-cierre-de-fronteras-lrsd/","https://larepublica.pe/economia/2020/04/14/arequipa-el-70-de-palta-para-exportar-no-salio-del-pais-por-cierre-de-fronteras-lrsd/?outputType=amp","2020-04-15 01:00:00","Arequipa : El 70 % de palta para exportar no salió del país por cierre de fronteras"
"https://larepublica.pe:443/economia/2020/04/14/arequipa-el-70-de-palta-para-exportar-no-salio-del-pais-por-cierre-de-fronteras-lrsd/","https://larepublica.pe/economia/2020/04/14/arequipa-el-70-de-palta-para-exportar-no-salio-del-pais-por-cierre-de-fronteras-lrsd/?outputType=amp","2020-04-15 01:15:00","Arequipa : El 70 % de palta para exportar no salió del país por cierre de fronteras"
"http://www.msn.com/en-us/foodanddrink/recipes/disney-shares-grilled-cheese-sandwich-recipe-from-toy-story-land/ar-BB12CzDS","","2020-04-15 10:15:00","Disney shares grilled cheese sandwich recipe from Toy Story Land"
"https://larepublica.pe/sociedad/2020/04/15/arequipa-productores-de-palta-y-ajo-se-quedaran-con-sus-cosechas-lrsd/","https://larepublica.pe/sociedad/2020/04/15/arequipa-productores-de-palta-y-ajo-se-quedaran-con-sus-cosechas-lrsd/?outputType=amp","2020-04-15 12:30:00","Arequipa : Productores de palta y ajo se quedarán con sus cosechas"
"https://www.derbytelegraph.co.uk/news/uk-world-news/dominos-axes-popular-pizzas-sides-4047166","","2020-04-15 06:45:00","Domino axes popular pizzas and sides thanks to coronavirus"
"https://www.myjournalcourier.com/news/article/5G-networks-and-other-coronavirus-myths-15201875.php","https://www.myjournalcourier.com/news/amp/5G-networks-and-other-coronavirus-myths-15201875.php","2020-04-15 16:00:00","5G networks and other coronavirus myths"
"https://www.theintelligencer.com/news/article/5G-networks-and-other-coronavirus-myths-15201875.php","","2020-04-15 15:45:00","5G networks and other coronavirus myths"
"https://www.msn.com/en-us/news/us/coronavirus-impact-marin-county-fair-cancelled-over-fear-of-spread/ar-BB12G91L","","2020-04-15 18:30:00","Coronavirus Impact : Marin County Fair Cancelled Over Fear Of Spread"
"https://www.getsurrey.co.uk/news/uk-world-news/dominos-axes-popular-pizzas-sides-18092343","","2020-04-15 06:45:00","Domino axes popular pizzas and sides thanks to coronavirus"
"https://kfbk.iheart.com/content/2020-04-15-boost-your-immune-system-with-a-pandemic-pantry/","","2020-04-15 15:45:00","Boost Your Immune System With A  Pandemic Pantry  "
"https://kste.iheart.com/content/2020-04-15-boost-your-immune-system-with-a-pandemic-pantry/","","2020-04-15 14:00:00","Boost Your Immune System With A  Pandemic Pantry  "
"https://www.laprensa.hn/inicio/1372635-417/se%F1ales-covid-19-coronavirus-pandemia-virus","","2020-04-15 23:15:00","Las 10 señales de que usted puede estar contagiado de COVID - 19"
"https://www.laprensa.hn/guiamedica/1372635-418/se%C3%B1ales-covid-19-coronavirus-pandemia-virus","","2020-04-15 17:00:00","Las 10 señales de que usted puede estar contagiado de COVID - 19"
"http://vgr.by/2020/04/15/spasaet-li-ot-koronavirusa-chesnok-pochemu-u-grodnenskogo-biznesa-vse-pechalno-i-kuda-delis-nelegalnyie-torgovcyi-s-ryinkov-anons-svezhego-nomera-gazetyi-vecherniy-grodno/","","2020-04-15 11:45:00","Спасает ли от коронавируса чеснок , почему у гродненского бизнеса все печально и куда делись нелегальные торговцы с рынков анонс свежего номера газеты « Вечерний Гродно » Новости Новости и события Гродно"
"https://www.argusleader.com/story/news/factcheck/2020/04/14/fact-check-smithfield-owned-chinese-firm-sells-us-processed-meat/2987004001/","https://amp.argusleader.com/amp/2987004001","2020-04-15 19:45:00","Fact check : Smithfield , owned by Chinese firm , sells US - processed meat"
"https://www.latimes.com/food/story/2020-04-15/dear-johns-tv-dinners-coronavirus","https://www.latimes.com/food/story/2020-04-15/dear-johns-tv-dinners-coronavirus?_amp=true","2020-04-15 15:00:00","Dear John restaurant is now making heat - and - eat TV dinners"
"https://news.yahoo.com/surviving-shutdown-dear-johns-launches-130043301.html","https://news.yahoo.com/amphtml/surviving-shutdown-dear-johns-launches-130043301.html","2020-04-15 13:30:00","Surviving the shutdown : Dear John launches new heat - and - eat TV dinners"
"https://www.nur.kz/1850783-najdeno-blokiruusee-koronavirus-lekarstvo.html","","2020-04-15 01:15:00","Найдено блокирующее коронавирус лекарство"
"https://pl.sputniknews.com/spoleczenstwo/2020041512250546-zamiast-imbiru-ktore-warzywa-chronia-organizm-przed-wirusami-sputnik/","https://pl.sputniknews.com/amp/spoleczenstwo/2020041512250546-zamiast-imbiru-ktore-warzywa-chronia-organizm-przed-wirusami-sputnik/","2020-04-15 09:15:00","Zamiast imbiru : które warzywa chronią organizm przed wirusami ? "
"https://www.birminghammail.co.uk/whats-on/food-drink-news/mcdonalds-customer-shares-recipe-make-18094407","https://www.birminghammail.co.uk/whats-on/food-drink-news/mcdonalds-customer-shares-recipe-make-18094407.amp","2020-04-15 14:30:00","McDonald customer shares recipe to make chicken nuggets at home and theyre  better  than real thing"
"https://poshan.outlookindia.com/story/poshan-news-covid-19-herbs-that-strengthen-your-immune-system/350819","","2020-04-15 18:00:00","COVID - 19 : Herbs That Strengthen Your Immune System"
"https://www.pulse.ng/news/metro/is-red-oil-cure-for-coronavirus/qp8m10g","https://www.pulse.ng/news/metro/is-red-oil-cure-for-coronavirus/qp8m10g.amp","2020-04-15 08:30:00","Is Red Oil cure for Coronavirus ? [ ARTICLE ] "
"https://www.rbc.ru/rbcfreenews/5e967ded9a7947080fa0dfcb","https://amp.rbc.ru/rbcnews/rbcfreenews/5e967ded9a7947080fa0dfcb","2020-04-15 04:30:00","Ученые из Канады обнаружили блокирующий коронавирус препарат"
"https://www.theadvocate.com/baton_rouge/news/coronavirus/article_66668822-7e73-11ea-a0ff-9b635a17cc96.html","https://www.theadvocate.com/baton_rouge/news/coronavirus/article_66668822-7e73-11ea-a0ff-9b635a17cc96.amp.html","2020-04-15 16:15:00","Takeout in Baton Rouge : A bourbon barbecue burger , ribs and brisket platters and Da Gumbo sandwich"
"https://www.ksby.com/news/local-news/local-restaurant-provides-meals-to-santa-maria-senior-living-apartment-complex","https://www.ksby.com/news/local-news/local-restaurant-provides-meals-to-santa-maria-senior-living-apartment-complex?_amp=true","2020-04-15 06:15:00","Local restaurant provides meals to Santa Maria senior living apartment complex"
"https://www.khaama.com/persian/archives/71231","","2020-04-15 22:15:00","غنی در فرمانی سه تن از معینان وزارت صحت را برکنار کرده است - خبرگزاری خامه پرس – فارسی"
"https://durangoherald.com/articles/321487-durango-restaurants-prepare-meals-for-nurses-doctors-on-front-lines","https://durangoherald.com/amp/321487-durango-restaurants-prepare-meals-for-nurses-doctors-on-front-lines","2020-04-15 23:00:00","Durango restaurants prepare meals for nurses , doctors on front lines"
"https://www.usatoday.com/story/life/food-dining/2020/04/15/coronavirus-mcdonalds-disney-parks-doubletree-cheesecake-factory-share-secret-recipes/2993756001/","https://amp.usatoday.com/amp/2993756001","2020-04-15 23:00:00","Coronavirus : McDonald , Disney , DoubleTree share at - home recipes"
"https://www.thenational.ae/arts-culture/art/omani-artist-creates-a-series-of-coronavirus-related-artworks-to-send-a-powerful-message-about-staying-home-1.1006268","https://amp.thenational.ae/arts-culture/art/omani-artist-creates-a-series-of-coronavirus-related-artworks-to-send-a-powerful-message-about-staying-home-1.1006268","2020-04-15 09:15:00","Omani artist creates a series of coronavirus - related artworks to send a powerful message about staying home"
"https://diario.mx/espectaculos/covid-19-deja-varado-a-kiko-en-eu-20200414-1651925.html","https://diario.mx/espectaculos/amp/covid-19-deja-varado-a-kiko-en-eu-20200414-1651925.html","2020-04-15 01:45:00","Covid - 19 deja varado a  Kiko  en EU"
"https://life.ru/p/1318562","https://life.ru/p/1318562/amp","2020-04-15 07:00:00","Врач рассказал о роковой ошибке при создании домашнего антисептика"
"https://gulfnews.com/uae/covid-19-quarantine-brings-out-the-best-chefs-in-uae-mums-1.1586965442733","https://gulfnews.com/amp/uae/covid-19-quarantine-brings-out-the-best-chefs-in-uae-mums-1.1586965442733","2020-04-15 16:45:00","COVID - 19 quarantine brings out the best chefs in UAE : Mums"
"https://www.yourlocalguardian.co.uk/news/18382146.dominos-axes-pizzas-sides-due-coronavirus/","","2020-04-15 19:15:00","Domino axes pizzas and sides due to coronavirus"
"https://www.blesk.cz/clanek/zpravy-koronavirus/640737/lek-zatim-neni-ale-falesnych-vyrobku-pribyva-pred-koronasmejdy-varuje-inspekce.html","","2020-04-15 12:15:00","Koronavirus a podvodníci : Před koronašmejdy s doplňky stravy varuje inspekce"
"https://www.vogue.com/article/chicken-soup-recipe-for-your-anxious-soul-la-mercerie","https://www.vogue.com/article/chicken-soup-recipe-for-your-anxious-soul-la-mercerie/amp","2020-04-15 19:30:00","A Chicken Soup Recipe For Your Anxious Soul"
"http://jamaica-star.com/article/news/20200415/herbalist-using-steam-baths-beat-covid-19-doctor-advises-against-practice","","2020-04-15 13:45:00","Herbalist using steam baths to beat COVID - 19 - But doctor advises against practice"
"https://www.dnaindia.com/television/report-it-is-not-a-vacation-for-me-chhavi-mittal-on-managing-household-working-from-home-amid-coronavirus-lockdown-2821118","https://www.dnaindia.com/television/report-it-is-not-a-vacation-for-me-chhavi-mittal-on-managing-household-working-from-home-amid-coronavirus-lockdown-2821118/amp","2020-04-15 12:00:00","  It is not a vacation for me : Chhavi Mittal on managing household , working from home amid coronavirus lockdown"
"https://www.indiatimes.com/trending/quarantine-cooking-easy-recipes-510882.html","https://www.indiatimes.com/amp/trending/quarantine-cooking-easy-recipes-510882.html","2020-04-15 13:15:00","Quarantine Special : 7 Mouthwatering And Easy Recipes That You Are Missing During Lockdown"
"https://www.limaohio.com/news/406721/todays-latest-updates-on-the-coronavirus-pandemic-36","","2020-04-15 19:30:00","Today latest updates on the coronavirus pandemic"
"https://www.uzdaily.com/ru/post/50970","","2020-04-15 11:00:00","Согласно новому исследованию , коронавирус может передаваться на расстоянии четырех метров"
"https://www.informador.mx/entretenimiento/Osvaldo-Benavides-te-quiere-en-casa-20200415-0010.html","https://www.informador.mx/amp/entretenimiento/Osvaldo-Benavides-te-quiere-en-casa-20200415-0010.html","2020-04-15 07:15:00","Osvaldo Benavides te quiere en casa"
"https://www.msn.com/en-us/foodanddrink/foodnews/grazing-from-the-takeout-burger-menu-at-grazers-in-williston/ar-BB12Fb7C","","2020-04-15 13:15:00","Grazing from the takeout burger menu at Grazers in Williston"
"https://rueconomics.ru/437638-zarazhennyi-babkinoi-vasilev-nazval-simptomy-koronavirusa-i-predrek-bolezn-mnogikh-zvezd","https://rueconomics.ru/amp/437638-zarazhennyi-babkinoi-vasilev-nazval-simptomy-koronavirusa-i-predrek-bolezn-mnogikh-zvezd","2020-04-15 15:45:00","Зараженный Бабкиной Васильев назвал симптомы коронавируса и предрек болезнь многих звезд"
"https://thepeninsulaqatar.com/article/15/04/2020/Frozen-hash-browns-make-an-easy,-crispy-crust-for-a-savory-pie","","2020-04-15 10:00:00","Frozen hash browns make an easy , crispy crust for a savory pie"
"https://www.washingtonian.com/2020/04/15/4-chefs-share-their-secrets-for-upgrading-instant-ramen/","","2020-04-15 18:30:00","4 Chefs Share Their Secrets for Upgrading Instant Ramen"
"https://www.eonline.com/uk/news/1141081/recipes-the-top-chef-all-stars-l-a-contestants-are-cooking-up-while-social-distancing","https://m.eonline.com/uk/amp/news/1141081/recipes-the-top-chef-all-stars-l-a-contestants-are-cooking-up-while-social-distancing","2020-04-15 18:45:00","Top Chef All Stars L . A . Share Recipes to Cook Up in Quarantine"
"https://www.eonline.com/ca/news/1141079/recipes-the-top-chef-all-stars-l-a-contestants-are-cooking-up-while-social-distancing","https://m.eonline.com/ca/amp/news/1141079/recipes-the-top-chef-all-stars-l-a-contestants-are-cooking-up-while-social-distancing","2020-04-15 18:15:00","Top Chef All Stars L . A . Share Recipes to Cook Up in Quarantine"
"https://www.tellychakkar.com/movie/movie-news/italian-beauty-actress-giorgia-andrian-try-hands-indian-dishes-amid-self-isolation","https://www.tellychakkar.com/movie/movie-news/italian-beauty-actress-giorgia-andrian-try-hands-indian-dishes-amid-self-isolation?amp","2020-04-15 12:00:00","Italian Beauty Actress Giorgia Andrian try hands - on Indian Dishes amid self - isolation"
"https://vestikavkaza.ru/analytics/shavkat-mirzieev-teper-zemlya-i-tolko-zemlya-smozhet-nas-prokormit.html","https://vestikavkaza.ru/amp/299220","2020-04-15 07:45:00","Шавкат Мирзиеев :  Теперь земля и только земля сможет нас прокормить  "
"https://www.texasmonthly.com/food/recipe-texas-style-bowl-o-red-beans/","https://www.texasmonthly.com/food/recipe-texas-style-bowl-o-red-beans/amp/","2020-04-15 21:30:00","Recipe : Texas - Style Bowl o  Red Beans – Texas Monthly"
"https://nationalinterest.org/blog/buzz/coronavirus-shows-we-havent-changed-how-we-respond-pandemics-144147","","2020-04-15 09:15:00","Coronavirus Shows That We Havent Changed How We Respond to Pandemics"
"https://www.dailymail.co.uk/tvshowbiz/article-8221177/Paul-OGrady-64-reveals-dog-Boycie-passed-away.html","https://www.dailymail.co.uk/tvshowbiz/article-8221177/amp/Paul-OGrady-64-reveals-dog-Boycie-passed-away.html","2020-04-15 11:15:00","Paul OGrady , 64 , reveals his dog Boycie has passed away"
"https://www.worldatlas.com/articles/10-natural-foods-to-boost-your-immune-system.html","https://www.worldatlas.com/amp/articles/10-natural-foods-to-boost-your-immune-system.html","2020-04-15 22:30:00","10 Natural Foods To Boost Your Immune System"
"https://www.spokesman.com/stories/2020/apr/14/wheres-the-beef-in-these-five-recipes-for-at-home-/","https://www.spokesman.com/stories/2020/apr/14/wheres-the-beef-in-these-five-recipes-for-at-home-/?amp-content=amp","2020-04-15 03:30:00","Where the beef ? In these five recipes for at - home dishes , beef can play a comforting role"
"https://www.baikal-daily.ru/news/16/388504/","https://m.baikal-daily.ru/news/16/388504/","2020-04-15 07:45:00","Лудуб Очиров призывает победить коронавирус в новом клипе | Байкал Daily - Новости Бурятии и Улан - Удэ в реальном времени"
"https://menafn.com/1100022843/Coronavirus-Black-Death-rumours-and-remedies-show-how-little-people-have-changed","","2020-04-15 06:00:00","Coronavirus : Black Death rumours and remedies show how little people have changed"
"https://hd983.com/2020/04/14/recipe-grilled-cheese-sandwich-disney-toy-story-land/","","2020-04-15 00:15:00","Revealed : Recipe To The Grilled Cheese Sandwich from Disney Toy Story Land"
"https://krdo.com/news/2020/04/14/utah-man-tests-positive-for-covid-19-after-trip-to-steamboat-springs-says-virus-left-him-with-neurological-damage/","https://krdo.com/amp/utah-man-tests-positive-for-covid-19-after-trip-to-steamboat-springs-says-virus-left-him-with-neurological-damage","2020-04-15 05:00:00","Utah man tests positive for COVID - 19 after trip to Steamboat Springs , says virus left him with neurological damage"
"https://www.thechronicleherald.ca/news/local/john-demont-nova-scotia-victory-gardens-are-making-a-pandemic-comeback-437632/","","2020-04-15 14:15:00","JOHN DeMONT : Nova Scotia victory gardens are making a pandemic comeback | Local | News"
"https://www.liverpoolecho.co.uk/whats-on/food-drink-news/mcdonalds-fan-makes-chicken-nuggets-18093899","https://www.liverpoolecho.co.uk/whats-on/food-drink-news/mcdonalds-fan-makes-chicken-nuggets-18093899.amp","2020-04-15 13:00:00","McDonald fan makes chicken nuggets at home and theyre  better than real thing  "
"https://www.sitioandino.com.ar/n/320265-el-programa-respaldar-distribuye-frutas-y-verduras-a-precio-justo/","","2020-04-15 00:15:00","El programa  Respaldar  distribuye frutas y verduras a precio justo"
"https://infotel.ca/inwine/closer-to-home-kamloops-okanagan-turns-to-small-farms-for-locally-sourced-food/it72271","","2020-04-15 16:00:00","CLOSER TO HOME : Kamloops , Okanagan turns to small farms for locally - sourced food - InfoNews"
"https://www.nj.com/food/2020/04/i-tried-an-affordable-meal-kit-how-does-it-stack-up-to-blue-apron-and-hellofresh.html","https://www.nj.com/food/2020/04/i-tried-an-affordable-meal-kit-how-does-it-stack-up-to-blue-apron-and-hellofresh.html?outputType=amp","2020-04-16 00:00:00","I tried an  affordable meal kit . How does it stack up to Blue Apron and HelloFresh ? "
"https://www.newsshopper.co.uk/news/18382146.dominos-axes-pizzas-sides-due-coronavirus/","","2020-04-15 18:45:00","Domino axes pizzas and sides due to coronavirus"
"https://www.thisislocallondon.co.uk/news/18382146.dominos-axes-pizzas-sides-due-coronavirus/","","2020-04-15 20:15:00","Domino axes pizzas and sides due to coronavirus | This Is Local London"
"https://www.wimbledonguardian.co.uk/news/18382146.dominos-axes-pizzas-sides-due-coronavirus/","","2020-04-15 19:00:00","Domino axes pizzas and sides due to coronavirus"
"http://www.jamaicaobserver.com/news/maroons-focus-on-boosting-immune-system-amid-covid-19_191960?profile=1373","http://amp.jamaicaobserver.com/news/maroons-focus-on-boosting-immune-system-amid-covid-19_191960?profile=1373","2020-04-15 11:15:00","Maroons focus on boosting immune system amid COVID - 19"
"http://www.jamaicaobserver.com/news/maroons-focus-on-boosting-immune-system-amid-covid-19_191960?profile=1470","http://amp.jamaicaobserver.com/news/maroons-focus-on-boosting-immune-system-amid-covid-19_191960?profile=1470","2020-04-15 11:00:00","Maroons focus on boosting immune system amid COVID - 19"
"https://www.dorzeczy.pl/kraj/136492/wirusolog-o-szczepionce-na-koronawirusa-dopiero-na-druga-lub-trzecia-epidemie.html","","2020-04-15 10:15:00","Prawda o szczepionce na koronawirusa . "
"https://dorzeczy.pl/kraj/136492/wirusolog-o-szczepionce-na-koronawirusa-dopiero-na-druga-lub-trzecia-epidemie.html","","2020-04-15 10:15:00","Prawda o szczepionce na koronawirusa . "
"https://www.dailypost.co.uk/news/north-wales-news/live-north-wales-news-wednesday-18086761","https://www.dailypost.co.uk/news/north-wales-news/live-north-wales-news-wednesday-18086761.amp","2020-04-15 10:30:00","LIVE : North Wales News Wednesday April 15 , 2020"
"https://www.cdispatch.com/lifestyles/article.asp?aid=80658","","2020-04-15 17:45:00","Tuna , my quarantine go - to"
"https://www.lifehacker.com.au/2020/04/recipes-to-batch-cook-and-freeze/","https://www.lifehacker.com.au/2020/04/recipes-to-batch-cook-and-freeze/amp","2020-04-15 07:45:00","5 Essential Recipes To Batch Cook And Freeze"
"https://life.ru/p/1318581","https://life.ru/p/1318581/amp","2020-04-15 10:45:00","Началось с боли в животе . Вылечившийся от CoViD - 19 врач из Нью - Йорка рассказал о борьбе с болезнью"
"https://dnews.dn.ua/news/746223","https://dnews.dn.ua/news-amp/746223","2020-04-15 06:15:00","Уже привыкли выживать и бороться : Как изменилась жизнь жителей Покровска на карантине ( Фото ) "
"https://www.theguardian.pe.ca/opinion/regional-perspectives/john-demont-nova-scotia-victory-gardens-are-making-a-pandemic-comeback-437632/","","2020-04-15 11:00:00","JOHN DeMONT : Nova Scotia victory gardens are making a pandemic comeback | Regional - Perspectives | Opinion"
"https://congressoemfoco.uol.com.br/opiniao/forum/antimalaricos-caipirinha-e-pandemias/","https://congressoemfoco.uol.com.br/opiniao/forum/antimalaricos-caipirinha-e-pandemias/amp/","2020-04-15 23:30:00","Antimaláricos , caipirinha e pandemias"
"https://www.msn.com/en-au/news/world/heres-how-indonesia-e2-80-94-where-ghosts-representing-trapped-souls-are-scaring-people-into-maintaining-lockdown-e2-80-94-went-from-no-cases-in-early-march-to-having-the-second-highest-death-rate-in-asia/ar-BB12DM9V","","2020-04-15 05:00:00","Here how Indonesia where  ghost representing trapped souls are scaring people into maintaining lockdown went from no cases in early March to having the second highest death rate in Asia"
