URL,MobileURL,Date,Title
"https://www.mensxp.com/special-features/features/74233-indian-youtuber-shows-how-to-make-a-coronavirus-covid-19-mask-using-handkerchief-rubber-bands.html","https://www.mensxp.com/amp/special-features/features/74233-indian-youtuber-shows-how-to-make-a-coronavirus-covid-19-mask-using-handkerchief-rubber-bands.html","2020-03-24 09:30:00","Indian YouTuber Shows How To Make A Coronavirus COVID - 19 Mask Using Handkerchief & Rubber Bands"
"https://www.firstpost.com/health/coronavirus-outbreak-apple-to-donate-n95-masks-to-healthcare-workers-treating-coronavirus-patients-8183851.html","https://www.firstpost.com/health/coronavirus-outbreak-apple-to-donate-n95-masks-to-healthcare-workers-treating-coronavirus-patients-8183851.html/amp","2020-03-24 09:15:00","Coronavirus Outbreak : Apple to donate N95 masks to healthcare workers treating coronavirus patients"
"https://www.healthline.com/health/coronavirus-mask","","2020-03-24 20:30:00","Coronavirus Masks : Types , Protection , How & When to Use"
"https://www.silive.com/news/j66j-2020/03/991bcb21f84372/life-with-coronavirus-face-masks-have-become-a-common-sight-.html","","2020-03-24 12:30:00","Life with coronavirus : Face masks have become a common sight"
"https://www.kp.ru/daily/27108/4183546/","https://amp.kp.ru/daily/27108/4183546/","2020-03-24 10:15:00","Одноклассники запустили виртуальную маску для празднования дня рождения онлайн"
"https://heavy.com/news/2020/03/how-to-make-diy-face-masks/","https://heavy.com/news/2020/03/how-to-make-diy-face-masks/amp/","2020-03-24 01:30:00","How to Make DIY Face Masks"
"https://www.palmbeachpost.com/news/20200324/coronavirus-florida-locals-roll-up-sleeves-to-create-diy-medical-supplies","https://www.palmbeachpost.com/news/20200324/coronavirus-florida-locals-roll-up-sleeves-to-create-diy-medical-supplies?template=ampart","2020-03-24 14:30:00","Coronavirus Florida : Locals roll up sleeves to create DIY medical supplies - News - The Palm Beach Post"
"https://www.oann.com/taiwans-coronavirus-cases-top-200-for-first-time/","","2020-03-24 08:45:00","Taiwan coronavirus cases top 200 for first time | One America News Network"
"https://www.cbc.ca/news/health/masks-coronavirus-1.5507186","https://www.cbc.ca/amp/1.5507186","2020-03-24 08:30:00","What you need to know about masks and protecting yourself against COVID - 19"
"https://swachhindia.ndtv.com/are-masks-effective-to-contain-the-spread-of-novel-coronavirus-42585/","https://swachhindia.ndtv.com/are-masks-effective-to-contain-the-spread-of-novel-coronavirus-42585/amp/","2020-03-24 06:45:00","Are Masks Effective To Contain The Spread Of Novel Coronavirus ? "
"https://news.yahoo.com/former-nicu-baby-now-5-173735686.html","https://news.yahoo.com/amphtml/former-nicu-baby-now-5-173735686.html","2020-03-24 18:00:00","Former NICU baby , now 5 , is making face mask covers for neonatal units"
"https://www.foxnews.com/media/coronavirus-questions-answered-can-grandparents-have-grandchildren-at-their-house-overnight","https://www.foxnews.com/media/coronavirus-questions-answered-can-grandparents-have-grandchildren-at-their-house-overnight.amp","2020-03-24 13:00:00","Coronavirus questions answered : Can grandparents have grandchildren at their house overnight ? "
"https://www.news-journalonline.com/news/20200324/coronavirus-florida-locals-roll-up-sleeves-to-create-diy-medical-supplies","https://www.news-journalonline.com/news/20200324/coronavirus-florida-locals-roll-up-sleeves-to-create-diy-medical-supplies?template=ampart","2020-03-24 17:15:00","Coronavirus Florida : Locals roll up sleeves to create DIY medical supplies - News - Daytona Beach News - Journal Online"
"https://gulfnews.com/photos/news/life-in-wuhan-after-the-coronavirus-scare-1.1585027803515","","2020-03-24 13:30:00","Life in Wuhan after the coronavirus scare"
"https://www.newsweek.com/72-year-old-italian-priest-who-gave-his-ventilator-younger-patient-dies-coronavirus-1493868","https://www.newsweek.com/72-year-old-italian-priest-who-gave-his-ventilator-younger-patient-dies-coronavirus-1493868?amp=1","2020-03-24 06:30:00","72 - Year - Old Italian Priest Who Gave His Ventilator to Younger Patient Dies of Coronavirus"
"http://www.leparisien.fr/societe/coronavirus-les-masques-faits-maison-sont-ils-vraiment-utiles-24-03-2020-8286675.php","http://www.leparisien.fr/amp/societe/coronavirus-les-masques-faits-maison-sont-ils-vraiment-utiles-24-03-2020-8286675.php","2020-03-24 10:30:00","Coronavirus : les masques faits maison sont - ils vraiment utiles ? "
"https://www.standard.co.uk/news/health/nhs-volunteer-army-coronavirus-all-you-need-to-know-a4396651.html","https://www.standard.co.uk/news/health/nhs-volunteer-army-coronavirus-all-you-need-to-know-a4396651.html?amp","2020-03-24 22:15:00","All you need to know about joining the NHS Volunteer Army"
"https://www.jacksonville.com/news/20200324/coronavirus-florida-locals-roll-up-sleeves-to-create-diy-medical-supplies","https://www.jacksonville.com/news/20200324/coronavirus-florida-locals-roll-up-sleeves-to-create-diy-medical-supplies?template=ampart","2020-03-24 15:00:00","Coronavirus Florida : Locals roll up sleeves to create DIY medical supplies - News - The Florida Times - Union"
"https://www.mirror.co.uk/news/world-news/coronavirus-incredible-hack-turning-scuba-21746459","https://www.mirror.co.uk/news/world-news/coronavirus-incredible-hack-turning-scuba-21746459.amp","2020-03-24 16:45:00","Coronavirus : Incredible hack turning scuba masks into ventilators saving lives - World News"
"https://www.20minutes.fr/sante/2747231-20200324-coronavirus-masque-plongee-decathlon-utilise-comme-protection-respirateur-enseigne-reste-prudente","https://m.20minutes.fr/amp/a/2747231","2020-03-24 16:45:00","Coronavirus  : Le masque de plongée de Decathlon utilisé comme protection ou respirateur , lenseigne reste prudente"
"https://www.cnet.com/how-to/homemade-face-masks-may-not-protect-you-from-coronavirus-heres-why/","https://www.cnet.com/google-amp/news/homemade-face-masks-may-not-protect-you-from-coronavirus-heres-why/","2020-03-24 16:30:00","Homemade face masks may not protect you from coronavirus . Here why"
"https://www.newsweek.com/cdc-coronavirus-advice-elderly-vulnerable-people-how-prepare-what-do-if-you-get-sick-1493900","https://www.newsweek.com/cdc-coronavirus-advice-elderly-vulnerable-people-how-prepare-what-do-if-you-get-sick-1493900?amp=1","2020-03-24 12:45:00","CDC Coronavirus Advice for Elderly and Vulnerable People : How to Prepare and What to Do If You Get Sick"
"https://www.antena3.com/noticias/sociedad/que-hace-un-virologo-cuando-sale-ahora-a-la-calle-para-protegerse-del-coronavirus_202003245e79deb4d41df90001bc057c.html","https://amp.antena3.com/noticias/sociedad/que-hace-un-virologo-cuando-sale-ahora-a-la-calle-para-protegerse-del-coronavirus_202003245e79deb4d41df90001bc057c.html","2020-03-24 13:45:00"," ¿ Qué hace un virólogo cuando sale ahora a la calle para protegerse del coronavirus ? "
"https://www.masslive.com/coronavirus/2020/03/coronavirus-umass-memorial-caregivers-now-required-to-wear-a-face-mask-at-all-times-during-covid-19-pandemic.html","https://www.masslive.com/coronavirus/2020/03/coronavirus-umass-memorial-caregivers-now-required-to-wear-a-face-mask-at-all-times-during-covid-19-pandemic.html?outputType=amp","2020-03-24 13:00:00","Coronavirus : UMass Memorial caregivers now required to wear a face mask at all times during COVID - 19 pandemic"
"https://www.standard.co.uk/news/politics/emergency-coronavirus-legislation-clears-commons-lockdown-measures-a4395476.html","https://www.standard.co.uk/news/politics/emergency-coronavirus-legislation-clears-commons-lockdown-measures-a4395476.html?amp","2020-03-24 00:15:00","Emergency coronavirus legislation clears Commons as strict lockdown measures introduced across united kingdom "
"https://www.newsweek.com/new-yorkers-urged-not-travel-suggested-self-quarantine-if-they-have-left-state-wh-task-force-1494073","https://www.newsweek.com/new-yorkers-urged-not-travel-suggested-self-quarantine-if-they-have-left-state-wh-task-force-1494073?amp=1","2020-03-25 00:00:00","New Yorkers Urged Not to Travel , Suggested to Self - Quarantine if They Have Left the State , WH Task Force Says"
"https://www.cnet.com/how-to/why-sewing-face-masks-may-not-protect-you-from-coronavirus/","https://www.cnet.com/google-amp/news/why-sewing-face-masks-may-not-protect-you-from-coronavirus/","2020-03-24 12:15:00","Why sewing face masks may not protect you from coronavirus"
"https://www.newsweek.com/coronavirus-study-look-using-gout-drug-prevent-lung-complications-deaths-covid-19-1493966","https://www.newsweek.com/coronavirus-study-look-using-gout-drug-prevent-lung-complications-deaths-covid-19-1493966?amp=1","2020-03-24 16:45:00","Coronavirus Study to Look at Using Gout Drug to Prevent Lung Complications and Deaths from COVID - 19"
"https://www.firstpost.com/health/working-in-times-of-coronavirus-outbreak-here-are-five-office-hygiene-tips-you-should-follow-to-stay-safe-8184641.html","https://www.firstpost.com/health/working-in-times-of-coronavirus-outbreak-here-are-five-office-hygiene-tips-you-should-follow-to-stay-safe-8184641.html/amp","2020-03-24 11:30:00","Working in times of coronavirus outbreak ? Here are five office hygiene tips you should follow to stay safe"
"https://www.newsweek.com/health-officials-warn-against-self-medicating-chloroquine-coronavirus-after-man-dies-taking-fish-1493874","https://www.newsweek.com/health-officials-warn-against-self-medicating-chloroquine-coronavirus-after-man-dies-taking-fish-1493874?amp=1","2020-03-24 09:45:00","Health Officials Warn Against Self - Medicating With Chloroquine for Coronavirus After Man Dies From Taking Fish Tank Cleaner"
"https://vz.ru/news/2020/3/24/1030650.html","https://vz.ru/amp/news/2020/3/24/1030650.html","2020-03-24 19:30:00","ВЗГЛЯД / Захарова предложила « немного доработать » идею генсека ООН об отмене санкций"
"https://www.theledger.com/news/20200324/coronavirus-florida-locals-roll-up-sleeves-to-create-diy-medical-supplies","https://www.theledger.com/news/20200324/coronavirus-florida-locals-roll-up-sleeves-to-create-diy-medical-supplies?template=ampart","2020-03-24 14:30:00","Coronavirus Florida : Locals roll up sleeves to create DIY medical supplies - News - The Ledger"
"https://www.desmoinesregister.com/story/news/health/2020/03/23/university-iowa-hospital-issues-guidelines-supplies-workers-respond-coronavirus-face-masks-patients/2900552001/","https://amp.desmoinesregister.com/amp/2900552001","2020-03-24 00:15:00","Iowa hospital tells workers to reuse masks with non - COVID - 19 patients"
"https://www.newsweek.com/covid-19-coronavirus-medications-diabetes-hypertension-1493916","https://www.newsweek.com/covid-19-coronavirus-medications-diabetes-hypertension-1493916?amp=1","2020-03-24 12:45:00","Controversial Study Links COVID - 19 Severity to ACEIs and ARBs , Despite Warning of No  Sound Scientific Basis or Evidence  "
"https://www.pedestrian.tv/style/slovak-president-colour-coordinates-masks-outfit/","","2020-03-24 04:15:00","The Slovak President Colour Coordinates Her Outfits With Her Masks"
"https://www.washingtonpost.com/business/mask-or-no-mask-this-is-what-the-virus-experts-say/2020/03/24/7a88475a-6ded-11ea-a156-0048b62cdb51_story.html","","2020-03-24 19:15:00","Mask or No Mask ? This Is What the Virus Experts Say - The Washington Post"
"https://www.newsweek.com/what-convalescent-plasma-new-york-health-officials-start-trial-using-blood-people-recovered-1493964","https://www.newsweek.com/what-convalescent-plasma-new-york-health-officials-start-trial-using-blood-people-recovered-1493964?amp=1","2020-03-24 15:30:00","What Is Convalescent Plasma ? New York Health Officials to Start Trial Using Blood of People Recovered From Coronavirus"
"https://www.newsweek.com/elon-musk-tesla-ventilators-coronavirus-covid19-california-governor-gavin-newsom-1493914","https://www.newsweek.com/elon-musk-tesla-ventilators-coronavirus-covid19-california-governor-gavin-newsom-1493914?amp=1","2020-03-24 11:45:00","Elon Musk Delivers 1 , 255 Ventilators to California After Buying  Oversupply  From China"
"https://www.newsweek.com/pennsylvania-doc-refusing-comply-death-row-inmate-coronavirus-1493925","https://www.newsweek.com/pennsylvania-doc-refusing-comply-death-row-inmate-coronavirus-1493925?amp=1","2020-03-24 15:15:00","Pennsylvania Dept . Of Corrections Refuses Coronavirus Test for Death Row Inmate Despite Court Order , Attorneys Say"
"https://www.newsweek.com/almost-7-percent-new-york-city-police-officers-call-out-sick-single-day-city-battles-coronavirus-1494068","https://www.newsweek.com/almost-7-percent-new-york-city-police-officers-call-out-sick-single-day-city-battles-coronavirus-1494068?amp=1","2020-03-24 23:00:00","Almost 7 Percent of New York City Police Officers Call Out Sick in a Single Day As City Battles Coronavirus"
"https://www.newsweek.com/us-coronavirus-cases-double-three-days-after-very-large-acceleration-infections-who-says-1493990","https://www.newsweek.com/us-coronavirus-cases-double-three-days-after-very-large-acceleration-infections-who-says-1493990?amp=1","2020-03-24 19:30:00","U . S . Coronavirus Cases Double in Just Three Days to 50 , 000 ,  Very Large Acceleration  of Infections WHO Warns"
"https://www.standard.co.uk/news/health/boris-johnson-clarity-uk-lockdown-coronavirus-measures-police-enforced-a4395491.html","https://www.standard.co.uk/news/health/boris-johnson-clarity-uk-lockdown-coronavirus-measures-police-enforced-a4395491.html?amp","2020-03-24 05:15:00","Boris Johnson faces calls for clarity after ordering three - week lockdown and giving police powers to enforce measures"
"https://www.newsweek.com/coronavirus-denver-liquor-marijuana-lines-1493906","https://www.newsweek.com/coronavirus-denver-liquor-marijuana-lines-1493906?amp=1","2020-03-24 12:45:00","Denver Updates Coronavirus  Stay at Home  Order to Allow Liquor and Marijuana Stores to Stay Open After Long Queues"
"https://tribuneonlineng.com/reps-to-pass-emergency-economic-stimulus-bill/","https://tribuneonlineng.com/reps-to-pass-emergency-economic-stimulus-bill/amp/","2020-03-24 11:30:00","Reps to pass emergency economic stimulus bill » Tribune Online"
"https://www.businessinsider.com/people-donating-face-masks-in-droves-to-protect-hospital-workers-2020-3","https://www.businessinsider.com/people-donating-face-masks-in-droves-to-protect-hospital-workers-2020-3?amp","2020-03-24 21:15:00","People are donating masks to protect hospital workers from coronavirus"
"https://www.fool.com/investing/2020/03/24/honeywell-expands-n95-face-mask-production-seeks-5.aspx","https://www.fool.com/amp/investing/2020/03/24/honeywell-expands-n95-face-mask-production-seeks-5.aspx","2020-03-24 19:45:00","Honeywell Expands N95 Face Mask Production , Seeks $5 Billion Loan"
"https://www.fool.com/investing/2020/03/24/honeywell-expands-n95-face-mask-production-seeks-5.aspx?source=iedfolrf0000001","https://www.fool.com/amp/investing/2020/03/24/honeywell-expands-n95-face-mask-production-seeks-5.aspx","2020-03-24 19:45:00","Honeywell Expands N95 Face Mask Production , Seeks $5 Billion Loan"
"https://news.yahoo.com/front-lines-coronavirus-outbreak-medical-workers-fear-rationing-080041808--abc-news-topstories.html","https://news.yahoo.com/amphtml/front-lines-coronavirus-outbreak-medical-workers-fear-rationing-080041808--abc-news-topstories.html","2020-03-24 09:15:00","On the front lines of coronavirus outbreak , medical workers fear rationing of masks will heighten risks"
"https://www.newsweek.com/dire-consequencesf-stopping-social-distancing-spread-coronavirus-explained-1493893","https://www.newsweek.com/dire-consequencesf-stopping-social-distancing-spread-coronavirus-explained-1493893?amp=1","2020-03-24 15:30:00","The Dire Consequences of Stopping Social Distancing During Spread of Coronavirus Explained"
"https://www.standard.co.uk/news/uk/social-care-coronavirus-jobs-10000-new-staff-cera-care-a4396331.html","https://www.standard.co.uk/news/uk/social-care-coronavirus-jobs-10000-new-staff-cera-care-a4396331.html?amp","2020-03-24 22:15:00","Care home provider Cera Care to hire 10 , 000 new staff as coronavirus crisis sees  unprecedented  demand"
"https://vanguardia.com.mx/articulo/estos-son-7-mitos-del-covid-19-que-no-debes-creer","https://vanguardia.com.mx/articulo/estos-son-7-mitos-del-covid-19-que-no-debes-creer/amp/","2020-03-24 22:30:00","Estos son 7 mitos del COVID - 19 que no debes creer"
"http://www.koreatimes.co.kr/www/nation/2020/03/119_286685.html","http://m.koreatimes.co.kr/pages/article.amp.asp?newsIdx=286685","2020-03-24 00:00:00","Korea calls on citizens to cancel or postpone overseas trips over virus"
"https://www.independent.co.uk/news/world/europe/coronavirus-ventilators-snorkelling-masks-brescia-italy-engineers-a9420916.html","https://www.independent.co.uk/news/world/europe/coronavirus-ventilators-snorkelling-masks-brescia-italy-engineers-a9420916.html?amp","2020-03-24 14:15:00","Italian engineers use snorkelling masks to make equipment for ventilators"
"https://www.newser.com/story/288595/amid-virus-mask-shortage-americans-step-up.html","https://amp.newser.com/story/288595/amid-virus-mask-shortage-americans-step-up.html","2020-03-24 14:15:00","Volunteers Across America Making Face Masks for Health Care Workers Amid Coronavirus Pandemic"
"https://www.elimparcial.com/sonora/hermosillo/Fariseos-afirman-que-su-mascara-los-protege-del-coronavirus-20200324-0010.html","https://www.elimparcial.com/amp/sonora/hermosillo/Fariseos-afirman-que-su-mascara-los-protege-del-coronavirus-20200324-0010.html","2020-03-24 15:30:00","Fariseos afirman que su máscara los protege del coronavirus"
"https://www.9news.com.au/national/coronavirus-some-perth-doctors-forced-to-go-without-masks-in-operating-rooms-surgeon-claims/e418126a-b574-47d2-971e-24155922175e","https://amp.9news.com.au/article/e418126a-b574-47d2-971e-24155922175e","2020-03-24 05:30:00","Coronavirus : Doctors without masks in some Perth operations , surgeon claims"
"https://www.newsweek.com/kindergarten-teacher-care-packages-students-1493909","https://www.newsweek.com/kindergarten-teacher-care-packages-students-1493909?amp=1","2020-03-24 12:15:00","Colorado Kindergarten Teacher Drops Off Care Packages for All Her Students After Her School Was Closed Due to the Coronavirus Pandemic"
"https://www.cbsnews.com/news/pregnant-women-face-new-concerns-amid-coronavirus-pandemic/","https://www.cbsnews.com/amp/news/pregnant-women-face-new-concerns-amid-coronavirus-pandemic/","2020-03-24 23:30:00","Pregnant women face new concerns amid coronavirus pandemic"
"https://www.nation.co.ke/health/Covid-19-myths/3476990-5501358-6eqhvfz/","https://www.nation.co.ke/health/Covid-19-myths/3476990-5501358-view-asAMP-c3jfqd/index.html","2020-03-24 06:00:00","Can garlic prevent Covid - 19 ? The facts and myths"
"http://articles.economictimes.indiatimes.com/news/politics-and-nation/pib-fact-checkers-dispel-myths-verify-2000-whatsapps/articleshow/74785165.cms","http://m.economictimes.com/news/politics-and-nation/pib-fact-checkers-dispel-myths-verify-2000-whatsapps/amp_articleshow/74785165.cms","2020-03-24 05:00:00","PIB fact checkers dispel myths , verify 2 , 000 WhatsApps messages"
"https://economictimes.indiatimes.com/news/politics-and-nation/pib-fact-checkers-dispel-myths-verify-2000-whatsapps/articleshow/74785165.cms","https://m.economictimes.com/news/politics-and-nation/pib-fact-checkers-dispel-myths-verify-2000-whatsapps/amp_articleshow/74785165.cms","2020-03-24 04:15:00","PIB fact checkers dispel myths , verify 2 , 000 WhatsApps messages"
"https://www.standard.co.uk/news/uk/teachers-support-local-communities-school-closure-coronavirus-a4395446.html","https://www.standard.co.uk/news/uk/teachers-support-local-communities-school-closure-coronavirus-a4395446.html?amp","2020-03-24 14:00:00","Teachers reach out to local communities to offer help as united kingdom schools close due to coronavirus"
"https://www.today.com/parents/former-nicu-baby-makes-mask-covers-nicu-nurses-coronavirus-t176679","https://www.today.com/today/amp/tdna176679","2020-03-24 18:00:00","Former NICU baby makes mask covers NICU nurses coronavirus"
"https://www.untvweb.com/news/philippines-covid-19-cases-now-at-462-with-33-deaths/","","2020-03-24 12:45:00","Philippine COVID - 19 cases now at 462 , with 33 deaths - UNTV News"
"https://tribune.com.pk/story/2182985/3-turkey-sets-shop-bus-restrictions-coronavirus-death-toll-rises-37/","https://tribune.com.pk/story/2182985/3-turkey-sets-shop-bus-restrictions-coronavirus-death-toll-rises-37/?amp=1","2020-03-24 08:00:00","Turkey sets shop , bus restrictions as coronavirus death toll rises to 37"
"https://hollywoodlife.com/2020/03/24/nina-dobrev-mask-photo-home-board-game-monopoly-driveway-pic/","https://hollywoodlife.com/2020/03/24/nina-dobrev-mask-photo-home-board-game-monopoly-driveway-pic/amp/","2020-03-24 18:00:00","Nina Dobrev Wears Mask In Photo Arriving Home With Board Game – Hollywood Life"
"https://www.iol.co.za/news/world/uk-calls-for-250-000-volunteers-as-coronavirus-deaths-surge-to-422-45501858","","2020-03-24 23:45:00","UK calls for 250 000 volunteers as coronavirus deaths surge to 422"
"https://www.cincinnati.com/story/news/nation/2020/03/23/homemade-coronavirus-masks-do-they-actually-block-spread/2899622001/","https://amp.cincinnati.com/amp/2899622001","2020-03-24 11:15:00","Homemade coronavirus masks : Do they actually block spread"
"https://www.timeslive.co.za/news/south-africa/2020-03-24-seven-coronavirus-myths-debunked/","","2020-03-24 06:00:00","Seven coronavirus myths debunked"
"https://www.crn.com/news/components-peripherals/hp-and-3-d-printer-partners-working-to-print-needed-medical-parts","","2020-03-24 19:15:00","HP And 3 - D Printer Partners Working To Print Needed Medical Parts"
"https://www.rt.com/news/483933-coronavirus-pandemic-fashion-parade/","https://www.rt.com/news/483933-coronavirus-pandemic-fashion-parade/amp/","2020-03-24 11:15:00","The good , the bad and the ugly : How politicians and celebrities are turning a pandemic into a fashion parade"
"https://www.femmeactuelle.fr:443/mode/news-mode/coronavirus-une-personnalite-politique-a-accorde-son-masque-a-sa-tenue-2092636","https://www.femmeactuelle.fr/mode/news-mode/coronavirus-une-personnalite-politique-a-accorde-son-masque-a-sa-tenue-2092636?amp","2020-03-24 12:15:00","Coronavirus : une personnalité politique a accordé son masque à sa tenue"
"https://www.newsweek.com/us-coronavirus-update-death-toll-soars-past-500-trump-admin-invoke-defense-production-act-1493949","https://www.newsweek.com/us-coronavirus-update-death-toll-soars-past-500-trump-admin-invoke-defense-production-act-1493949?amp=1","2020-03-24 16:00:00","U . S . Coronavirus Update as Death Toll Soars Past 500 , Trump Admin to Invoke Defense Production Act to Fight Pandemic"
"https://www.inquisitr.com/5960936/pence-coronavirus-plan-spread-infection-like-crazy/","https://www.inquisitr.com/5960936/pence-coronavirus-plan-spread-infection-like-crazy/amp/","2020-03-24 19:45:00","Mike Pence Coronavirus Plan Could Spread Infection  Like Crazy , Health Expert Says"
"https://www.indiatimes.com/technology/news/to-fight-covid-19-this-firm-converts-snorkeling-mask-into-ventilator-with-3d-printing-509147.html","https://www.indiatimes.com/amp/technology/news/to-fight-covid-19-this-firm-converts-snorkeling-mask-into-ventilator-with-3d-printing-509147.html","2020-03-24 13:00:00","To Fight COVID - 19 , This Firm Converts Snorkeling Mask Into Ventilator With 3D Printing"
"https://www.northjersey.com/story/news/coronavirus/2020/03/23/nj-coronavirus-volunteers-sew-masks-health-care-workers-amid-shortage/2902181001/","https://amp.northjersey.com/amp/2902181001","2020-03-24 02:00:00","Coronavirus : Volunteers sew masks for health care workers amid shortage"
"http://www.msn.com/en-nz/news/world/priest-dies-after-giving-his-respirator-to-younger-covid-19-patient/ar-BB11CT6Q","","2020-03-24 12:30:00","Priest dies after giving his respirator to younger COVID - 19 patient"
"https://www.npr.org/sections/coronavirus-live-updates/2020/03/24/820788936/nurses-are-facing-coronavirus-without-enough-protective-gear","","2020-03-24 21:00:00","Nurses Are Facing Coronavirus Without Enough Protective Gear"
"https://www.globalsecurity.org/security/library/news/2020/03/sec-200323-cna02.htm","","2020-03-24 02:15:00","Taiwan gearing up to produce 13 million masks per day"
"https://www.newsweek.com/people-are-sewing-their-own-face-masks-protect-against-coronavirus-cdc-says-its-not-safe-1494007","https://www.newsweek.com/people-are-sewing-their-own-face-masks-protect-against-coronavirus-cdc-says-its-not-safe-1494007?amp=1","2020-03-24 17:45:00","People Are Sewing Their Own Face Masks to Protect Against Coronavirus , but CDC Says It Not Safe"
"https://www.newsweek.com/canadian-couple-death-threats-buying-meat-1493880","https://www.newsweek.com/canadian-couple-death-threats-buying-meat-1493880?amp=1","2020-03-24 10:00:00","Canadian Couple Say Theyve Received Death Threats After Allegedly Panic Buying Grocery Store Entire Meat Section"
"https://news.northwestern.edu/stories/2020/03/self-sanitizing-face-mask-project-receives-nsf-rapid-grant/","","2020-03-24 19:45:00","Self - sanitizing face mask project receives NSF RAPID grant"
"https://www.huffpost.com/entry/how-to-make-face-mask-coronavirus_l_5e78cb2fc5b6f5b7c5483e17","https://www.huffpost.com/entry/how-to-make-face-mask-coronavirus_l_5e78cb2fc5b6f5b7c5483e17/amp","2020-03-24 13:15:00","How To Make A Face Mask That Is Effective Against Coronavirus"
