URL,MobileURL,Date,Title
"https://www.ndtv.com/health/coronavirus-outbreak-top-10-guidelines-for-travellers-2170485","https://www.ndtv.com/health/coronavirus-outbreak-top-10-guidelines-for-travellers-2170485?amp=1 -rum=off","2020-01-28 09:15:00","Coronavirus Outbreak : Top 10 Travel Guidelines"
"https://thepointsguy.com/news/face-mask-virus-safe-plane-travel/","https://thepointsguy.com/news/face-mask-virus-safe-plane-travel/amp/","2020-01-28 00:30:00","Will a face mask protect you from viruses while traveling ? "
"https://g1.globo.com/ciencia-e-saude/noticia/2020/01/28/brasil-tem-2-novos-casos-suspeitos-de-coronavirus-em-porto-alegre-e-curitiba-ministerio.ghtml","https://g1.globo.com/google/amp/ciencia-e-saude/noticia/2020/01/28/brasil-tem-2-novos-casos-suspeitos-de-coronavirus-em-porto-alegre-e-curitiba-ministerio.ghtml","2020-01-28 22:15:00","Brasil tem 2 novos casos suspeitos de coronavírus em Porto Alegre e em Curitiba , diz Ministério da Saúde"
"https://www.cnn.com/2020/01/28/health/coronavirus-us-masks-prevention-trnd/","https://amp.cnn.com/cnn/2020/01/28/health/coronavirus-us-masks-prevention-trnd/index.html","2020-01-28 17:00:00","There been a run of surgical masks in the US because of the coronavirus scare . You dont need them , physicians say"
"https://www.ccn.com/japanese-stock-parabolic-coronavirus/","https://www.ccn.com/japanese-stock-parabolic-coronavirus/","2020-01-28 19:00:00","This Japanese Stock Just Went Parabolic Because of the Coronavirus"
"https://www.ctvnews.ca/health/can-face-masks-protect-you-from-the-coronavirus-experts-weigh-in-1.4786014","https://beta.ctvnews.ca/national/health/2020/1/27/1_4786014.html","2020-01-28 02:00:00","Should you wear a face mask in public to protect you from the coronavirus ? "
"https://g1.globo.com/mundo/noticia/2020/01/28/brasileiras-relatam-preocupacao-dos-moradores-de-hong-kong-com-a-chegada-do-coronavirus.ghtml","https://g1.globo.com/google/amp/mundo/noticia/2020/01/28/brasileiras-relatam-preocupacao-dos-moradores-de-hong-kong-com-a-chegada-do-coronavirus.ghtml","2020-01-28 19:15:00","Brasileiras relatam preocupao dos moradores de Hong Kong com a chegada do coronavírus"
"https://ktla.com/2020/01/28/coronavirus-scare-has-surgical-masks-selling-out-in-u-s-but-physicians-say-theres-no-need/","https://ktla.com/2020/01/28/coronavirus-scare-has-surgical-masks-selling-out-in-u-s-but-physicians-say-theres-no-need/amp/","2020-01-28 23:15:00","Coronavirus Scare Has Surgical Masks Selling Out in U . S . But Physicians Say There No Need"
"https://fox5sandiego.com/2020/01/28/experts-say-wearing-masks-likely-wont-help-avoid-coronavirus-in-us/","https://fox5sandiego.com/2020/01/28/experts-say-wearing-masks-likely-wont-help-avoid-coronavirus-in-us/amp/","2020-01-28 20:45:00","Experts say wearing masks likely wont help avoid coronavirus in US"
"https://fox6now.com/2020/01/28/theres-been-a-run-of-surgical-masks-in-the-us-due-to-coronavirus-scare-you-dont-need-them-physicians-say/","https://fox6now.com/2020/01/28/theres-been-a-run-of-surgical-masks-in-the-us-due-to-coronavirus-scare-you-dont-need-them-physicians-say/amp/","2020-01-28 18:30:00","There been a run of surgical masks in the US due to coronavirus scare , you dont need them , physicians say"
"https://kvia.com/health/2020/01/28/theres-been-a-run-of-surgical-masks-in-the-us-because-of-the-coronavirus-scare-you-dont-need-them-physicians-say/","https://kvia.com/amp/theres-been-a-run-of-surgical-masks-in-the-us-because-of-the-coronavirus-scare-you-dont-need-them-physicians-say","2020-01-28 19:15:00","There been a run of surgical masks in the US because of the coronavirus scare . You dont need them , physicians say"
"https://glavred.info/ukraine/10144205-podderzhi-kitayskih-druzey-ukraincy-zarabatyvayut-v-seti-na-koronaviruse.html","https://glavred.info/ukraine/amp-10144205-podderzhi-kitayskih-druzey-ukraincy-zarabatyvayut-v-seti-na-koronaviruse.html","2020-01-28 09:45:00","Коронавирус на OLX - украинцы зарабатывают на 2019 - nCoV"
"https://www.cnews.fr/france/2020-01-28/coronavirus-est-il-utile-de-porter-un-masque-921332","https://www.cnews.fr/france/2020-01-28/coronavirus-est-il-utile-de-porter-un-masque-921332?amp","2020-01-28 09:30:00","Coronavirus : est - il utile de porter un masque ? "
"https://news.abs-cbn.com/overseas/01/28/20/hong-kong-to-suspend-high-speed-rail-service-in-bid-to-halt-spread-of-coronavirus","","2020-01-28 12:00:00","Hong Kong to suspend high - speed rail service in bid to halt spread of coronavirus"
"https://www.gizchina.com/2020/01/28/xiaomi-surgical-mask-crashes-xiaomi-youpin-website-due-to-huge-traffic/","https://www.gizchina.com/2020/01/28/xiaomi-surgical-mask-crashes-xiaomi-youpin-website-due-to-huge-traffic/amp/","2020-01-28 22:00:00","Xiaomi surgical mask crashes Xiaomi Youpin website due to huge traffic"
"https://www.dw.com/ru/%D0%BD%D0%BE%D0%B2%D1%8B%D0%B9-%D0%BA%D0%BE%D1%80%D0%BE%D0%BD%D0%B0%D0%B2%D0%B8%D1%80%D1%83%D1%81-%D0%B8%D0%B7-%D0%BA%D0%B8%D1%82%D0%B0%D1%8F/g-52171800","https://amp.dw.com/ru/%D0%BD%D0%BE%D0%B2%D1%8B%D0%B9-%D0%BA%D0%BE%D1%80%D0%BE%D0%BD%D0%B0%D0%B2%D0%B8%D1%80%D1%83%D1%81-%D0%B8%D0%B7-%D0%BA%D0%B8%D1%82%D0%B0%D1%8F/g-52171800","2020-01-28 13:00:00","Новый коронавирус из Китая | Мультимедийные публикации Deutsche Welle на русском языке | DW"
"https://www.gwinnettdailypost.com/features/health/there-s-been-a-run-of-surgical-masks-in-the/article_84792135-90fa-50e7-990d-b2e7300d3e58.html","","2020-01-28 21:45:00","There been a run of surgical masks in the US because of the coronavirus scare . You dont need them , physicians say"
"https://uk.reuters.com/article/uk-china-health-hongkong/hong-kong-to-suspend-high-speed-rail-service-in-bid-to-halt-spread-of-coronavirus-idUKKBN1ZR0VE","https://uk.mobile.reuters.com/article/amp/idUKKBN1ZR0VE","2020-01-28 10:00:00","Hong Kong to suspend high - speed rail service in bid to halt spread of coronavirus"
"https://www.mk.ru/science/2020/01/28/vlasti-kitaya-zayavili-chto-koronavirus-peredaetsya-cherez-ruki-i-glaza.html","https://www.mk.ru/amp/science/2020/01/28/vlasti-kitaya-zayavili-chto-koronavirus-peredaetsya-cherez-ruki-i-glaza.html","2020-01-28 09:30:00","Власти Китая заявили , что коронавирус передается через руки и глаза"
"https://www.timesnownews.com/health/article/can-wearing-masks-protect-you-from-catching-wuhan-coronavirus-best-mask-to-stop-the-spread-of-virus/545867","https://www.timesnownews.com/amp/health/article/can-wearing-masks-protect-you-from-catching-wuhan-coronavirus-best-mask-to-stop-the-spread-of-virus/545867","2020-01-28 06:00:00","Can wearing masks protect you from catching Wuhan coronavirus ? Best mask to stop the spread of virus"
"https://torontosun.com/news/local-news/warmington-thousands-unchecked-for-coronavirus-at-pearson","https://torontosun.com/news/local-news/warmington-thousands-unchecked-for-coronavirus-at-pearson/amp","2020-01-28 02:45:00","WARMINGTON : No medical screening for arrivals from three China flights"
"https://www.travelandleisure.com/travel-tips/travel-warnings/coronovirus-symptoms-prevention-cdc-health-expert","https://www.travelandleisure.com/travel-tips/travel-warnings/coronovirus-symptoms-prevention-cdc-health-expert?amp=true","2020-01-28 16:30:00","What to Know About the Coronavirus , According to a Doctor and Public Health Expert | Travel + Leisure"
"https://nv.ua/world/countries/koronavirus-v-kitae-fotoreportazh-glavnye-novosti-50066866.html","https://nv.ua/amp/koronavirus-v-kitae-fotoreportazh-glavnye-novosti-50066866.html","2020-01-28 18:30:00","Коронавирус в Китае фоторепортаж главные новости / НВ"
"https://www.pravda.ru/news/world/1469920-virus/","https://www.pravda.ru/amp/news/world/1469920-virus/","2020-01-28 10:00:00","Заражение коронавирусом может произойти на расстоянии двух метров"
"https://edmontonsun.com/news/local-news/warmington-thousands-unchecked-for-coronavirus-at-pearson/wcm/28c9d28b-9074-45f3-8544-f57997e78d61","https://edmontonsun.com/news/local-news/warmington-thousands-unchecked-for-coronavirus-at-pearson/wcm/28c9d28b-9074-45f3-8544-f57997e78d61/amp","2020-01-28 18:00:00","WARMINGTON : No medical screening for arrivals from three China flights"
"https://edmontonsun.com/news/local-news/warmington-thousands-unchecked-for-coronavirus-at-pearson/wcm/82d3c2a9-ff80-40ad-aafb-0c6ebe5b4fa8","https://edmontonsun.com/news/local-news/warmington-thousands-unchecked-for-coronavirus-at-pearson/wcm/82d3c2a9-ff80-40ad-aafb-0c6ebe5b4fa8/amp","2020-01-28 06:45:00","WARMINGTON : No medical screening for arrivals from three China flights"
"https://edmontonsun.com/news/local-news/warmington-thousands-unchecked-for-coronavirus-at-pearson/wcm/7407784b-bd07-4d25-9781-c7874ba4c315","https://edmontonsun.com/news/local-news/warmington-thousands-unchecked-for-coronavirus-at-pearson/wcm/7407784b-bd07-4d25-9781-c7874ba4c315/amp","2020-01-28 03:30:00","WARMINGTON : No medical screening for arrivals from three China flights"
"https://www.winnipegfreepress.com/local/medical-mask-sales-skyrocket-due-to-coronavirus-concerns-567338222.html","","2020-01-28 01:30:00","Medical mask sales skyrocket due to coronavirus concerns"
"https://www.elcomercio.es/sociedad/salud/policia-reparte-marcarillas-20200128133646-ntrc.html","https://www.elcomercio.es/sociedad/salud/policia-reparte-marcarillas-20200128133646-ntrc_amp.html","2020-01-28 13:15:00","La Policía Nacional reparte marcarillas a los agentes en los aeropuertos ante el coronavirus"
"https://theprovince.com/news/local-news/warmington-thousands-unchecked-for-coronavirus-at-pearson/wcm/8008295d-2104-44d6-80bf-3a0f2aef0736","https://theprovince.com/news/local-news/warmington-thousands-unchecked-for-coronavirus-at-pearson/wcm/8008295d-2104-44d6-80bf-3a0f2aef0736/amp","2020-01-28 05:45:00","Joe Warmington : No medical screening at Toronto airport for arrivals from three China flights"
"https://montrealgazette.com/news/local-news/coronavirus-fears-should-you-be-wearing-a-surgical-mask","https://montrealgazette.com/news/local-news/coronavirus-fears-should-you-be-wearing-a-surgical-mask/amp","2020-01-28 11:45:00","Coronavirus fears : Should you be wearing a surgical mask ? "
"https://www.elnortedecastilla.es/sociedad/salud/policia-reparte-marcarillas-20200128133646-ntrc.html","https://www.elnortedecastilla.es/sociedad/salud/policia-reparte-marcarillas-20200128133646-ntrc_amp.html","2020-01-28 13:15:00","La Policía Nacional reparte marcarillas a los agentes en los aeropuertos ante el coronavirus"
"https://g1.globo.com/mg/minas-gerais/noticia/2020/01/28/antes-de-ser-internada-paciente-suspeita-de-ter-o-coronavirus-nao-saiu-de-casa-em-bh-diz-prefeitura.ghtml","https://g1.globo.com/google/amp/mg/minas-gerais/noticia/2020/01/28/antes-de-ser-internada-paciente-suspeita-de-ter-o-coronavirus-nao-saiu-de-casa-em-bh-diz-prefeitura.ghtml","2020-01-28 21:15:00","Antes de ser internada , paciente suspeita de ter o coronavírus não saiu de casa em BH , diz prefeitura"
"http://www.leparisien.fr/societe/sante/coronavirus-c-est-de-la-folie-tout-le-monde-veut-un-masque-28-01-2020-8246013.php","","2020-01-28 05:45:00","Coronavirus : « Cest de la folie , tout le monde veut un masque » "
"https://localnews8.com/health/2020/01/28/theres-been-a-run-of-surgical-masks-in-the-us-because-of-the-coronavirus-scare-you-dont-need-them-physicians-say/","https://localnews8.com/amp/theres-been-a-run-of-surgical-masks-in-the-us-because-of-the-coronavirus-scare-you-dont-need-them-physicians-say","2020-01-28 17:45:00","There been a run of surgical masks in the US because of the coronavirus scare . You dont need them , physicians say"
"https://regnum.ru/news/accidents/2841659.html","","2020-01-28 08:15:00","Власти КНР подтвердили : коронавирус передаётся контактным путём"
"https://tass.ru/obschestvo/7622577","https://tass.ru/obschestvo/7622577/amp","2020-01-28 09:45:00","Отели и объекты туризма в Москве взяты под особый контроль из - за коронавируса в Китае"
"https://www.leonoticias.com/sociedad/salud/policia-reparte-marcarillas-20200128133646-ntrc.html","https://www.leonoticias.com/sociedad/salud/policia-reparte-marcarillas-20200128133646-ntrc_amp.html","2020-01-28 13:15:00","La Policía Nacional reparte marcarillas a los agentes en los aeropuertos ante el coronavirus"
"https://www.bangkokpost.com/world/1845599/hong-kong-suspends-some-rail-ferry-links","","2020-01-28 15:00:00","Hong Kong suspends some rail , ferry links"
"https://www.terra.com.br/noticias/mundo/japao-diz-que-homem-que-nao-esteve-em-wuhan-contraiu-coronavirus,fd8d6e65b77f9b3b2b979f9d73671e9cj5axwj4g.html","https://www.terra.com.br/amp/noticias/mundo/japao-diz-que-homem-que-nao-esteve-em-wuhan-contraiu-coronavirus,fd8d6e65b77f9b3b2b979f9d73671e9cj5axwj4g.html","2020-01-28 11:45:00","Japão diz que homem que não esteve em Wuhan contraiu coronavírus"
"https://ura.news/news/1052416491","{{ (metaService && metaService.ampUrl()) ? metaService.ampUrl() : https://amp.ura.news/news/1052416491 }}","2020-01-28 14:00:00","Китайцы с « Таганского ряда » скупают тысячи масок в аптеках"
"https://www.newshub.co.nz/home/new-zealand/2020/01/do-masks-actually-protect-against-coronavirus.html","https://www.newshub.co.nz/home/new-zealand/2020/01/do-masks-actually-protect-against-coronavirus.amp.html","2020-01-28 17:30:00","Do masks actually protect against coronavirus ? "
"https://www.oann.com/south-korea-all-out-to-contain-virus-outbreak-vows-to-stabilize-market/","","2020-01-28 05:30:00","South Korea  all out  to contain virus outbreak , vows to stabilize market"
"https://www.unian.ua/health/worldnews/10849838-u-ssha-eksperti-rozpovili-chi-zahishchayut-maski-vid-koronavirusu.html","https://www.unian.ua/health/worldnews/amp-10849838-u-ssha-eksperti-rozpovili-chi-zahishchayut-maski-vid-koronavirusu.html","2020-01-28 18:45:00","У США експерти розповіли , чи захищають маски від коронавірусу"
"https://www.financialexpress.com/lifestyle/health/coronavirus-attack-heres-what-doctors-are-suggesting-for-precaution-and-prevention/1837564/","https://www.financialexpress.com/lifestyle/health/coronavirus-attack-heres-what-doctors-are-suggesting-for-precaution-and-prevention/1837564/lite/","2020-01-28 09:45:00","Coronavirus attack : Here what doctors are suggesting for precaution and prevention"
"https://www.wtsp.com/article/news/local/coronavirus-concerns-spread-in-tampa-bay-even-though-the-disease-hasnt/67-b9a12f9b-515e-4a7b-bb23-cf2540fb19eb","https://www.wtsp.com/amp/article/news/local/coronavirus-concerns-spread-in-tampa-bay-even-though-the-disease-hasnt/67-b9a12f9b-515e-4a7b-bb23-cf2540fb19eb","2020-01-28 22:15:00","Coronavirus concerns spreading faster than the virus"
"https://www.ibtimes.com/fig-leaf-or-first-defence-deploying-flimsy-masks-against-virus-2911051","","2020-01-28 10:15:00","Fig Leaf Or First Defence ? Deploying Flimsy Masks Against Virus"
"https://www.elcomercio.es/sociedad/comision-europea-anuncia-repatriacion-coronavirus-20200128191215-nt.html","https://www.elcomercio.es/sociedad/comision-europea-anuncia-repatriacion-coronavirus-20200128191215-nt_amp.html","2020-01-28 18:45:00","La Comisión Europea anuncia la evacuación de China de 350 europeos por el coronavirus"
"https://www.mirror.co.uk/news/uk-news/coronavirus-fears-birmingham-patient-escorted-21377553","https://www.mirror.co.uk/news/uk-news/coronavirus-fears-birmingham-patient-escorted-21377553.amp","2020-01-28 14:15:00","Coronavirus fears as united kingdom man who visited Wuhan escorted by medic in hazmat suit"
"https://ria.ru/20200128/1563983239.html","https://ria.ru/amp/20200128/1563983239.html","2020-01-28 16:00:00","Отели во Вьетнаме предупредили туристов о вспышке коронавируса"
"https://vosizneias.com/2020/01/28/in-photos-chinese-virus-affect-on-daily-life/","","2020-01-28 18:15:00","In Photos : Chinese Virus Affect On Daily Life"
"https://www.ledevoir.com/societe/571664/coronovirus-inquietudes-a-brossard","","2020-01-28 06:00:00","La peur sinstalle au Québec , malgré les messages rassurants des autorités"
"https://www.journaldequebec.com/2020/01/28/pour-eviter-le-coronavirus-un-conseil-simple-et-gratuit-1","","2020-01-28 19:30:00","Pour éviter le coronavirus , un conseil simple et gratuit"
"https://www.ideal.es/sociedad/salud/policia-reparte-marcarillas-20200128133646-ntrc.html","https://www.ideal.es/sociedad/salud/policia-reparte-marcarillas-20200128133646-ntrc_amp.html","2020-01-28 14:00:00","La Policía Nacional reparte marcarillas a los agentes en los aeropuertos ante el coronavirus"
"https://calgarysun.com/news/local-news/warmington-thousands-unchecked-for-coronavirus-at-pearson/wcm/28c9d28b-9074-45f3-8544-f57997e78d61","https://calgarysun.com/news/local-news/warmington-thousands-unchecked-for-coronavirus-at-pearson/wcm/28c9d28b-9074-45f3-8544-f57997e78d61/amp","2020-01-28 20:00:00","WARMINGTON : No medical screening for arrivals from three China flights"
"https://www.segodnya.ua/ukraine/ot-koronavirusa-ne-spasut-suprun-perechislila-bespoleznye-sredstva-i-lekarstva-1394164.html","/ukraine-amp/ot-koronavirusa-ne-spasut-suprun-perechislila-bespoleznye-sredstva-i-lekarstva-1394164.html","2020-01-28 21:30:00","Коронавирус - Супрун назвала симптомы , есть ли лекарства - новости Украины"
"https://tass.ru/mezhdunarodnaya-panorama/7621599","https://tass.ru/mezhdunarodnaya-panorama/7621599/amp","2020-01-28 08:15:00","Власти Китая подтвердили , что коронавирус нового типа может передаваться контактным путем"
"https://www.rtbf.be/info/societe/detail_coronavirus-trois-nouveaux-cas-en-allemagne?id=10419101","","2020-01-28 21:15:00","Coronavirus : trois nouveaux cas en Allemagne"
"https://www.vol.at/coronavirus-schutzmasken-in-vorarlberg-nur-bedingt-gefragt/6501215","https://www.vol.at/coronavirus-schutzmasken-in-vorarlberg-nur-bedingt-gefragt/6501215/amp","2020-01-28 20:45:00","Coronavirus : Schutzmasken in Vorarlberg nur bedingt gefragt"
"https://www.vol.at/coronavirus-schutzmasken-in-vorarlberg-nur-bedingt-gefragt/6501215/","https://www.vol.at/coronavirus-schutzmasken-in-vorarlberg-nur-bedingt-gefragt/6501215/amp","2020-01-28 22:15:00","Coronavirus : Schutzmasken in Vorarlberg nur bedingt gefragt"
"https://blitz.bg/svyat/blgarska-studentka-blokirana-v-ukhan-razkaza-kakvo-se-sluchva-tam_news723263.html","","2020-01-28 08:30:00","Българска студентка , блокирана в Ухан , разказа какво се случва там"
"http://interfax.az/view/790531","","2020-01-28 14:00:00","Жители Эстонии скупают в аптеках медицинские маски из - за коронавируса в Китае"
"https://people.com/health/surgical-masks-selling-out-helpful-preventing-coronavirus/","https://people.com/health/surgical-masks-selling-out-helpful-preventing-coronavirus/amp/","2020-01-28 21:15:00","Surgical Masks Selling Out But Do They Prevent Coronavirus ? | PEOPLE . com"
"https://korrespondent.net/ukraine/4187329-masky-y-vaktsyna-ot-koronavyrusa-v-ukrayne-aktyvyzyrovalys-moshennyky","https://korrespondent.net/amp/4187329-masky-y-vaktsyna-ot-koronavyrusa-v-ukrayne-aktyvyzyrovalys-moshennyky","2020-01-28 11:00:00","Маски и вакцина от коронавируса . В Украине активизировались мошенники"
"https://www.king5.com/article/news/health/surgical-mask-effectiveness/281-9c762e52-c2ec-4dec-b5f3-77ee833fca1e","https://www.king5.com/amp/article/news/health/surgical-mask-effectiveness/281-9c762e52-c2ec-4dec-b5f3-77ee833fca1e","2020-01-28 00:30:00","How effective are masks at stopping the spread of coronavirus ? "
"https://www.francetvinfo.fr/sante/maladie/coronavirus/coronavirus-les-masques-de-protection-en-rupture-de-stock_3803287.html","https://mobile.francetvinfo.fr/sante/maladie/coronavirus/coronavirus-les-masques-de-protection-en-rupture-de-stock_3803287.amp","2020-01-28 16:30:00","Coronavirus : les masques de protection en rupture de stock"
"https://www.kp.ru/online/news/3747099/","https://amp.kp.ru/online/news/3747099/","2020-01-28 11:15:00","Китайским коронавирусом можно заразиться через слизистую оболочку глаз"
"https://www.msn.com/en-us/health/medical/what-to-know-about-coronavirus-symptoms/ar-BBZceSG","","2020-01-28 22:15:00","What to know about coronavirus symptoms"
"https://fedpress.ru/news/77/society/2418058","","2020-01-28 04:15:00","Большинство россиян считают коронавирус реальной угрозой | Москва"
"https://economia.uol.com.br/cotacoes/noticias/redacao/2020/01/28/dolar-cai-037-e-fecha-o-dia-a-r-4194.htm","https://economia.uol.com.br/cotacoes/noticias/redacao/2020/01/28/dolar-cai-037-e-fecha-o-dia-a-r-4194.amp.htm","2020-01-28 20:30:00","Dólar cai 0 , 37 % e fecha o dia a R$ 4 , 194"
"https://newsinfo.inquirer.net/1220876/normal-people-doing-normal-work-need-not-wear-mask-who-official","https://newsinfo.inquirer.net/1220876/normal-people-doing-normal-work-need-not-wear-mask-who-official/amp","2020-01-28 14:45:00","  Normal people doing normal work  need not wear mask - WHO official"
"https://vancouversun.com/news/local-news/five-things-to-know-about-coronavirus-in-b-c","https://vancouversun.com/news/local-news/five-things-to-know-about-coronavirus-in-b-c/amp","2020-01-28 23:30:00","Five things to know about coronavirus in B . C . "
"https://www.correiobraziliense.com.br/app/noticia/mundo/2020/01/28/interna_mundo,823916/a-mascara-e-uma-opcao-de-protecao-mas-sem-100-de-garantia.shtml","https://www.correiobraziliense.com.br/app/noticia/mundo/2020/01/28/interna_mundo,823916/amp.html","2020-01-28 17:30:00","A máscara é uma opo de proteo , mas sem 100 % de garantia"
"https://www.adelaidenow.com.au/lifestyle/health/do-surgical-masks-protect-against-coronavirus/news-story/44a9bf2cd5434b278b2f489b51d49972?nk=602e79070130c21bbcfb7cc6b908b67d-1580170677","https://amp.adelaidenow.com.au/lifestyle/health/do-surgical-masks-protect-against-coronavirus/news-story/44a9bf2cd5434b278b2f489b51d49972","2020-01-28 00:30:00","Coronavirus outbreak : Do surgical masks protect against infection ? "
"https://g1.globo.com/mundo/noticia/2020/01/28/hong-kong-anuncia-restricao-de-circulacao-com-a-china-continental.ghtml","https://g1.globo.com/google/amp/mundo/noticia/2020/01/28/hong-kong-anuncia-restricao-de-circulacao-com-a-china-continental.ghtml","2020-01-28 10:45:00","Hong Kong anuncia restrio de circulao com a China continental por causa do coronavírus | Mundo"
"https://noticias.uol.com.br/saude/ultimas-noticias/reuters/2020/01/28/bolsonaro-diz-que-nao-seria-oportuno-repatriar-familia-brasileira-com-suspeita-de-coronavirus.htm","https://noticias.uol.com.br/saude/ultimas-noticias/reuters/2020/01/28/bolsonaro-diz-que-nao-seria-oportuno-repatriar-familia-brasileira-com-suspeita-de-coronavirus.amp.htm","2020-01-28 19:00:00","Coronavírus : Bolsonaro diz que não seria oportuno repatriar família brasileira com suspeita do vírus"
"https://www.prisonplanet.com/report-chinese-man-uses-sanitary-pad-as-face-mask-in-coronavirus-crisis.html","","2020-01-28 15:45:00","Prison Planet . com » REPORT : Chinese Man Uses Sanitary Pad as Face Mask in Coronavirus Crisis"
"https://www.tsf.pt/mundo/viver-sob-ameaca-de-um-virus-11756719.html","https://www.tsf.pt/mundo/amp/viver-sob-ameaca-de-um-virus-11756719.html","2020-01-28 11:00:00","Viver sob ameaça de um vírus"
"https://theprovince.com/news/local-news/five-things-to-know-about-coronavirus-in-b-c/wcm/9a0ea42c-d749-4e4f-bd89-6bd121b3ac24","https://theprovince.com/news/local-news/five-things-to-know-about-coronavirus-in-b-c/wcm/9a0ea42c-d749-4e4f-bd89-6bd121b3ac24/amp","2020-01-28 22:15:00","Five things to know about coronavirus in B . C . "
"https://www.cbc.ca/news/canada/manitoba/coronavirus-winnipeg-mask-sold-out-1.5442021","https://www.cbc.ca/amp/1.5442021","2020-01-28 06:00:00",""
"https://www.reuters.com/article/us-china-health-air-canada/air-canada-cancelling-select-flights-to-china-in-response-to-coronavirus-idUSKBN1ZR2RO","https://mobile.reuters.com/article/amp/idUSKBN1ZR2RO","2020-01-28 22:15:00","Air Canada cancelling select flights to China in response to coronavirus"
"https://in.reuters.com/article/us-china-health-air-canada/air-canada-cancelling-select-flights-to-china-in-response-to-coronavirus-idINKBN1ZR2RO","https://in.mobile.reuters.com/article/amp/idINKBN1ZR2RO","2020-01-28 22:45:00","Air Canada cancelling select flights to China in response to coronavirus"
"https://uk.reuters.com/article/us-china-health-air-canada/air-canada-cancelling-select-flights-to-china-in-response-to-coronavirus-idUKKBN1ZR2RO","https://uk.mobile.reuters.com/article/amp/idUKKBN1ZR2RO","2020-01-28 22:30:00","Air Canada cancelling select flights to China in response to coronavirus"
"http://news.bigmir.net/world/1974796-Koronavirys-rasprostranilsya-ne-cherez-rinok-moreprodyktov-ychenie","http://amp.news.bigmir.net/world/1974796-Koronavirys-rasprostranilsya-ne-cherez-rinok-moreprodyktov-ychenie","2020-01-28 14:00:00","Коронавирус распространился не через рынок морепродуктов"
