URL,MobileURL,Date,Title
"https://www.thesundaily.my/local/home-ministry-asked-to-allow-face-mask-producers-to-hire-more-foreign-workers-DY2010467","","2020-02-14 14:45:00","Home Ministry asked to allow face mask producers to hire more foreign workers"
"https://news.northeastern.edu/2020/02/13/the-novel-coronavirus-disease-now-has-a-name-covid-19/","","2020-02-14 06:30:00","The novel coronavirus disease now has a name : COVID - 19"
"https://ph.news.yahoo.com/khok-words-time-covid-19-094600839.html","https://ph.news.yahoo.com/amphtml/khok-words-time-covid-19-094600839.html","2020-02-14 14:30:00","Khok : Words in the time of COVID - 19"
"https://www.sunstar.com.ph/article/1844316","","2020-02-14 13:30:00","Khok : Words in the time of COVID - 19"
"https://www.cbs8.com/article/news/local/more-people-wearing-face-masks-since-covid-19-outbreak/509-4a907768-60f8-45ad-9af6-3e6a31e0363f","https://www.cbs8.com/amp/article/news/local/more-people-wearing-face-masks-since-covid-19-outbreak/509-4a907768-60f8-45ad-9af6-3e6a31e0363f","2020-02-14 07:15:00","More people wearing face masks since COVID - 19 outbreak"
"https://www.malaysiakini.com/news/510899","","2020-02-14 14:30:00","Face mask production : Home Ministry asked to give leeway on hiring foreign workers"
"https://www.abqjournal.com/1420485/unmasking-the-truth-no-coronavirus-in-new-mexico.html","https://www.abqjournal.com/1420485/unmasking-the-truth-no-coronavirus-in-new-mexico.html/amp","2020-02-14 01:00:00","Unmasked truth : No coronavirus in New Mexico"
"https://www.nst.com.my/news/nation/2020/02/565484/shopping-malls-urged-implement-preventive-measures-covid-19","//www.nst.com.my/node/565484/amp","2020-02-14 04:45:00","Shopping malls urged to implement preventive measures for Covid - 19"
"https://www.thestreet.com/personal-finance/can-my-dog-get-coronavirus","https://www.thestreet.com/.amp/personal-finance/can-my-dog-get-coronavirus","2020-02-14 04:15:00","Can My Dog Get Coronavirus ? "
"https://www.cbs8.com/article/news/health/coronavirus/travelers-express-concerns-about-flying-amid-outbreak-of-covid-19/509-1a03357b-7968-4bf2-866d-d9539cccd32a","https://www.cbs8.com/amp/article/news/health/coronavirus/travelers-express-concerns-about-flying-amid-outbreak-of-covid-19/509-1a03357b-7968-4bf2-866d-d9539cccd32a","2020-02-14 07:15:00","Travelers express concerns about flying amid outbreak of COVID - 19"
"https://www.themalaysianinsight.com/s/219102","","2020-02-14 15:45:00","Mask producers can hire extra foreigners to boost production , says DPM"
"https://www.theedgemarkets.com/article/ramping-face-mask-production-home-ministry-asked-give-leeway-hiring-foreign-workers","","2020-02-14 18:00:00","Ramping up face mask production : Home Ministry asked to give leeway for hiring of foreign workers"
"https://nationalpost.com/news/cp-newsalert-fifth-person-in-b-c-presumptively-confirmed-for-new-coronavirus","https://nationalpost.com/news/cp-newsalert-fifth-person-in-b-c-presumptively-confirmed-for-new-coronavirus/amp","2020-02-14 22:45:00","Fifth case of coronavirus in Canada , presumptively confirmed in B . C . "
"https://www.680news.com/2020/02/14/fifth-person-in-b-c-presumptively-confirmed-for-new-coronavirus/","https://www.680news.com/2020/02/14/fifth-person-in-b-c-presumptively-confirmed-for-new-coronavirus/amp/","2020-02-14 21:45:00","Fifth person in B . C . presumptively confirmed for new coronavirus"
"http://www.msn.com/en-nz/news/world/fake-news-makes-disease-outbreaks-worse-study-finds/ar-BBZYWXD","","2020-02-14 02:45:00","Fake news makes disease outbreaks worse , study finds"
"https://www.msn.com/en-nz/news/world/fake-news-makes-disease-outbreaks-worse-study-finds/ar-BBZYWXD","","2020-02-14 01:00:00","Fake news makes disease outbreaks worse , study finds"
"https://www.dailystar.co.uk/news/world-news/woman-dodging-coronavirus-checkpoint-jumps-21497846","https://www.dailystar.co.uk/news/world-news/woman-dodging-coronavirus-checkpoint-jumps-21497846.amp","2020-02-14 16:00:00","Woman dodging coronavirus checkpoint jumps off bridge in dramatic video"
"https://www.univision.com/local/san-antonio-kwex/se-agotan-las-mascarillas-faciales-en-farmacias-de-san-antonio","https://www.univision.com/amp/local/san-antonio-kwex/se-agotan-las-mascarillas-faciales-en-farmacias-de-san-antonio","2020-02-15 00:00:00","Se agotan las mascarillas faciales en farmacias de San Antonio"
"https://www.albawaba.com/node/philippines-florist-selling-anti-coronavirus-bouquets-valentines-and-people-are-loving-it","https://www.albawaba.com/amp/node/philippines-florist-selling-anti-coronavirus-bouquets-valentines-and-people-are-loving-it","2020-02-14 17:00:00","Philippines Florist Is Selling Anti - Coronavirus Bouquets for Valentine , and People Are Loving It"
"https://www.680news.com/2020/02/14/cp-newsalert-fifth-person-in-b-c-presumptively-confirmed-for-new-coronavirus/","https://www.680news.com/2020/02/14/cp-newsalert-fifth-person-in-b-c-presumptively-confirmed-for-new-coronavirus/amp/","2020-02-14 21:30:00","CP NewsAlert : Fifth person in B . C . presumptively confirmed for new coronavirus"
"https://www.nbcnews.com/health/health-news/what-new-coronavirus-n1119081?cid=public-rss_20200214","https://www.nbcnews.com/news/amp/ncna1119081","2020-02-14 04:30:00","What is the coronavirus disease and is there a coronavirus vaccine ? "
"https://www.msn.com/en-us/news/world/florist-in-the-philippines-selling-anti-coronavirus-bouquets-for-valentine-e2-80-99s-day/ar-BBZZ1rE","","2020-02-14 19:45:00","Florist in the Philippines selling anti - coronavirus bouquets for Valentine Day"
"https://www.msn.com/en-ae/news/other/philippines-florist-is-selling-anti-coronavirus-bouquets-for-valentine-e2-80-99s-and-people-are-loving-it/ar-BB1010Hs","","2020-02-14 23:00:00","Philippines Florist Is Selling Anti - Coronavirus Bouquets for Valentine , and People Are Loving It"
"http://www.newsonair.com/News?title=China-reports-63,767-confirmed-cases-of-COVID-19&id=381320","","2020-02-14 11:00:00","China reports 63 , 767 confirmed cases of COVID - 19"
"https://dailyhive.com/vancouver/fifth-coronavirus-presumptively-confirmed-bc","","2020-02-14 22:15:00","Fifth presumptive case of coronavirus confirmed in BC"
"https://www.cbc.ca/news/canada/calgary/containing-covid-19-medical-supplies-are-stockpiled-and-alberta-doctors-are-on-alert-1.5462658","https://www.cbc.ca/amp/1.5462658","2020-02-14 01:45:00","Containing COVID - 19 : Medical supplies are stockpiled and Alberta doctors are on alert"
"https://indianexpress.com/article/india/coronavirus-india-china-wuhan-diamond-princess-japanese-cruise-ship-6268326/","https://indianexpress.com/article/india/coronavirus-india-china-wuhan-diamond-princess-japanese-cruise-ship-6268326/lite/","2020-02-14 12:15:00","Third Indian tests positive for coronavirus on board quarantined Japanese cruise"
"https://www.thestar.com.my/news/nation/2020/02/14/scaled-down-chingay-festival-proceeds-despite-covid-19-outbreak","","2020-02-14 14:15:00","Scaled - down Chingay Festival proceeds despite Covid - 19 outbreak"
"https://uk.reuters.com/uk.reuters.com/article/uk-china-health-scale/under-chinas-coronavirus-lockdown-millions-have-nowhere-to-go-idUKKBN2081DE","https://uk.mobile.reuters.com/article/amp/idUKKBN2081DE","2020-02-14 13:30:00","Under China coronavirus lockdown , millions have nowhere to go"
"https://uk.reuters.com/article/uk-china-health-scale/under-chinas-coronavirus-lockdown-millions-have-nowhere-to-go-idUKKBN2081DE","https://uk.mobile.reuters.com/article/amp/idUKKBN2081DE","2020-02-14 12:00:00","Under China coronavirus lockdown , millions have nowhere to go"
"https://www.msn.com/en-au/news/australia/coronavirus-checks-clear-cruise-ship-docked-in-sydney-harbour/ar-BBZYLxU","","2020-02-14 06:45:00","Coronavirus checks clear cruise ship docked in Sydney Harbour"
"https://in.reuters.com/article/health-fake/fake-news-makes-disease-outbreaks-worse-study-finds-idINKBN20807A","https://in.mobile.reuters.com/article/amp/idINKBN20807A","2020-02-14 03:15:00","Fake news makes disease outbreaks worse , study finds"
"https://www.reuters.com/article/us-health-fake-idUSKBN208028","https://mobile.reuters.com/article/amp/idUSKBN208028","2020-02-14 06:30:00","Fake news makes disease outbreaks worse , study finds"
"https://www.reuters.com/article/us-health-fake/fake-news-makes-disease-outbreaks-worse-study-finds-idUSKBN208028","https://mobile.reuters.com/article/amp/idUSKBN208028","2020-02-14 01:00:00","Fake news makes disease outbreaks worse , study finds"
"https://article.wn.com/view/2020/02/14/COVID19s_impact_on_5G_will_be_limited_Samsung_LG/","","2020-02-14 15:30:00","COVID - 19 impact on 5G will be limited : Samsung , LG"
"https://www.breitbart.com/news/oxygen-therapy-working-for-coronavirus-patient-seoul-says/","https://www.breitbart.com/news/oxygen-therapy-working-for-coronavirus-patient-seoul-says/amp/","2020-02-14 19:45:00","Oxygen therapy working for coronavirus patient , Seoul says"
"https://www.upi.com/Top_News/World-News/2020/02/14/Oxygen-therapy-working-for-coronavirus-patient-Seoul-says/6651581696794/","https://www.upi.com/amp/Top_News/World-News/2020/02/14/Oxygen-therapy-working-for-coronavirus-patient-Seoul-says/6651581696794/","2020-02-14 16:45:00","Oxygen therapy working for coronavirus patient , Seoul says"
"https://www.wbtv.com/2020/02/14/florist-philippines-selling-anti-coronavirus-bouquets-valentines-day/","/2020/02/14/florist-philippines-selling-anti-coronavirus-bouquets-valentines-day/?outputType=amp","2020-02-14 00:30:00","Florist in the Philippines selling anti - coronavirus bouquets for Valentine Day"
"https://sciencepost.fr/ce-drole-de-robot-informe-les-new-yorkais-sur-le-covid-19/","","2020-02-14 13:30:00","Ce drôle de robot informe les New - Yorkais sur le Covid - 19"
"https://communityimpact.com/austin/cedar-park-leander/health-care/2020/02/13/the-first-coronavirus-case-in-texas-was-just-confirmed-here-is-what-austinites-need-to-know-about-the-virus/","","2020-02-14 09:30:00","The first coronavirus case in Texas was just confirmed . Here is what Austinites need to know about the virus"
"https://africa.cgtn.com/2020/02/14/nigeria-and-china-address-health-emergency-on-corona-virus/","","2020-02-14 20:15:00","Nigeria and China address health emergency on Corona Virus"
"https://www.smh.com.au/world/asia/chinese-medics-pay-heavy-price-as-death-toll-rises-20200215-p5412v.html","https://amp.smh.com.au/world/asia/chinese-medics-pay-heavy-price-as-death-toll-rises-20200215-p5412v.html","2020-02-14 22:15:00","Chinese medics pay heavy price as death toll rises"
"https://www.theage.com.au/world/asia/chinese-medics-pay-heavy-price-as-death-toll-rises-20200215-p5412v.html","https://amp.theage.com.au/world/asia/chinese-medics-pay-heavy-price-as-death-toll-rises-20200215-p5412v.html","2020-02-14 22:30:00","Chinese medics pay heavy price as death toll rises"
"https://www.cleveland.com/metro/2020/02/close-to-2000-health-workers-in-china-infected-with-coronavirus-us-confirms-15th-case-covid-19-news-roundup.html","https://www.cleveland.com/metro/2020/02/close-to-2000-health-workers-in-china-infected-with-coronavirus-us-confirms-15th-case-covid-19-news-roundup.html?outputType=amp","2020-02-14 13:00:00","Close to 2 , 000 health workers in China infected with coronavirus ; U . S . confirms 15th case : COVID - 19 news roundup"
"https://www.thetelegraphandargus.co.uk/news/national/18236667.hundreds-people-contacted-coronavirus-case-emerges-bus-summit/","https://www.thetelegraphandargus.co.uk/news/national/18236667.amp/","2020-02-14 15:45:00","Hundreds of people contacted as coronavirus case emerges after bus summit"
"https://panahon.tv/beta/v2/web/blog/2020/02/coronavirus-faqs/","","2020-02-14 15:30:00","CORONAVIRUS FAQS – Panahon TV"
"https://www.brisbanetimes.com.au/world/asia/chinese-medics-pay-heavy-price-as-death-toll-rises-20200215-p5412v.html","https://amp.brisbanetimes.com.au/world/asia/chinese-medics-pay-heavy-price-as-death-toll-rises-20200215-p5412v.html","2020-02-14 22:15:00","Chinese medics pay heavy price as death toll rises"
"https://www.businessinsider.com/people-buy-face-masks-for-pets-over-covid-19-fears-2020-2","https://www.businessinsider.com/people-buy-face-masks-for-pets-over-covid-19-fears-2020-2?amp","2020-02-14 06:15:00","Photos : People rush to buy face masks for pets over fears of COVID - 19"
"https://www.businessinsider.com/people-buy-face-masks-for-pets-over-covid-19-fears-2020-2/","https://www.businessinsider.com/people-buy-face-masks-for-pets-over-covid-19-fears-2020-2?amp","2020-02-14 19:45:00","Photos : People rush to buy face masks for pets over fears of COVID - 19"
"https://www.rediff.com/news/report/third-indian-on-board-japan-cruise-hit-by-coronavirus/20200214.htm","https://m.rediff.com/amp/news/report/third-indian-on-board-japan-cruise-hit-by-coronavirus/20200214.htm","2020-02-14 16:15:00","3rd Indian on board cruise off Japan coast hit by Coronavirus"
"https://www.yorkpress.co.uk/news/national/18236667.hundreds-people-contacted-coronavirus-case-emerges-bus-summit/","","2020-02-14 16:15:00","Hundreds of people contacted as coronavirus case emerges after bus summit"
"https://www.theepochtimes.com/vietnam-denies-cruise-ship-from-entering-port-over-coronavirus_3238461.html","https://www.theepochtimes.com/vietnam-denies-cruise-ship-from-entering-port-over-coronavirus_3238461.html/amp","2020-02-14 18:15:00","Vietnam Denies Cruise Ship From Entering Port Over Coronavirus Fears"
"https://www.tatar-inform.ru/news/official/14-02-2020/mintimer-shaymiev-v-stroitelstve-polilingvalnogo-kompleksa-ne-dolzhno-byt-melochey-5722807","","2020-02-14 16:45:00","Минтимер Шаймиев : В строительстве полилингвального комплекса не должно быть мелочей"
"http://theindependent.sg/singapore-parents-air-concerns-over-schools-allegedly-telling-children-not-to-wear-masks/","","2020-02-14 16:45:00","Singapore parents air concerns over schools allegedly telling children not to wear masks – The Independent News"
"https://www.thecourier.co.uk/news/uk-world/1144522/nurse-in-self-isolation-says-process-not-being-dealt-with-effectively/","https://www.thecourier.co.uk/news/uk-world/1144522/nurse-in-self-isolation-says-process-not-being-dealt-with-effectively/amp/","2020-02-14 00:15:00","Nurse in self - isolation says process  not being dealt with effectively  "
"https://tuoitrenews.vn/news/society/20200214/life-inside-vietnams-covid19-epicenter/52991.html","","2020-02-14 13:00:00","Life inside Vietnam COVID - 19 epicenter | Tuoi Tre News"
"https://www.eveningexpress.co.uk/news/uk/hundreds-of-people-contacted-as-coronavirus-case-emerges-after-bus-summit/","https://www.eveningexpress.co.uk/news/uk/hundreds-of-people-contacted-as-coronavirus-case-emerges-after-bus-summit/amp/","2020-02-14 16:00:00","Hundreds of people contacted as coronavirus case emerges after bus summit"
"https://www.ibtimes.com/london-coronavirus-patient-took-uber-hospital-drivers-account-suspended-2922166","https://www.ibtimes.com/london-coronavirus-patient-took-uber-hospital-drivers-account-suspended-2922166?amp=1","2020-02-14 06:30:00","London Coronavirus Patient Took Uber To Hospital , Driver Account Suspended"
"https://www.businessinsider.com/coronavirus-apple-beijing-checking-customers-temperatures-at-stores-china-2020-2","https://www.businessinsider.com/coronavirus-apple-beijing-checking-customers-temperatures-at-stores-china-2020-2?amp","2020-02-14 18:15:00","Apple is checking customer temperatures at its Beijing stores"
"https://www.theargus.co.uk/news/national/18236667.hundreds-people-contacted-coronavirus-case-emerges-bus-summit/","https://www.theargus.co.uk/news/national/18236667.amp/","2020-02-14 17:30:00","Hundreds of people contacted as coronavirus case emerges after bus summit"
"https://www.businessinsider.in/tech/news/apple-is-checking-customers-temperatures-at-its-stores-in-beijing-because-of-the-coronavirus-outbreak/articleshow/74142395.cms","https://www.businessinsider.in/tech/news/apple-is-checking-customers-temperatures-at-its-stores-in-beijing-because-of-the-coronavirus-outbreak/amp_articleshow/74142395.cms","2020-02-14 19:45:00","Apple is checking customer temperatures at its stores in Beijing because of the coronavirus outbreak"
"https://www.salisburyjournal.co.uk/news/national/18236667.hundreds-people-contacted-coronavirus-case-emerges-bus-summit/","","2020-02-14 15:30:00","Hundreds of people contacted as coronavirus case emerges after bus summit"
"https://www.lancashiretelegraph.co.uk/news/national/18236667.hundreds-people-contacted-coronavirus-case-emerges-bus-summit/","","2020-02-14 15:45:00","Hundreds of people contacted as coronavirus case emerges after bus summit"
"https://www.cityam.com/coronavirus-what-are-the-symptoms-of-covid-19-and-how-can-i-avoid-catching-it/","https://www.cityam.com/coronavirus-what-are-the-symptoms-of-covid-19-and-how-can-i-avoid-catching-it/amp/","2020-02-14 16:30:00","Coronavirus : What are the symptoms of Covid - 19 ? : CityAM"
"https://www.nbcnews.com/news/world/coronavirus-updates-death-toll-tops-1-000-china-nations-race-n1134576?cid=public-rss_20200214","https://www.nbcnews.com/news/amp/ncna1134576","2020-02-14 04:45:00","Coronavirus death toll tops 1 , 000 in China , WHO issues new name"
"https://www.nst.com.my/news/nation/2020/02/565640/covid-19-leeway-face-mask-factories-bring-additional-foreign-workers","//www.nst.com.my/node/565640/amp","2020-02-14 13:00:00","Covid - 19 : Leeway for face mask factories to bring in additional foreign workers"
"https://www.nbcnews.com/business/business-news/say-it-sanitizer-beijing-florist-takes-covid-19-valentine-s-n1136631?cid=public-rss_20200214","https://www.nbcnews.com/news/amp/ncna1136631","2020-02-14 04:00:00","Say it with sanitizer : Beijing florist takes on COVID - 19 for Valentine Day"
"https://glavred.info/health/10149698-kak-ne-podhvatit-koronavirus-v-doroge-pravila-ot-komarovskogo.html","https://glavred.info/health/amp-10149698-kak-ne-podhvatit-koronavirus-v-doroge-pravila-ot-komarovskogo.html","2020-02-14 16:45:00","Как уберечься от коронавируса в дороге : что посоветовал Комаровский – Китай вирус"
"https://www.msn.com/en-us/finance/other/apple-is-checking-customers-temperatures-at-its-stores-in-beijing-because-of-the-coronavirus-outbreak/ar-BB100BMR","","2020-02-14 18:45:00","Apple is checking customer temperatures at its stores in Beijing because of the coronavirus outbreak"
"https://www.standard.co.uk/news/uk/face-masks-protect-coronavirus-expert-advice-a4362156.html","https://www.standard.co.uk/news/uk/face-masks-protect-coronavirus-expert-advice-a4362156.html?amp","2020-02-14 16:30:00","Can face masks really protect you from coronavirus ? "
"https://www.theboltonnews.co.uk/news/national/18236667.hundreds-people-contacted-coronavirus-case-emerges-bus-summit/","https://www.theboltonnews.co.uk/news/national/18236667.amp/","2020-02-14 16:45:00","Hundreds of people contacted as coronavirus case emerges after bus summit"
"https://www.castanet.net/news/BC/277135/New-COVID-19-case-involves-woman-in-the-interior","","2020-02-14 22:15:00","New COVID - 19 case involves woman in the interior - BC News"
"https://www.castanet.net/edition/news-story-277135-3-.htm","","2020-02-14 22:15:00","New COVID - 19 case involves woman in the interior - BC News"
"https://edmontonjournal.com/diseases-and-conditions/coronavirus/fifth-case-of-coronavirus-reported-in-british-columbia/wcm/0eab93f0-c56b-4e65-993c-8ef1de2cf278","https://edmontonjournal.com/diseases-and-conditions/coronavirus/fifth-case-of-coronavirus-reported-in-british-columbia/wcm/0eab93f0-c56b-4e65-993c-8ef1de2cf278/amp","2020-02-14 22:15:00","Fifth case of coronavirus reported in British Columbia"
"https://calgaryherald.com/diseases-and-conditions/coronavirus/fifth-case-of-coronavirus-reported-in-british-columbia/wcm/0eab93f0-c56b-4e65-993c-8ef1de2cf278","https://calgaryherald.com/diseases-and-conditions/coronavirus/fifth-case-of-coronavirus-reported-in-british-columbia/wcm/0eab93f0-c56b-4e65-993c-8ef1de2cf278/amp","2020-02-14 23:15:00","Fifth case of coronavirus reported in British Columbia"
"https://theprovince.com/news/local-news/fifth-case-of-coronavirus-reported-in-british-columbia/wcm/30097209-6ebe-454b-8f89-7141beabaeb2","https://theprovince.com/news/local-news/fifth-case-of-coronavirus-reported-in-british-columbia/wcm/30097209-6ebe-454b-8f89-7141beabaeb2/amp","2020-02-14 21:45:00","Fifth case of coronavirus reported in British Columbia"
"https://www.newsweek.com/florist-anti-coronavirus-bouquets-valentines-day-1487368","https://www.newsweek.com/florist-anti-coronavirus-bouquets-valentines-day-1487368?amp=1","2020-02-14 17:15:00","Florist Selling Anti - Coronavirus Bouquets for Valentine Day"
"https://financial-news.co.uk/apex-aligns-with-world-health-organization-to-encourage/","","2020-02-14 18:30:00","APEX aligns with World Health Organization to encourage normal air travel during Coronavirus – Financial News"
"https://www.kob.com/new-mexico-health-news/new-virus-has-infected-more-than-64000-people-globally/5644467/?cat=605","https://amp.kob.com/articles/new-virus-has-infected-more-than-64000-people-globally-5644467.html","2020-02-14 11:15:00","New virus has infected more than 64 , 000 people globally"
"https://www.npr.org/sections/goatsandsoda/2020/02/14/805289669/how-covid-19-kills-the-new-coronavirus-disease-can-take-a-deadly-turn","","2020-02-14 18:30:00","How Patients Die After Contracting COVID - 19 , The New Coronavirus Disease : Goats and Soda : NPR"
"https://newsinfo.inquirer.net/1229044/hong-kong-announces-3-2-b-fund-to-boost-fight-vs-coronavirus-epidemic","https://newsinfo.inquirer.net/1229044/hong-kong-announces-3-2-b-fund-to-boost-fight-vs-coronavirus-epidemic/amp","2020-02-14 15:45:00","Hong Kong announces $3 . 2 - B fund to boost fight vs coronavirus epidemic"
"https://www.pressandjournal.co.uk/news/uk/2023582/hundreds-of-people-contacted-as-coronavirus-case-emerges-after-bus-summit/","https://www.pressandjournal.co.uk/news/uk/2023582/hundreds-of-people-contacted-as-coronavirus-case-emerges-after-bus-summit/amp/","2020-02-14 16:00:00","Hundreds of people contacted as coronavirus case emerges after bus summit"
"https://www.swindonadvertiser.co.uk/news/national/18236667.hundreds-people-contacted-coronavirus-case-emerges-bus-summit/","","2020-02-14 18:00:00","Hundreds of people contacted as coronavirus case emerges after bus summit"
"https://www.businessinsider.com/vietnam-company-using-toilet-paper-for-coronavirus-masks-faces-penalty-2020-2","https://www.businessinsider.com/vietnam-company-using-toilet-paper-for-coronavirus-masks-faces-penalty-2020-2?amp","2020-02-14 17:30:00","Vietnam company using toilet paper for coronavirus masks faces penalty"
"https://larepublica.pe/salud/2020/02/14/oms-el-95-de-la-poblacion-mundial-no-se-lava-las-manos-despues-de-ir-el-bano-o-antes-de-comer-salud-ops-coronavirus-unicef-rddr/","https://larepublica.pe/salud/2020/02/14/oms-el-95-de-la-poblacion-mundial-no-se-lava-las-manos-despues-de-ir-el-bano-o-antes-de-comer-salud-ops-coronavirus-unicef-rddr/?outputType=amp","2020-02-14 01:00:00","OMS : el 95 % de la población mundial no se lava las manos después de ir el baño o antes de comer | salud | OPS | coronavirus | Unicef | rddr | Salud"
"https://larepublica.pe:443/salud/2020/02/14/oms-el-95-de-la-poblacion-mundial-no-se-lava-las-manos-despues-de-ir-el-bano-o-antes-de-comer-salud-ops-coronavirus-unicef-rddr/","https://larepublica.pe/salud/2020/02/14/oms-el-95-de-la-poblacion-mundial-no-se-lava-las-manos-despues-de-ir-el-bano-o-antes-de-comer-salud-ops-coronavirus-unicef-rddr/?outputType=amp","2020-02-14 01:00:00","OMS : el 95 % de la población mundial no se lava las manos después de ir el baño o antes de comer | salud | OPS | coronavirus | Unicef | rddr | Salud"
"https://o.canada.com/diseases-and-conditions/coronavirus/fifth-case-of-coronavirus-reported-in-british-columbia/wcm/0eab93f0-c56b-4e65-993c-8ef1de2cf278","https://o.canada.com/diseases-and-conditions/coronavirus/fifth-case-of-coronavirus-reported-in-british-columbia/wcm/0eab93f0-c56b-4e65-993c-8ef1de2cf278/amp","2020-02-14 22:15:00","Fifth case of coronavirus reported in British Columbia"
"https://www.watoday.com.au/world/asia/chinese-medics-pay-heavy-price-as-death-toll-rises-20200215-p5412v.html","https://amp.watoday.com.au/world/asia/chinese-medics-pay-heavy-price-as-death-toll-rises-20200215-p5412v.html","2020-02-14 23:45:00","Chinese medics pay heavy price as death toll rises"
"https://www.oxfordmail.co.uk/news/national/18236667.hundreds-people-contacted-coronavirus-case-emerges-bus-summit/","","2020-02-14 16:45:00","Hundreds of people contacted as coronavirus case emerges after bus summit"
"https://www.eveningtelegraph.co.uk/2020/02/14/hundreds-of-people-contacted-as-coronavirus-case-emerges-after-bus-summit/","https://www.eveningtelegraph.co.uk/2020/02/14/hundreds-of-people-contacted-as-coronavirus-case-emerges-after-bus-summit/amp/","2020-02-14 17:30:00","Hundreds of people contacted as coronavirus case emerges after bus summit"
"https://www.thestar.com.my/news/nation/2020/02/14/govt-to-allow-face-mask-manufacturers-to-hire-more-foreign-workers","","2020-02-14 11:45:00","Govt to allow face mask manufacturers to hire more foreign workers"
"https://www.publimetro.com.mx/mx/destacado-tv/2020/02/14/robot-patrulla-mide-la-temperatura-corporal.html","https://www.publimetro.com.mx/mx/metroamp/destacado-tv/2020/02/14/robot-patrulla-mide-la-temperatura-corporal.html","2020-02-14 19:15:00","Robot patrulla mide la temperatura corporal colaborando en el combate contra el coronavirus"
