URL,MobileURL,Date,Title
"https://heraldodemexico.com.mx/pais/coronavirus-mitos-verdades-sobre-enfermedad-covid-19-secretaria-salud/","","2020-02-27 01:45:00"," ¿ Comer ajo evita el coronavirus ? Mitos y verdades de la enfermedad"
"https://www.brusselstimes.com/all-news/belgium-all-news/97423/coronavirus-fake-news-and-conspiracies-begin-to-spread/","","2020-02-27 18:30:00","Coronavirus : Fake news and conspiracies begin to spread"
"https://www.dw.com/overlay/media/en/myths-vs-facts-how-true-is-coronavirus-information-on-the-web/52524871/52553559","","2020-02-27 13:15:00",""
"https://www.antena3.com/noticias/economia/el-coronavirus-dispara-la-venta-de-ajos-espanoles_202002275e57df320cf2b09631a4c5da.html","https://amp.antena3.com/noticias/economia/el-coronavirus-dispara-la-venta-de-ajos-espanoles_202002275e57df320cf2b09631a4c5da.html","2020-02-27 21:00:00","El coronavirus dispara la venta de ajos españoles"
"https://www.thejakartapost.com/news/2020/02/27/garlic-stock-will-only-suffice-until-april-without-chinese-imports.html","https://www.thejakartapost.com/amp/news/2020/02/27/garlic-stock-will-only-suffice-until-april-without-chinese-imports.html","2020-02-27 12:15:00","Garlic stock will only suffice until April without Chinese imports"
"https://www.hoy.com.py/nacionales/preocupa-posible-ingreso-de-coronavirus-reaccion-de-salud-y-falsas-informaciones","","2020-02-27 14:30:00","HOY / Preocupa posible ingreso de coronavirus , reacción de Salud y falsas informaciones"
"https://www.hoy.com.py/nacionales/mil-jovenes-fueron-a-buscar-empleo-a-nadie-se-le-pregunto-de-que-partido-era","","2020-02-27 11:45:00","HOY / Mil jóvenes fueron a buscar empleo :  A nadie se le preguntó de qué partido era  "
"http://www.msn.com/en-us/health/medical/12-myths-about-coronavirus-according-to-the-world-health-organization/ar-BB10ucpE","","2020-02-27 21:15:00","12 Myths About Coronavirus , According to the World Health Organization"
"https://www.timesnownews.com/health/article/vitamin-c-for-coronavirus-beware-of-these-5-dangerous-myths-about-the-deadly-covid19/558393","https://www.timesnownews.com/amp/health/article/vitamin-c-for-coronavirus-beware-of-these-5-dangerous-myths-about-the-deadly-covid19/558393","2020-02-27 08:45:00","Vitamin C for coronavirus ? Beware of these 5 dangerous myths about the deadly COVID - 19"
"https://www.health.com/condition/infectious-diseases/coronavirus-myths","https://www.health.com/condition/infectious-diseases/coronavirus-myths?amp=true","2020-02-27 21:15:00","12 Myths About Coronavirus , From the World Health Organization"
"https://sib.fm/news/2020/02/27/chesnok-rezko-podorozhal-v-rossii-iz-za-koronavirusa","","2020-02-27 03:00:00","Чеснок резко подорожал в России из - за коронавируса"
"https://www.news24.com/SouthAfrica/News/coronavirus-do-you-need-a-mask-spoilers-the-answer-is-no-20200226","https://m.news24.com/SouthAfrica/News/coronavirus-do-you-need-a-mask-spoilers-the-answer-is-no-20200226","2020-02-27 05:45:00","Coronavirus : Do you need a mask ? Spoilers , the answer is no . "
"https://m.news24.com/SouthAfrica/News/coronavirus-do-you-need-a-mask-spoilers-the-answer-is-no-20200226","","2020-02-27 06:00:00","Coronavirus : Do you need a mask ? Spoilers , the answer is no . "
"https://elpais.com/elpais/2020/02/27/buenavida/1582784548_287555.html","https://elpais.com/elpais/2020/02/27/buenavida/1582784548_287555.amp.html","2020-02-27 07:30:00","Diez rumores y mitos sobre el coronavirus desmentidos por la OMS | BuenaVida"
"https://www.dw.com/en/zimbabwe-businesses-count-cost-of-the-impact-of-coronavirus/a-52554723","https://amp.dw.com/en/zimbabwe-businesses-count-cost-of-the-impact-of-coronavirus/a-52554723","2020-02-27 12:45:00","Zimbabwe businesses count cost of the impact of coronavirus | Africa | DW"
"https://ukrainian.voanews.com/a/vooz-sprostovuye-mify-pro-koronavirus/5306902.html","https://ukrainian.voanews.com/amp/5306902.html","2020-02-28 00:00:00","Часник проти коронавірусу ? ВООЗ спростовує міфи про 2019 - nCoV"
"https://www.contextotucuman.com/nota/180110/de-tomar-cocaina-a-comer-ajo-la-lista-de-los-15-mitos-mas-ridiculos-sobre-el-coronavirus.html","https://www.contextotucuman.com/nota/180110/de-tomar-cocaina-a-comer-ajo-la-lista-de-los-15-mitos-mas-ridiculos-sobre-el-coronavirus.html/amp","2020-02-27 14:45:00","De tomar cocaína a comer ajo : la lista de los 15 mitos más ridículos sobre el coronavirus"
"https://www.clarin.com/buena-vida/coronavirus-oms-despeja-20-mitos-dudas-frecuentes_0_Kv2BDP9v.html","https://www.clarin.com/buena-vida/coronavirus-oms-despeja-20-mitos-dudas-frecuentes_0_Kv2BDP9v.amp.html","2020-02-27 03:15:00","Coronavirus : la OMS despeja 20 mitos y dudas frecuentes"
"https://www.dw.com/en/coronavirus-are-less-developed-eu-countries-more-susceptible/a-52553559","https://amp.dw.com/en/coronavirus-are-less-developed-eu-countries-more-susceptible/a-52553559","2020-02-27 13:15:00","Coronavirus : Are less - developed EU countries more susceptible ? | Europe| News and current affairs from around the continent | DW"
"https://caretas.pe/mundo/coronavirus-mitos-y-verdades-del-contagio-del-mortal-virus-que-se-expande-en-el-mundo/","https://caretas.pe/mundo/coronavirus-mitos-y-verdades-del-contagio-del-mortal-virus-que-se-expande-en-el-mundo/amp/","2020-02-27 15:30:00","La orina no sirve contra el coronavirus : mitos y verdades acerca del mortal virus de China"
"http://dunyanews.tv/en/Health/534445-Dispelling-myths-and-misconceptions-about-coronavirus","https://dunyanews.tv/amp/english/534445.php","2020-02-27 20:30:00","Dispelling myths and misconceptions about coronavirus"
"http://globalcomment.com/coronavirus-know-the-fact-from-the-fiction-about-covid-19/","","2020-02-27 23:00:00","Coronavirus : know the fact from the fiction about COVID - 19"
"https://elmundo.sv/todo-lo-que-no-debes-creer-sobre-el-coronavirus-segun-la-oms/","","2020-02-27 16:00:00","Todo lo que no debes creer sobre el coronavirus , según la OMS"
"http://menudodia.blogosfera.uol.com.br/2020/02/27/5-alimentos-que-ajudam-a-proteger-o-sistema-respiratorio-combatendo-gripes/","https://menudodia.blogosfera.uol.com.br/uol_amp/2020/02/27/5-alimentos-que-ajudam-a-proteger-o-sistema-respiratorio-combatendo-gripes/","2020-02-27 13:15:00","5 alimentos que ajudam a proteger o sistema respiratório , combatendo gripes"
"https://www.thedailystar.net/business/news/coronavirus-cant-tame-bangladeshs-growth-momentum-1873864","","2020-02-27 19:30:00","Coronavirus cant tame Bangladesh growth momentum"
"https://www.terrenature.ch/lail-noir-condiment-magique-venu-dasie-en-terres-vaudoises/","","2020-02-27 05:15:00","Lail noir , condiment magique venu dAsie en terres vaudoises – Terre & Nature"
"https://www.perfil.com/noticias/ciencia/mitos-y-verdades-sobre-como-hacerle-frente-al-nuevo-coronavirus.phtml","https://www.perfil.com/amp/noticias/ciencia/mitos-y-verdades-sobre-como-hacerle-frente-al-nuevo-coronavirus.phtml","2020-02-27 00:15:00","Mitos y verdades sobre cómo hacerle frente al nuevo coronavirus"
"https://www.newscientist.com/article/2235539-coronavirus-what-you-need-to-know-to-prepare-for-a-covid-19-pandemic/","https://www.newscientist.com/article/2235539-coronavirus-what-you-need-to-know-to-prepare-for-a-covid-19-pandemic/amp/","2020-02-27 16:45:00","Coronavirus : What you need to know to prepare for a covid - 19 pandemic"
"https://www.bigbangnews.com/actualidad/ajo-cocaina-y-pis-la-oms-derriba-mitos-sobre-el-coronavirus-y-lanza-16-recomendaciones-para-prevenir-el-contagio-20202269540","https://www.bigbangnews.com/nota/ajo-cocaina-y-pis-la-oms-derriba-mitos-sobre-el-coronavirus-y-lanza-16-recomendaciones-para-prevenir-el-contagio-20202269540/amp","2020-02-27 18:45:00","Ajo , cocaína y pis : la OMS derriba mitos sobre el coronavirus y lanza 16 recomendaciones para prevenir el contagio"
"https://www.genbeta.com/redes-sociales-y-comunidades/coronavirus-se-expande-lentamente-que-sus-bulos-enfermedad-whatsapp-redes-sociales","https://www.genbeta.com/redes-sociales-y-comunidades/coronavirus-se-expande-lentamente-que-sus-bulos-enfermedad-whatsapp-redes-sociales/amp","2020-02-27 09:30:00","El coronavirus se expande más lentamente que sus bulos sobre la enfermedad en WhatsApp y redes sociales"
"https://www.laverdad.es/sociedad/irracional-usar-mascarilla-20200226121025-ntrc.html","https://www.laverdad.es/sociedad/irracional-usar-mascarilla-20200226121025-ntrc_amp.html","2020-02-27 02:15:00","La OMS ve irracional usar la mascarilla y el gel desinfectante ante el coronavirus"
"https://www.folhavitoria.com.br/saude/noticia/02/2020/alimentacao-pode-prevenir-coronavirus-diz-especialista","","2020-02-27 12:45:00","Alimentao pode prevenir coronavírus , diz especialista"
"https://tn.com.ar/salud/lo-ultimo/coronavirus-los-diez-rumores-que-fueron-desmentidos-por-la-oms_1038009","https://amp.tn.com.ar/salud/lo-ultimo/coronavirus-los-diez-rumores-que-fueron-desmentidos-por-la-oms_1038009","2020-02-27 17:45:00","Coronavirus : los diez rumores que fueron desmentidos por la OMS"
"https://www.idnes.cz/ekonomika/zahranicni/koronavirus-automobilovy-sektor-retezce-fast-foodu-producenti-zakladnich-potravin-vyrobci-hracek.A200226_172210_eko-zahranicni_maz","","2020-02-27 13:00:00","Koronavirus : málo hraček na Velikonoce i dražší česnek"
"https://www.bostonglobe.com/2020/02/26/business/coronavirus-scams-are-infecting-internet-social-media-sites-are-fighting-back/","https://www.bostonglobe.com/2020/02/26/business/coronavirus-scams-are-infecting-internet-social-media-sites-are-fighting-back/?outputType=amp","2020-02-27 00:15:00","Coronavirus scams are infecting the Internet , but social - media sites are fighting back"
"https://jc.ne10.uol.com.br/blogs/vidafit/2020/02/27/entenda-como-exercicios-fisicos-e-boa-alimentacao-sao-aliados-contra-o-coronavirus/","https://jc.ne10.uol.com.br/blogs/vidafit/2020/02/27/entenda-como-exercicios-fisicos-e-boa-alimentacao-sao-aliados-contra-o-coronavirus/amp/","2020-02-27 20:30:00","Entenda como exercícios físicos e boa alimentao são aliados contra o coronavírus"
"https://www.ridus.ru/news/320905","","2020-02-27 21:15:00"," « Город ад »: активисты « Зеленой альтернативы » поменяли дорожные указатели"
"https://imirante.com/brasil/noticias/2020/02/27/disseminacao-de-fake-news-sobre-coronavirus-preocupa-especialistas.shtml","https://imirante.com/brasil/noticias/amp/2020/02/27/disseminacao-de-fake-news-sobre-coronavirus-preocupa-especialistas.shtml","2020-02-27 21:45:00","Disseminao de fake news sobre coronavírus preocupa especialistas"
"https://noticias.uol.com.br/ultimas-noticias/agencia-brasil/2020/02/27/disseminacao-de-fake-news-sobre-coronavirus-preocupa-especialistas.htm","https://noticias.uol.com.br/ultimas-noticias/agencia-brasil/2020/02/27/disseminacao-de-fake-news-sobre-coronavirus-preocupa-especialistas.amp.htm","2020-02-27 21:30:00","Disseminao de fake news sobre coronavírus preocupa especialistas"
"http://agenciabrasil.ebc.com.br/saude/noticia/2020-02/disseminacao-de-fake-news-sobre-o-coronavirus-preocupam-especialistas","http://agenciabrasil.ebc.com.br/saude/noticia/2020-02/disseminacao-de-fake-news-sobre-o-coronavirus-preocupam-especialistas?amp","2020-02-27 21:30:00","Disseminao de fake news sobre o coronavírus preocupam especialistas"
"https://www.ofm.co.za/article/centralsa/285775/-coronavirus-need-a-mask-spoilers-answer-is-no","","2020-02-27 07:00:00"," # Coronavirus : Need a mask ? Spoilers ... answer is no"
"https://www.istoedinheiro.com.br/disseminacao-de-fake-news-sobre-coronavirus-preocupa-especialistas/","","2020-02-27 21:30:00","Disseminao de fake news sobre coronavírus preocupa especialistas"
"https://www.hojeemdia.com.br/horizontes/dissemina%C3%A7%C3%A3o-de-fake-news-sobre-coronav%C3%ADrus-preocupa-especialistas-1.775325","","2020-02-27 22:00:00","Disseminao de fake news sobre coronavírus preocupa especialistas"
"https://www.lasprovincias.es/comunitat/bulos-contagian-20200227172715-nt.html","https://www.lasprovincias.es/comunitat/bulos-contagian-20200227172715-nt_amp.html","2020-02-27 23:15:00","Los bulos que nos contagian"
"https://www.bemparana.com.br/noticia/disseminacao-de-fake-news-sobre-coronavirus-vai-de-uisque-a-injecao-de-vitamina-d","","2020-02-27 22:00:00","Disseminao de fake news sobre coronavírus vai de uísque a injeo de vitamina D"
"https://www.courier-journal.com/story/money/companies/2020/02/26/papa-johns-bouncing-back-after-john-schnatter-controversy/4879014002/","https://amp.courier-journal.com/amp/4879014002","2020-02-27 00:30:00","Papa John bouncing back after John Schnatter controversy"
"https://www.middleeasteye.net/news/iranian-press-review-police-crack-down-spread-unofficial-coronavirus-toll","","2020-02-27 18:30:00","Iranian press review : Police crack down on spread of unofficial coronavirus toll"
"https://www.elidealgallego.com/opinion/aturuxos/cocaina-luchar-coronavirus/20200226214307429740.html","https://www.elidealgallego.com/opinion/aturuxos/cocaina-luchar-coronavirus/20200226214307429740.amp.html","2020-02-27 01:00:00","Cocaína para luchar con el coronavirus"
"https://www.larazon.es/ciencia/20200227/kalay54mxjcjxiuipyee2kfehq.html","https://www.larazon.es/ciencia/20200227/kalay54mxjcjxiuipyee2kfehq.html?outputType=amp","2020-02-27 07:30:00","Nos come el virus , el virus de la paranoia"
"https://www.kp.kz/daily/27094.4/4170419/","https://amp.crimea.kp.ru/daily/27094.4/4170419/","2020-02-27 13:00:00","Крымский художник продает картину « Коронавирус » за 50 тысяч рублей"
"https://www.idnes.cz/pardubice/zpravy/vrazda-orlickoustecko-sekera-matka-rozsudek.A200227_112124_pardubice-zpravy_alh","","2020-02-27 13:00:00","Za vraždu matky sekerou poslal soud dceru na patnáct let do vězení"
"https://kp.ua/life/661056-v-novykh-sanzharakh-opravdyvauitsia-y-zhaleuit-zaderzhannykh-zemliakov","","2020-02-27 18:00:00","В Новых Санжарах оправдываются и жалеют задержанных земляков"
"https://www.telegraph.co.uk/food-and-drink/features/yorkshire-tea-toffs-pg-tips-squares-does-tea-choice-say/","https://www.telegraph.co.uk/food-and-drink/features/yorkshire-tea-toffs-pg-tips-squares-does-tea-choice-say/amp/","2020-02-27 16:30:00","Yorkshire Tea is for toffs , PG Tips is for  square : what does your tea choice say about you ? "
"https://www.washingtonpost.com/es/post-opinion/2020/02/26/el-coronavirus-probara-si-podemos-unirnos-ante-una-crisis-global/","","2020-02-27 05:00:00","El coronavirus probará si podemos unirnos ante una crisis global"
"https://en.prothomalo.com/bangladesh/news/209995/Bangladesh-export-import-may-be-affected-by","http://m.prothom-alo.com/bangladesh/news/209995/Bangladesh-export-import-may-be-affected-by","2020-02-27 15:15:00","Bangladesh export - import may be affected by coronavirus : Commercial counsellor"
"https://kp.ua/economics/660992-kak-kytaiskyi-vyrus-zastavliaet-samykh-bohatykh-luidei-teriat-myllyardy-y-chem-eto-hrozyt-ukrayne","","2020-02-27 11:30:00","Как китайский вирус заставляет самых богатых людей терять миллиарды и чем это грозит Украине"
"https://qctimes.com/opinion/columnists/ignatius-coronavirus-will-test-whether-the-planet-can-unite-in/article_c3961cf8-b04d-5eca-9073-847c8f218f29.html","","2020-02-27 08:00:00","Ignatius : Coronavirus will test whether the planet can unite in the face of a global crisis"
"https://vietnamnet.vn/en/business/vietnam-business-news-headlines-feb-27-619318.html","http://m.vietnamnet.vn/en/business/vietnam-business-news-headlines-feb-27-619318.html","2020-02-27 03:00:00","VIETNAM BUSINESS NEWS HEADLINES FEB . 27"
"https://www.informa-tico.com/26-02-2020/precisiones-oms-frente-rumores-acerca-coronavirus","","2020-02-27 07:30:00","Las precisiones de la OMS frente a los rumores acerca del coronavirus"
"https://www.worldhealth.net/news/americas-first-case-community-spread-coronavirus/","","2020-02-28 00:00:00","America First Case Of Community Spread Coronavirus | Worldhealth . net Anti - Aging News"
"https://dnes.dir.bg/comments/chetirinayset-dushi-sa-nastaneni-vav-vma-sas-samneniya-za-koronavirus","https://m.dir.bg/dnes/comments/chetirinayset-dushi-sa-nastaneni-vav-vma-sas-samneniya-za-koronavirus","2020-02-27 07:30:00","Коментари - Четиринайсет души са изолирани във ВМА със съмнения за коронавирус"
"https://www.fool.com/earnings/call-transcripts/2020/02/27/papa-johns-international-pzza-q4-2019-earnings-cal.aspx?source=iedfolrf0000001","https://www.fool.com/amp/earnings/call-transcripts/2020/02/27/papa-johns-international-pzza-q4-2019-earnings-cal.aspx","2020-02-27 08:45:00","Papa John International ( PZZA ) Q4 2019 Earnings Call Transcript"
"https://qconline.com/opinion/columnists/ignatius-coronavirus-will-test-whether-the-planet-can-unite-in/article_736cf43d-ca49-588a-9188-e1b48d637cd2.html","","2020-02-27 09:00:00","Ignatius : Coronavirus will test whether the planet can unite in the face of a global crisis"
"https://www.nsk.kp.ru/daily/27097.4/4170056/","https://amp.kp.ru/daily/27097.4/4170056/","2020-02-27 00:00:00","Чтобы не вернуться к России , Латвия убила свои советские заводы . А теперь просит компенсацию"
