URL,MobileURL,Date,Title
"https://www.americatv.com.pe/noticias/util-e-interesante/mascarillas-coronavirus-quienes-necesitan-y-como-usarlas-n408169","https://www.americatv.com.pe/noticias/amp/util-e-interesante/mascarillas-coronavirus-quienes-necesitan-y-como-usarlas-n408169","2020-03-12 23:00:00","Mascarillas por coronavirus : ¿ quiénes la necesitan y cómo usarlas ? "
"https://sea.mashable.com/culture/9544/these-are-the-emoji-most-often-used-in-connection-with-coronavirus","https://sea.mashable.com/culture/9544/these-are-the-emoji-most-often-used-in-connection-with-coronavirus?amp=1","2020-03-12 05:00:00","These are the emoji most often used in connection with coronavirus"
"https://www.newsweek.com/scientists-london-infected-coronaviruses-covid-19-vaccine-treatments-1491976","https://www.newsweek.com/scientists-london-infected-coronaviruses-covid-19-vaccine-treatments-1491976?amp=1","2020-03-12 17:30:00","Scientists in London Paying People $4 , 000 to Get Infected With Coronaviruses to Help Find COVID - 19 Vaccine and Treatments"
"https://www.businessinsider.com.au/coronavirus-face-masks-who-needs-2020-2","https://www.businessinsider.com.au/coronavirus-face-masks-who-needs-2020-2/amp","2020-03-12 03:45:00","Who should wear a face mask during the coronavirus outbreak , and who should not"
"https://www.newsweek.com/nurses-protest-coronavirus-california-cdc-1491873","https://www.newsweek.com/nurses-protest-coronavirus-california-cdc-1491873?amp=1","2020-03-12 10:30:00","Nurses Protest Across Country Over  Mass Confusion  on How to Prepare for Coronavirus"
"https://www.newsweek.com/china-says-passed-peak-coronavirus-epidemic-covid-19-1491863","https://www.newsweek.com/china-says-passed-peak-coronavirus-epidemic-covid-19-1491863?amp=1","2020-03-12 09:30:00","China Claims Peak of Coronavirus Epidemic Has Passed As New Cases Decline and More Than 60 , 000 Have Recovered"
"https://www.standard.co.uk/news/health/coronavirus-symptoms-nhs-guide-a4383296.html","https://www.standard.co.uk/news/health/coronavirus-symptoms-nhs-guide-a4383296.html?amp","2020-03-12 16:45:00","Coronavirus symptoms united kingdom : NHS guidance on what to do if youre showing signs of the virus"
"https://www.newsweek.com/tom-hanks-rita-wilson-announce-they-have-tested-positive-coronavirus-australia-1491854","https://www.newsweek.com/tom-hanks-rita-wilson-announce-they-have-tested-positive-coronavirus-australia-1491854?amp=1","2020-03-12 03:30:00","Tom Hanks and Rita Wilson Announce They Have Tested Positive for Coronavirus in Australia"
"https://www.newsweek.com/miami-dade-county-mayor-will-declare-state-emergency-over-coronavirus-1491841","https://www.newsweek.com/miami-dade-county-mayor-will-declare-state-emergency-over-coronavirus-1491841?amp=1","2020-03-12 00:30:00","Miami - Dade County Mayor Will Declare State of Emergency Over Coronavirus"
"https://www.newsweek.com/coronavirus-gun-sales-asian-california-washington-1491891","https://www.newsweek.com/coronavirus-gun-sales-asian-california-washington-1491891?amp=1","2020-03-12 12:00:00","U . S . Gun Store Owners Say Asian Customers Are Buying Weapons Over Coronavirus Backlash Fears"
"https://newsinfo.inquirer.net/1241044/heres-what-to-do-when-you-self-quarantine","https://newsinfo.inquirer.net/1241044/heres-what-to-do-when-you-self-quarantine/amp","2020-03-12 22:00:00","Here what to do when you self - quarantine"
"https://www.standard.co.uk/news/health/new-uk-coronavirus-cases-announced-latest-figures-a4385641.html","https://www.standard.co.uk/news/health/new-uk-coronavirus-cases-announced-latest-figures-a4385641.html?amp","2020-03-12 16:45:00","Two London patients die in hospital as coronavirus cases leap by 134 in the united kingdom "
"https://www.standard.co.uk/lifestyle/london-life/coronarvirus-emoji-a4385741.html","https://www.standard.co.uk/lifestyle/london-life/coronarvirus-emoji-a4385741.html?amp","2020-03-12 17:00:00","Masks , petri dishes and no more fist bumps how the pandemic is changing the digital lexicon"
"https://citizen.co.za/news/2254265/24-hours-in-pictures-12-march-2020/","https://citizen.co.za/news/2254265/24-hours-in-pictures-12-march-2020/amp/","2020-03-12 17:00:00","24 hours in pictures , 12 March 2020"
"https://www.newsweek.com/carnival-cancels-cruises-amid-coronavirus-outbreak-princess-cruises-line-suspends-operations-two-1491923","https://www.newsweek.com/carnival-cancels-cruises-amid-coronavirus-outbreak-princess-cruises-line-suspends-operations-two-1491923?amp=1","2020-03-12 15:30:00","Carnival Cancels Cruises Amid Coronavirus Outbreak , Princess Cruises Line Suspends Operations For Two Months"
"https://www.repretel.com/actualidad/oms-declara-oficialmente-covid-como-pandemia-179937","","2020-03-12 00:30:00","23 preguntas y respuestas fundamentales sobre el coronavirus que nadie debería dejar de leer"
"https://patch.com/new-jersey/bridgewater/hand-washing-not-enough-governments-have-misinformed","https://patch.com/new-jersey/bridgewater/amp/28630863/hand-washing-not-enough-governments-have-misinformed","2020-03-12 00:45:00","Hand washing is not enough , governments have misinformed"
"https://sputniknews.com/europe/202003121078544286-first-coronavirus-death-registered-in-greece---reports/","https://sputniknews.com/amp/europe/202003121078544286-first-coronavirus-death-registered-in-greece---reports/","2020-03-12 07:00:00","First Coronavirus Death Registered in Greece - Reports"
"https://www.newsweek.com/ct-scans-coronavirus-lungs-covid-19-sufferers-1491997","https://www.newsweek.com/ct-scans-coronavirus-lungs-covid-19-sufferers-1491997?amp=1","2020-03-12 17:30:00","CT Scans Show What Coronavirus Did to the Lungs of COVID - 19 Sufferers"
"https://www.elmundo.es/ciencia-y-salud/salud/2020/03/12/5e6a5b4121efa063218b4614.html","https://amp.elmundo.es/ciencia-y-salud/salud/2020/03/12/5e6a5b4121efa063218b4614.html","2020-03-12 20:00:00","Coronavirus : los perros y gatos no se contagian ni pueden transmitir la enfermedad"
"https://www.msn.com/en-sg/news/world/why-wearing-a-face-mask-is-encouraged-in-asia-but-shunned-in-the-us/ar-BB114WMw","","2020-03-12 09:15:00","Why Wearing a Face Mask Is Encouraged in Asia , but Shunned in the U . S . "
"https://www.debate.com.mx/salud/Que-es-el-coronavirus-o-COVID-19-y-como-se-propaga-segun-la-OMS-20200122-0033.html","https://www.debate.com.mx/amp/salud/Que-es-el-coronavirus-o-COVID-19-y-como-se-propaga-segun-la-OMS-20200122-0033.html","2020-03-12 19:15:00","Qué es el coronavirus o COVID - 19 , y cómo se propaga según la OMS"
"https://www.newsweek.com/can-i-spread-coronavirus-grandparents-vulnerable-people-not-showing-symptoms-1491888","https://www.newsweek.com/can-i-spread-coronavirus-grandparents-vulnerable-people-not-showing-symptoms-1491888?amp=1","2020-03-12 13:45:00","Can I Spread Coronavirus to Grandparents and Other Vulnerable People When Im Not Showing Symptoms ? "
"https://www.timesnownews.com/india/article/coronavirus-india-registers-first-covid-19-death-state-wise-and-ut-wise-break-up-here-total-cases-now-at/563558","https://www.timesnownews.com/amp/india/article/coronavirus-india-registers-first-covid-19-death-state-wise-and-ut-wise-break-up-here-total-cases-now-at/563558","2020-03-12 22:15:00","Coronavirus Cases in India | Coronavirus India : Total confirmed cases in India touch 73 ; Check this list of state - wise and UT - wise break - up ; Coronavirus cases in Delhi , Mumbai , kerla , UP and other sates"
"https://patch.com/new-jersey/princeton/princeton-party-update-3-more-test-positive-coronavirus","https://patch.com/new-jersey/princeton/amp/28630298/princeton-party-update-3-more-test-positive-coronavirus","2020-03-12 03:30:00","Princeton Party Update : 3 More Test Positive For Coronavirus"
"https://www.bollywoodhungama.com/news/features/kapil-sharma-travels-wearing-mask-gives-advice-fans-amid-coronavirus-outbreak/","https://www.bollywoodhungama.com/amp/news/features/kapil-sharma-travels-wearing-mask-gives-advice-fans-amid-coronavirus-outbreak/","2020-03-12 04:30:00","Kapil Sharma travels wearing mask , gives advice to fans amid Coronavirus outbreak : Bollywood News"
"https://www.thejournal.ie/coronavirus-case-trinity-main-points-5043197-Mar2020/","https://www.thejournal.ie/coronavirus-case-trinity-main-points-5043197-Mar2020/?amp=1","2020-03-12 08:15:00","A second coronavirus case at Trinity College , and Trump travel ban : Today main Covid - 19 points"
"https://www.thestranger.com/slog/2020/03/11/43118421/keeping-it-together-despite-it-all","","2020-03-12 05:00:00","Keeping It Together , Despite It All"
"https://www.standard.co.uk/news/health/uk-coronavirus-fight-public-health-advice-a4385721.html","https://www.standard.co.uk/news/health/uk-coronavirus-fight-public-health-advice-a4385721.html?amp","2020-03-12 16:45:00","Rallying cry : Your country needs YOU to join coronavirus fight"
"https://www.newsweek.com/washington-governor-announces-school-closures-until-april-counties-hardest-hit-coronavirus-1492058","https://www.newsweek.com/washington-governor-announces-school-closures-until-april-counties-hardest-hit-coronavirus-1492058?amp=1","2020-03-12 23:15:00","Washington Governor Announces School Closures Until April in Counties Hardest Hit by Coronavirus"
"https://www.msn.com/en-au/health/medical/all-the-different-types-of-face-masks-and-who-should-wear-them-during-the-coronavirus-outbreak/ar-BB113Vj9","","2020-03-12 02:15:00","All the different types of face masks , and who should wear them during the coronavirus outbreak"
"https://www.standard.co.uk/tech/google-ban-coronavirus-face-mask-adverts-a4385596.html","https://www.standard.co.uk/tech/google-ban-coronavirus-face-mask-adverts-a4385596.html?amp","2020-03-12 14:00:00","Google bans face mask adverts to help stop spreading misinformation about coronavirus"
"https://www.publimetro.cl/cl/social/2020/03/12/coronavirus-oms-pandemia-covid-19-como-saber-como-se-contagia-sintomas-propaga.html","https://www.publimetro.cl/cl/metroamp/social/2020/03/12/coronavirus-oms-pandemia-covid-19-como-saber-como-se-contagia-sintomas-propaga.html","2020-03-12 11:45:00","Tras ser declarada como pandemia : OMS responde las dudas más frecuentes sobre el coronavirus"
"https://globalnews.ca/news/6666182/coronavirus-celebrities/","https://globalnews.ca/news/6666182/coronavirus-celebrities/amp/","2020-03-12 16:45:00","Coronavirus : Celebrities including Tom Hanks , Naomi Campbell react to outbreak"
"https://www.newsweek.com/flatten-curve-graph-coronavirus-deaths-1491877","","2020-03-12 09:30:00","  Flattening the Curve  Could Significantly Reduce Coronavirus Deaths"
"https://www.newsweek.com/who-coronavirus-pandemic-worried-1491935","https://www.newsweek.com/who-coronavirus-pandemic-worried-1491935?amp=1","2020-03-12 15:30:00","Who Declares Pandemic How Worried Should I Be ? "
"https://www.aol.co.uk/living/2020/03/12/face-masks-could-put-wearers-at-increased-risk-of-coronavirus-t/","https://www.aol.co.uk/amp/2020/03/12/face-masks-could-put-wearers-at-increased-risk-of-coronavirus-t/","2020-03-12 15:00:00","Face masks could put wearers at increased risk of coronavirus , top medic warns"
"http://www.dailypress.com/virginiagazette/news/va-vg-vp-nw-coronavirus-questions-answered-20200312-kfolcfdumfduxiymoldutlbokq-story.html","https://www.dailypress.com/virginiagazette/news/va-vg-vp-nw-coronavirus-questions-answered-20200312-kfolcfdumfduxiymoldutlbokq-story.html?outputType=amp","2020-03-12 15:00:00","Answers to your questions about the coronavirus in Hampton Roads"
"http://www.techtimes.com/articles/247972/20200311/beware-face-masks-amazon-labeled-based-usa-manufactured-wuhan-china.htm","https://www.techtimes.com/amp/articles/247972/20200311/beware-face-masks-amazon-labeled-based-usa-manufactured-wuhan-china.htm","2020-03-12 10:30:00","Beware ! Face Masks from Amazon Labeled  Based in united states  are Manufactured in WUHAN CHINA ! "
"http://www.jamaicaobserver.com/news/-use-covid-19-logo-see-tuesday-paper-_189271?profile=1470","http://amp.jamaicaobserver.com/news/-use-covid-19-logo-see-tuesday-paper-_189271?profile=1470","2020-03-12 05:45:00","How likely am I to catch COVID - 19 ? "
"https://www.diariolibre.com/actualidad/salud/medidas-que-recomienda-oms-para-cuidarse-del-covid-19-OC17626594","https://m.diariolibre.com/actualidad/salud/medidas-que-recomienda-oms-para-cuidarse-del-covid-19-OC17626594?amp=1","2020-03-12 03:30:00","Medidas que recomienda OMS para cuidarse del COVID - 19"
"https://www.indiatvnews.com/news/india/coronavirus-in-india-update-vaccine-health-ministry-597477","https://www.indiatvnews.com/amp/news/india/coronavirus-in-india-update-vaccine-health-ministry-597477","2020-03-12 11:00:00","Coronavirus difficult to isolate , developing vaccine may take up to 2 yrs : Health Ministry"
"https://www.newsfirst.lk/2020/03/12/coronavirus-at-a-glance-infographic/","https://www.newsfirst.lk/2020/03/12/coronavirus-at-a-glance-infographic/amp/","2020-03-12 12:30:00","Coronavirus at a Glance : Infographic - Myth vs . Fact"
"https://www.laprensagrafica.com/farandula/Siempre-fashion-nunca-infashion-Naomi-Campbell-y-la-moda-en-los-tiempos-de-coronavirus-20200311-0052.html","https://www.laprensagrafica.com/amp/farandula/Siempre-fashion-nunca-infashion-Naomi-Campbell-y-la-moda-en-los-tiempos-de-coronavirus-20200311-0052.html","2020-03-12 01:00:00"," ¿ Siempre fashion nunca infashion ? Naomi Campbell y la moda en los tiempos de coronavirus"
"https://www.thesun.co.uk/sport/11162149/man-city-star-benjamin-mendy-coronavirus-medics/","https://www.thesun.co.uk/sport/11162149/man-city-star-benjamin-mendy-coronavirus-medics/amp/","2020-03-13 00:00:00","Man City star Benjamin Mendy checked by coronavirus medics in hazmat suits after family member falls ill"
"http://www.xinhuanet.com/english/2020-03/12/c_138867812.htm","","2020-03-12 14:30:00","Senegal reports its 5th confirmed case of COVID - 19 - Xinhua"
"https://www.stamfordadvocate.com/news/article/Here-s-what-you-should-do-if-you-already-have-the-15127652.php","https://m.stamfordadvocate.com/news/article/Here-s-what-you-should-do-if-you-already-have-the-15127652.php","2020-03-13 00:00:00","Here what you should do if you already have the coronavirus"
"https://www.usatoday.com/story/news/nation/2020/03/12/too-much-coronavirus-news-here-baby-animal-pictures-you-need/5032859002/","https://amp.usatoday.com/amp/5032859002","2020-03-12 19:30:00","Too much coronavirus news ? Here are the baby animal pictures you need"
"https://www.news.com.au/entertainment/celebrity-life/coronavirus-gwyneth-paltrow-face-mask-sells-out-despite-health-advice/news-story/7bf04021d5d0a37cc051c13608d1c1a6","https://amp.news.com.au/entertainment/celebrity-life/coronavirus-gwyneth-paltrow-face-mask-sells-out-despite-health-advice/news-story/7bf04021d5d0a37cc051c13608d1c1a6","2020-03-12 11:45:00","Coronavirus : Gwyneth Paltrow face mask sells out despite health advice"
"https://www.azcentral.com/story/news/nation/2020/03/12/too-much-coronavirus-news-here-baby-animal-pictures-you-need/5032859002/","https://amp.azcentral.com/amp/5032859002","2020-03-12 19:30:00","Too much coronavirus news ? Here are the baby animal pictures you need"
"https://international.thenewslens.com/article/132385","https://international.thenewslens.com/amparticle/132385","2020-03-12 07:00:00","Not Just Coronavirus : Asians Have Worn Face Masks for Decades - The News Lens International Edition"
"https://www.koat.com/article/heres-what-you-should-do-if-you-already-have-the-coronavirus/31451988","https://www.koat.com/amp/article/heres-what-you-should-do-if-you-already-have-the-coronavirus/31451988","2020-03-13 00:00:00","Here what you should do if you already have the coronavirus"
"https://patch.com/new-jersey/newarknj/coronavirus-newark-beth-israel-hospital-changes-visitor-policy","https://patch.com/new-jersey/newarknj/amp/28632033/coronavirus-newark-beth-israel-hospital-changes-visitor-policy","2020-03-12 17:30:00","Coronavirus : Newark Beth Israel Hospital Changes Visitor Policy"
"https://www.dailydot.com/unclick/italian-man-pasta-shortage-coronavirus/","https://www.dailydot.com/unclick/italian-man-pasta-shortage-coronavirus/?amp","2020-03-12 06:00:00","Old Italian Man Upset About Pasta Shortage Amid Coronavirus Goes Viral"
"https://www.standard.co.uk/news/health/coronavirus-uk-infected-5000-to-1000-britons-a4386001.html","https://www.standard.co.uk/news/health/coronavirus-uk-infected-5000-to-1000-britons-a4386001.html?amp","2020-03-12 18:00:00","Coronavirus infects 5 , 000 to 10 , 000 people in the united kingdom "
"https://www.kcci.com/article/heres-what-you-should-do-if-you-already-have-the-coronavirus/31451988","https://www.kcci.com/amp/article/heres-what-you-should-do-if-you-already-have-the-coronavirus/31451988","2020-03-12 23:45:00","Here what you should do if you already have the coronavirus"
"https://www.breakingnews.ie/world/face-masks-could-put-wearers-at-increased-risk-of-coronavirus-top-medic-warns-987527.html","","2020-03-12 15:15:00","Face masks could put wearers at increased risk of coronavirus , top medic warns"
"https://www.nhregister.com/news/article/Here-s-what-you-should-do-if-you-already-have-the-15127652.php","","2020-03-13 00:00:00","Here what you should do if you already have the coronavirus"
"https://www.expressandstar.com/news/uk-news/2020/03/12/face-masks-could-put-wearers-at-increased-risk-of-coronavirus-top-medic-warns/","","2020-03-12 19:15:00","Face masks could put wearers at increased risk of coronavirus , top medic warns"
"https://www.20minutos.es/noticia/4185608/0/piden-no-poner-mascarillas-perros-no-riesgo-de-contagio-coronavirus/","https://amp.20minutos.es/noticia/4185608/0/piden-no-poner-mascarillas-perros-no-riesgo-de-contagio-coronavirus/","2020-03-12 17:00:00","Piden evitar poner mascarillas a los perros porque les estresa y no pueden transmitir ni padecer el coronavirus"
"https://www.nbcnews.com/health/health-news/what-new-coronavirus-n1119081?cid=public-rss_20200312","https://www.nbcnews.com/news/amp/ncna1119081","2020-03-12 02:45:00","What is the coronavirus ? Here what we know about it . "
"https://www.eveningexpress.co.uk/news/uk/face-masks-could-put-wearers-at-increased-risk-of-coronavirus-top-medic-warns/","https://www.eveningexpress.co.uk/news/uk/face-masks-could-put-wearers-at-increased-risk-of-coronavirus-top-medic-warns/amp/","2020-03-12 15:00:00","Face masks could put wearers at increased risk of coronavirus , top medic warns"
"https://www.couriermail.com.au/entertainment/celebrity/coronavirus-gwyneth-paltrow-face-mask-sells-out-despite-health-advice/news-story/7bf04021d5d0a37cc051c13608d1c1a6?nk=db8ce7816bc18c121822370cc63972a6-1584016354","https://amp.couriermail.com.au/entertainment/celebrity/coronavirus-gwyneth-paltrow-face-mask-sells-out-despite-health-advice/news-story/7bf04021d5d0a37cc051c13608d1c1a6","2020-03-12 12:45:00","Coronavirus : Gwyneth Paltrow face mask sells out despite health advice"
"https://www.couriermail.com.au/entertainment/celebrity/coronavirus-gwyneth-paltrow-face-mask-sells-out-despite-health-advice/news-story/7bf04021d5d0a37cc051c13608d1c1a6?nk=b934c755477bb13c88ff1a428b67b530-1584014663","https://amp.couriermail.com.au/entertainment/celebrity/coronavirus-gwyneth-paltrow-face-mask-sells-out-despite-health-advice/news-story/7bf04021d5d0a37cc051c13608d1c1a6","2020-03-12 12:15:00","Coronavirus : Gwyneth Paltrow face mask sells out despite health advice"
"https://www.couriermail.com.au/entertainment/celebrity/coronavirus-gwyneth-paltrow-face-mask-sells-out-despite-health-advice/news-story/7bf04021d5d0a37cc051c13608d1c1a6?nk=9b1ab447a7afc80e09809b091edde735-1584012904","https://amp.couriermail.com.au/entertainment/celebrity/coronavirus-gwyneth-paltrow-face-mask-sells-out-despite-health-advice/news-story/7bf04021d5d0a37cc051c13608d1c1a6","2020-03-12 11:45:00","Coronavirus : Gwyneth Paltrow face mask sells out despite health advice"
"https://www.standard.co.uk/showbiz/celebrity-news/mulan-european-premiere-cancelled-a4385681.html","https://www.standard.co.uk/showbiz/celebrity-news/mulan-european-premiere-cancelled-a4385681.html?amp","2020-03-12 14:00:00","Disney scales back European premiere of Mulan over coronavirus"
"https://www.standard.co.uk/news/world/donald-trump-leo-varadkar-namaste-greeting-coronavirus-a4386111.html","https://www.standard.co.uk/news/world/donald-trump-leo-varadkar-namaste-greeting-coronavirus-a4386111.html?amp","2020-03-12 21:30:00","Donald Trump and Leo Varadkar greet with namaste gesture amid coronavirus outbreak"
"https://www.shropshirestar.com/news/uk-news/2020/03/12/face-masks-could-put-wearers-at-increased-risk-of-coronavirus-top-medic-warns/","","2020-03-12 15:45:00","Face masks could put wearers at increased risk of coronavirus , top medic warns"
"https://www.elmundo.es/comunidad-valenciana/castellon/2020/03/12/5e693e6afc6c83573b8b474a.html","https://amp.elmundo.es/comunidad-valenciana/castellon/2020/03/12/5e693e6afc6c83573b8b474a.html","2020-03-12 08:15:00","Coronavirus : Una única mascarilla a compartir entre seis hermanos para cuidar a su madre en el hospital"
"https://www.adelaidenow.com.au/entertainment/celebrity/coronavirus-gwyneth-paltrow-face-mask-sells-out-despite-health-advice/news-story/7bf04021d5d0a37cc051c13608d1c1a6?nk=b59e702f8acf60593912a6563308babe-1584020028","https://amp.adelaidenow.com.au/entertainment/celebrity/coronavirus-gwyneth-paltrow-face-mask-sells-out-despite-health-advice/news-story/7bf04021d5d0a37cc051c13608d1c1a6","2020-03-12 13:45:00","Coronavirus : Gwyneth Paltrow face mask sells out despite health advice"
"https://www.adelaidenow.com.au/entertainment/celebrity/coronavirus-gwyneth-paltrow-face-mask-sells-out-despite-health-advice/news-story/7bf04021d5d0a37cc051c13608d1c1a6?nk=219865fea6fb6896945ebde86e23c809-1584013739","https://amp.adelaidenow.com.au/entertainment/celebrity/coronavirus-gwyneth-paltrow-face-mask-sells-out-despite-health-advice/news-story/7bf04021d5d0a37cc051c13608d1c1a6","2020-03-12 12:00:00","Coronavirus : Gwyneth Paltrow face mask sells out despite health advice"
"https://www.newsweek.com/2020/03/27/past-pandemics-numbers-how-coronavirus-fits-1491794.html","https://www.newsweek.com/2020/03/27/past-pandemics-numbers-how-coronavirus-fits-1491794.html?amp=1","2020-03-12 11:30:00","Past Pandemics By The Numbers and How Coronavirus Fits In"
"https://590kqnt.iheart.com/content/2020-03-11-coronavirus-covid-19-cancellations-and-postponements/","","2020-03-12 00:30:00","Coronavirus / COVID - 19 : Cancellations and Postponements"
"https://kube1049.iheart.com/content/2020-03-02-coronavirus-covid-19-what-you-need-to-know/","","2020-03-12 22:15:00","Coronavirus COVID - 19 : SeattleTacoma Area Cancellations and Postponements"
"https://www.salisburyjournal.co.uk/news/national/18301435.face-masks-put-wearers-increased-risk-coronavirus-top-medic-warns/","","2020-03-12 14:30:00","Face masks could put wearers at increased risk of coronavirus , top medic warns"
"https://www.msn.com/en-au/money/career/australian-workers-are-told-to-stay-home-if-they-feel-sick-as-the-number-of-coronavirus-cases-jump-141-across-the-country/ar-BB113QZY","","2020-03-12 00:15:00","Australian workers are told to STAY HOME if they feel sick as the number of coronavirus cases jump 141 across the country"
"https://entertainment.inquirer.net/367714/luis-manzano-urges-public-to-practice-proper-etiquette-amid-covid-19-outbreak","https://entertainment.inquirer.net/367714/luis-manzano-urges-public-to-practice-proper-etiquette-amid-covid-19-outbreak/amp","2020-03-12 05:15:00","Manzano : Take care of each other amid COVID - 19 | Inquirer Entertainment"
"https://www.standard.co.uk/news/uk/coronavirus-cleaning-group-protect-essex-germ-hotspots-a4385286.html","https://www.standard.co.uk/news/uk/coronavirus-cleaning-group-protect-essex-germ-hotspots-a4385286.html?amp","2020-03-12 12:15:00","Chigwell residents join forces to form coronavirus cleaning group to disinfect germ hotspots and  protect Essex  "
"https://www.standard.co.uk/news/health/doctor-simon-ashworth-outrage-uk-coronavirus-response-a4385391.html","https://www.standard.co.uk/news/health/doctor-simon-ashworth-outrage-uk-coronavirus-response-a4385391.html?amp","2020-03-12 12:15:00","Wake up , ministers ! Top doctor vents fury at  slow reaction  to coronavirus outbreak"
"https://www.standard.co.uk/news/health/paramedic-tests-positive-coronavirus-uk-cases-a4385406.html","https://www.standard.co.uk/news/health/paramedic-tests-positive-coronavirus-uk-cases-a4385406.html?amp","2020-03-12 12:15:00","Paramedic tests positive for coronavirus as united kingdom outbreak continues to spread"
"https://www.standard.co.uk/news/uk/ftse-100-second-worst-day-stock-markets-coronavirus-a4386121.html","https://www.standard.co.uk/news/uk/ftse-100-second-worst-day-stock-markets-coronavirus-a4386121.html?amp","2020-03-12 21:30:00","FTSE 100 drops by 10 . 9 per cent in second worst day in stock market history"
"https://patch.com/new-jersey/livingston/coronavirus-throws-monkey-wrench-new-jersey-court-system","https://patch.com/new-jersey/livingston/amp/28633865/coronavirus-throws-monkey-wrench-new-jersey-court-system","2020-03-12 22:30:00","Coronavirus Throws Monkey Wrench Into New Jersey Court System"
"https://www.gocomics.com/tomtoles/2020/03/12","","2020-03-12 12:45:00","Tom Toles for March 12 , 2020"
"https://www.limaohio.com/news/401937/todays-latest-updates-on-the-coronavirus-pandemic-2","","2020-03-12 23:45:00","Today latest updates on the coronavirus pandemic"
"https://thenewdaily.com.au/news/2020/03/12/coronavirus-facts-checked/","https://thenewdaily.com.au/news/2020/03/12/coronavirus-facts-checked/amp/","2020-03-12 15:15:00","Coronavirus symptoms myths busted – and the truth about toilet paper"
