URL,MobileURL,Date,Title
"https://www.wprost.pl/prime-time/10296012/rozenek-majdan-podrozowala-w-masce-ochronnej-w-zwiazku-z-szalejacym-wirusem.html","","2020-02-06 10:00:00","Rozenek - Majdan podróżowała w masce ochronnej . Pokazała na Instagramie"
"https://vsluh.ru:443/news/health/351100","","2020-02-06 10:15:00","Специалисты назвали пять основных правил , как защитить себя от вируса"
"https://www.liputan6.com/bisnis/read/4172562/daftar-harga-barang-yang-naik-imbas-virus-corona-apa-saja","https://m.liputan6.com/amp/4172562/daftar-harga-barang-yang-naik-imbas-virus-corona-apa-saja","2020-02-06 04:45:00","Daftar Harga Barang yang Naik Imbas Virus Corona , Apa Saja ? "
"https://informpskov.ru/news/314885.html","","2020-02-06 20:00:00","ВОЗ о китайском коронавирусе : Мы боремся с тенью"
"http://www.ecns.cn/business/2020-02-06/detail-ifztmcih6510426.shtml","","2020-02-06 07:00:00","Mask makers go all out in fight against novel coronavirus"
"https://www.topky.sk/cl/1003165/1859157/Koronavirus-sa-siri-sialenou-rychlostou--Muz-sa-mal-nakazit-od-zeny-iba-za-15-sekund-","https://m.topky.sk/cl/1003165/1859157/Koronavirus-sa-siri-sialenou-rychlostou--Muz-sa-mal-nakazit-od-zeny-iba-za-15-sekund-","2020-02-06 21:30:00","Koronavírus sa šíri šialenou rýchlosťou : Muž sa mal nakaziť od ženy iba za 15 sekúnd ! "
"https://www.24heures.ch/suisse/suisse-romande/Coronavirus-l-aeroport-informe-les-voyageurs-arrives-de-Chine/story/29074699","","2020-02-06 20:30:00","Genève : Coronavirus : laéroport informe les voyageurs arrivés de Chine - News Suisse : Suisse romande"
"https://www.24heures.ch/suisse/suisse-romande/coronavirus-aeroport-informe-voyageurs-arrives-chine/story/29074699","","2020-02-06 20:30:00","Genève : Coronavirus : laéroport informe les voyageurs arrivés de Chine - News Suisse : Suisse romande"
"https://www.msn.com/en-us/health/medical/2-newborns-among-28000-coronavirus-cases-as-death-toll-grows/ar-BBZIomK","","2020-02-06 16:00:00","2 newborns among 28 , 000 coronavirus cases as death toll grows"
"https://haqqin.az/news/169430","https://amp.haqqin.az/news/169430","2020-02-06 15:30:00","Ухань превратился в город - призрак - видео"
"https://www.lbc.co.uk/news/british-chinese-people-discrimination-coronavirus/","https://amp.lbc.co.uk/news/british-chinese-people-discrimination-coronavirus/","2020-02-06 01:30:00","British - Chinese people tell of  discrimination  and hate as fears rise over coronavirus"
"https://www.lbc.co.uk/news/british-chinese-people-tell-of-discrimination-and/","https://amp.lbc.co.uk/news/british-chinese-people-tell-of-discrimination-and/","2020-02-06 01:30:00","British - Chinese people tell of  discrimination  and hate as fears rise over coronavirus"
"https://www.midilibre.fr/2020/02/06/coronavirus-les-drones-deversent-un-liquide-desinfectant-sur-des-villes-de-chine,8714448.php","https://www.midilibre.fr/amp/2020/02/06/coronavirus-les-drones-deversent-un-liquide-desinfectant-sur-des-villes-de-chine,8714448.php","2020-02-06 14:00:00","Coronavirus : les drones déversent un liquide désinfectant sur des villes de Chine"
"https://www.moroccoworldnews.com/2020/02/293042/morocco-arrests-man-for-spreading-rumors-on-coronavirus-outbreak/","https://www.moroccoworldnews.com/2020/02/293042/morocco-arrests-man-for-spreading-rumors-on-coronavirus-outbreak/amp/","2020-02-06 23:00:00","Morocco Arrests Man for Spreading Rumors on Coronavirus Outbreak"
"https://www.thechronicle.com.au/news/nurse-flown-in-to-test-coal-carrier-crew-for-virus/3938174/","","2020-02-06 06:30:00","Nurse flown in to test coal carrier crew for virus"
"https://www.financialexpress.com/lifestyle/health/coronavirus-china-death-toll-rises-to-563-total-cases-cross-28000/1858063/","https://www.financialexpress.com/lifestyle/health/coronavirus-china-death-toll-rises-to-563-total-cases-cross-28000/1858063/lite/","2020-02-06 05:15:00","Coronavirus : China death toll rises to 563 , total cases cross 28 , 000"
"https://www.straitstimes.com/lifestyle/coronavirus-netizens-create-memes-mask-wearing-stickers-and-nicknames-for-forklifts-used","","2020-02-06 03:45:00","Coronavirus : Netizens create memes , mask - wearing stickers and nicknames for forklifts used to build Wuhan hospitals"
"http://www.koreaherald.com/view.php?ud=20200206000512","http://m.koreaherald.com/view.php?ud=20200206000512","2020-02-06 08:30:00"," [ Editorial ] Flawed system"
"http://nwww.koreaherald.com/view.php?ud=20200206000512","http://m.koreaherald.com/view.php?ud=20200206000512","2020-02-06 11:30:00"," [ Editorial ] Flawed system"
"https://www.jacarandafm.com/shows/scenic-drive-rian/watch-influencer-forces-emergency-landing-after-pretending-have-coronavirus/","","2020-02-06 16:00:00","WATCH : Influencer forces emergency landing after pretending to have the coronavirus"
"https://www.sunshinecoastdaily.com.au/news/nurse-flown-in-to-test-coal-carrier-crew-for-virus/3938174/","","2020-02-06 06:15:00","Nurse flown in to test coal carrier crew for virus"
"https://pl.sputniknews.com/swiat/2020020611888117-Sputnik-who-spadek-liczby-zachorowan-koronawirus-sputnik/","https://pl.sputniknews.com/amp/swiat/2020020611888117-Sputnik-who-spadek-liczby-zachorowan-koronawirus-sputnik/","2020-02-06 23:30:00","WHO ma dobre wiadomości ws . koronawirusa"
"http://www.angop.ao/angola/pt_pt/noticias/internacional/2020/1/6/Registado-China-caso-transmissao-coronavirus-segundos,117a41a8-77d2-42c7-88bf-453aad7f313a.html","","2020-02-06 20:00:00","Registado na China caso de transmissão de coronavírus em 50 segundos"
"https://www.lemonde.fr/afrique/article/2020/02/06/l-afrique-du-sud-en-etat-d-alerte-face-a-la-menace-du-coronavirus_6028690_3212.html","","2020-02-06 18:45:00","LAfrique du Sud en état dalerte face à la menace du coronavirus"
"https://regnum.ru/news/society/2850584.html","","2020-02-06 07:00:00","Роспотребнадзор назвал пять основных правил профилактики коронавироуса"
"https://www.lbc.co.uk/news/third-uk-patient-confirmed-to-have-coronavirus/","https://amp.lbc.co.uk/news/third-uk-patient-confirmed-to-have-coronavirus/","2020-02-06 16:00:00","Third united kingdom patient confirmed to have coronavirus"
"https://people.com/health/australia-nightclub-apologizes-corona-themed-chinese-new-year-party/","https://people.com/health/australia-nightclub-apologizes-corona-themed-chinese-new-year-party/amp/","2020-02-06 21:30:00","Nightclub Apologizes for Promoting  Corona Chinese New Year  Party During Virus Outbreak"
"https://mainichi.jp/english/articles/20200206/p2a/00m/0na/006000c","","2020-02-06 04:30:00","Criticism of reselling apps heats up in Japan as virus fears cause mask shortages"
"https://www.msn.com/en-us/health/medical/coronavirus-deaths-top-560-as-cases-exceed-28000/ar-BBZIomK","","2020-02-06 19:15:00","Coronavirus deaths top 560 as cases exceed 28 , 000"
"https://e.vnexpress.net/news/news/2019-ncov-roundup-vietnam-steps-up-vigilance-preparations-4049906.html","https://ampe.vnexpress.net/news/news/2019-ncov-roundup-vietnam-steps-up-vigilance-preparations-4049906.html","2020-02-06 01:15:00","2019 - nCoV roundup : Vietnam steps up vigilance , preparations - VnExpress International"
"https://ren.tv/news/v-mire/657696-v-kitae-gorod-dali-perekhvatil-zashchitnye-maski-dlia-drugogo-goroda","","2020-02-06 13:30:00","В Китае город Дали перехватил защитные маски для другого города"
"https://ura.news/news/1052417809","{{ (metaService && metaService.ampUrl()) ? metaService.ampUrl() : https://amp.ura.news/news/1052417809 }}","2020-02-06 10:45:00","Власти ХМАО поддержали россиян , эвакуированных из Китая"
"https://ura.news/news/1052417809?story_id=651","{{ (metaService && metaService.ampUrl()) ? metaService.ampUrl() : https://amp.ura.news/news/1052417809 }}","2020-02-06 10:45:00","Власти ХМАО поддержали россиян , эвакуированных из Китая"
"https://24tv.ua/health/ru/umer_vrach_kotorogo_hoteli_arestovat_za_preduprezhdenie_o_koronaviruse_n1276574","https://24tv.ua/health/ru/umer_vrach_kotorogo_hoteli_arestovat_za_preduprezhdenie_o_koronaviruse_n1276574/amp","2020-02-06 17:15:00","Умер врач , которого хотели арестовать за предупреждение о коронавирусе - Новости здоровья"
"https://technode.com/2020/02/06/e-commerce-firms-cracking-down-on-sellers-of-fake-protective-masks/","","2020-02-06 08:15:00","E - commerce firms cracking down on sellers of fake protective masks · TechNode"
"https://www.msn.com/en-us/news/world/reuters-health-news-summary/ar-BBZIAR1","","2020-02-06 13:30:00","Reuters Health News Summary"
"https://www.noticiasaominuto.com/mundo/1408977/registado-na-china-caso-de-transmissao-de-coronavirus-em-50-segundos","","2020-02-06 18:30:00","Registado na China caso de transmissão de coronavírus em 50 segundos"
"https://www.kp.ru/daily/27088.4/4160637/","https://amp.kp.ru/daily/27088.4/4160637/","2020-02-06 15:45:00","Пассажиры карантинного лайнера вывешивают простыни с надписью « Хотим алкоголя » и « Америка , спаси нас » "
"https://www.fool.com/investing/2020/02/06/why-51job-shares-dropped-15-last-month.aspx","https://www.fool.com/amp/investing/2020/02/06/why-51job-shares-dropped-15-last-month.aspx","2020-02-06 14:00:00","Why 51job Shares Dropped 15 % Last Month"
"https://www.fool.com/investing/2020/02/06/why-51job-shares-dropped-15-last-month.aspx?source=iedfolrf0000001","https://www.fool.com/amp/investing/2020/02/06/why-51job-shares-dropped-15-last-month.aspx","2020-02-06 15:00:00","Why 51job Shares Dropped 15 % Last Month"
"https://www.publico.es/videos/837112/el-coronavirus-de-wuhan-se-cobra-ya-la-vida-de-mas-de-medio-millar-de-personas","https://m.publico.es/redirect/publicotv/videos/837112/el-coronavirus-de-wuhan-se-cobra-ya-la-vida-de-mas-de-medio-millar-de-personas/amp","2020-02-06 11:00:00","El coronavirus de Wuhan se cobra ya la vida de más de medio millar de personas"
"https://noticias.uol.com.br/saude/ultimas-noticias/redacao/2020/02/06/mandetta-vacinacao-contra-gripe-pode-ajudar-em-suspeitas-de-coronavirus.htm","https://noticias.uol.com.br/saude/ultimas-noticias/redacao/2020/02/06/mandetta-vacinacao-contra-gripe-pode-ajudar-em-suspeitas-de-coronavirus.amp.htm","2020-02-06 16:45:00","Coronavírus : Vacina contra a gripe pode ajudar a identificar casos suspeitos , diz Mandetta"
"https://in.news.yahoo.com/coronavirus-reports-suggests-death-toll-081213252.html","https://in.news.yahoo.com/amphtml/coronavirus-reports-suggests-death-toll-081213252.html","2020-02-06 08:45:00","Coronavirus Update : Reports suggests death toll close to 25 , 000 , over 1 . 54 lakh people infected"
"https://www.worldofbuzz.com/mothers-may-pass-wuhan-coronavirus-to-unborn-children-in-their-womb-say-doctors/","","2020-02-06 00:45:00","Mothers May Pass Wuhan Coronavirus To Unborn Children In Their WOMB , Say Doctors"
"http://www.msn.com/en-us/news/world/an-instagram-personality-suggested-he-had-coronavirus-on-a-plane-the-viral-stunt-got-him-arrested/ar-BBZGZP8","","2020-02-06 06:45:00","An Instagram personality suggested he had coronavirus on a plane . The viral stunt got him arrested . "
"https://ru.euronews.com/2020/02/06/coronavirus-china-automakers-around-the-world-counting-losses","/amp/2020/02/06/coronavirus-china-automakers-around-the-world-counting-losses","2020-02-07 00:00:00","Коронавирус : автопроизводители подсчитывают убытки"
"https://www.iol.co.za/travel/travel-news/instagrammer-apologises-for-coronavirus-plane-prank-42192741","","2020-02-06 10:00:00","Instagrammer apologises for coronavirus plane prank"
"https://nationalpost.com/news/canada/an-instagram-personality-said-he-had-coronavirus-on-a-plane-the-failed-viral-stunt-got-him-arrested","https://nationalpost.com/news/canada/an-instagram-personality-said-he-had-coronavirus-on-a-plane-the-failed-viral-stunt-got-him-arrested/amp","2020-02-06 15:30:00","An Instagram personality said he had coronavirus on a plane . The failed viral stunt got him arrested"
"https://tass.ru/obschestvo/7702047","https://tass.ru/obschestvo/7702047/amp","2020-02-06 13:30:00","Time поместил на обложку изображение Си Цзиньпина в медицинской маске"
"https://rg.ru/2020/02/06/reg-dfo/na-dalnem-vostoke-iz-za-koronavirusa-rezko-podorozhali-ovoshchi.html","https://rg.ru/amp/2020/02/06/reg-dfo/na-dalnem-vostoke-iz-za-koronavirusa-rezko-podorozhali-ovoshchi.html","2020-02-06 03:00:00","На Дальнем Востоке из - за коронавируса резко подорожали овощи"
"https://www.jn.pt/nacional/cidadaos-que-estavam-no-parque-saude-de-lisboa-foram-transferidos-para-hospital-11794330.html","https://www.jn.pt/nacional/amp/cidadaos-que-estavam-no-parque-saude-de-lisboa-foram-transferidos-para-hospital-11794330.html","2020-02-06 20:30:00","Cidadãos que estavam no Parque Saúde de Lisboa foram transferidos para hospital"
"https://govoritmoskva.ru/news/224107/","","2020-02-06 14:45:00","Оперштаб проведёт заседание для рассмотрения ситуации с завышением аптеками цен"
"https://www.globalsecurity.org/security/library/news/2020/02/sec-200205-kcna01.htm","","2020-02-06 10:15:00","DPRK Takes Measures to Check Novel Coronavirus Infection"
"https://www.tnp.sg/news/singapore/long-queues-toto-outlets-despite-virus-outbreak","","2020-02-06 23:15:00","Long queues at Toto outlets despite virus outbreak"
"https://www.asiaone.com/china/why-china-grips-facial-mask-shortage-coronavirus-death-toll-grows","http://www.asiaone.com/china/why-china-grips-facial-mask-shortage-coronavirus-death-toll-grows?amp","2020-02-06 04:45:00","Why China is in the grips of a facial mask shortage as coronavirus death toll grows"
"https://www.aninews.in/news/lifestyle/quirky/self-styled-artist-causes-panic-on-flight-after-faking-coronavirus-infection20200206222913/","/news/lifestyle/quirky/self-styled-artist-causes-panic-on-flight-after-faking-coronavirus-infection20200206222913/?amp=1","2020-02-06 18:00:00","Self - styled  artist  causes panic on flight after faking coronavirus infection"
"https://www.amur.info/news/2020/02/06/167500","","2020-02-06 03:15:00","Путин поручил отбирать лицензии у аптек , завышающих цены на фоне коронавируса"
"https://www.1tv.ru/news/2020-02-06/380094-na_volne_borby_s_koronavirusom_v_nekotoryh_aptekah_vyrosli_tseny_na_lekarstva_i_meditsinskie_maski","","2020-02-06 20:45:00","На волне борьбы с коронавирусом в некоторых аптеках выросли цены на лекарства и медицинские маски . Новости . Первый канал"
"https://www.1tv.ru/news/2020-02-06/380094-na_volne_borby_s_koronavirusom_v_nekotoryh_aptekah_vyrosli_tseny_na_protivovirusnye_preparaty_i_meditsinskie_maski","","2020-02-06 18:45:00","На волне борьбы с коронавирусом в некоторых аптеках выросли цены на противовирусные препараты и медицинские маски . Новости . Первый канал"
"https://ura.news/news/1052417765","{{ (metaService && metaService.ampUrl()) ? metaService.ampUrl() : https://amp.ura.news/news/1052417765 }}","2020-02-06 09:30:00","В ХМАО из - за коронавируса под наблюдением врачей находятся больше 50 человек"
"https://www.thenews.com.pk/print/609626-pharmacies-profiteering-from-coronavirus-will-be-shut-putin","https://www.thenews.com.pk/amp/609626-pharmacies-profiteering-from-coronavirus-will-be-shut-putin","2020-02-06 06:45:00","Pharmacies profiteering from coronavirus will be shut : Putin"
"https://novayagazeta.ru/articles/2020/02/06/83798-svoih-ne-brosaem","","2020-02-06 17:00:00","Своих не бросаем ? "
"https://www.nst.com.my/news/nation/2020/02/563209/mr-diy-giving-away-free-face-masks-nationwide","//www.nst.com.my/node/563209/amp","2020-02-06 16:30:00","Mr DIY giving away free face masks nationwide"
"https://www.sfgate.com/entertainment/article/Why-an-Aspiring-Rapper-and-Many-Others-Are-15035893.php","https://m.sfgate.com/entertainment/article/Why-an-Aspiring-Rapper-and-Many-Others-Are-15035893.php","2020-02-06 20:30:00","Why an Aspiring Rapper ( and Many Others ) Are Pretending to Have Coronavirus"
"https://newsinfo.inquirer.net/1225181/coronavirus-hate-crime-woman-with-face-mask-attacked-allegedly-called-diseased","https://newsinfo.inquirer.net/1225181/coronavirus-hate-crime-woman-with-face-mask-attacked-allegedly-called-diseased/amp","2020-02-06 10:45:00","Woman with face mask attacked in New York"
"https://lb.ua/society/2020/02/06/449127_bez_koroni_hto_taki_virusi_zvidki.html","","2020-02-06 12:45:00","Без корони . Хто такі віруси та звідки вони з  являються ? - портал новостей LB . ua"
"https://www.msn.com/en-us/finance/markets/despite-coronavirus-fears-a-fast-recovery-is-predicted-for-your-401k-plan/ar-BBZJeVw","","2020-02-06 19:15:00","Despite coronavirus fears , a fast recovery is predicted for your 401 ( k ) plan"
"https://ria.ru/20200206/1564357509.html","https://ria.ru/amp/20200206/1564357509.html","2020-02-06 13:15:00","В Китае город Дали перехватил защитные маски , направленные в Чунцин"
"https://allafrica.com/stories/202002060778.html","","2020-02-06 18:30:00","Mozambique : Health Service On Maximum Alert Against Coronavirus"
"https://theprovince.com/news/canada/an-instagram-personality-said-he-had-coronavirus-on-a-plane-the-failed-viral-stunt-got-him-arrested/wcm/cfda8ef6-d8a7-41c6-8827-90a8df95d9b2","https://theprovince.com/news/canada/an-instagram-personality-said-he-had-coronavirus-on-a-plane-the-failed-viral-stunt-got-him-arrested/wcm/cfda8ef6-d8a7-41c6-8827-90a8df95d9b2/amp","2020-02-06 19:00:00","An Instagram personality said he had coronavirus on a plane . The failed viral stunt got him arrested"
